[27.05.2025, 15:46:39] ~Yuriy_R: Виталя привет. Как дела? У нас есть камеры на пилоте в КазАвтожоле сейчас. Они хотятпопробовать вашу ДЗК аналитику. Она у вас есть ACAP?
[27.05.2025, 15:51:07] Vitalii Kazymyrovych: Привет. Что такое ДЗК?
[27.05.2025, 15:51:28] ~Yuriy_R: LPR🤦‍♂️
[27.05.2025, 15:51:31] ~Yuriy_R: T9
[27.05.2025, 15:51:32] Vitalii Kazymyrovych: АХхахахахх
[27.05.2025, 15:51:48] Vitalii Kazymyrovych: Да, LPR есть)
[27.05.2025, 15:51:58] ~Yuriy_R: Demo как можно получить?
[27.05.2025, 15:52:03] ~Yuriy_R: Как нибудь
[27.05.2025, 15:52:12] Vitalii Kazymyrovych: Зарегистрируй проект в партнерском кабинете. Я смогу выдать тестовые лицензии.
[27.05.2025, 15:52:21] ~Yuriy_R: Ок. Ща сделаю
[27.05.2025, 16:07:29] Vitalii Kazymyrovych: Только поставить мы сможем на следующей неделе. У нас сейчас есть оптимизированная версия под Мексику, но под страны СНГ еще нужно дорабатывать.
[27.05.2025, 16:12:11] ~Yuriy_R: Окей
‎[27.05.2025, 16:12:53] ~Yuriy_R: ‎<attached: 00000078-AUDIO-2025-05-27-16-12-53.opus>
[27.05.2025, 16:18:00] Vitalii Kazymyrovych: Надо уточнять. Позже вернусь с ответом.
[27.05.2025, 17:46:27] Vitalii Kazymyrovych: Возвращаюсь. В данный момент интеграции с радаром нет, начнем разработку в июле.
[27.05.2025, 17:49:11] ~Yuriy_R: Ох печально
[27.05.2025, 19:06:07] Vitalii Kazymyrovych: Слушай, у нас классно работает FR. Клиенты прямо очень хвалят. И его не нужно дорабатывать под отдельные страны.

У вас есть клиенты с запросом на распознавание лиц, с которыми можно провести демку?
‎[27.05.2025, 19:07:22] ~Yuriy_R: ‎<attached: 00000083-AUDIO-2025-05-27-19-07-22.opus>
[28.05.2025, 09:22:46] Vitalii Kazymyrovych: У нас нас есть камерный FR
[28.05.2025, 09:22:50] Vitalii Kazymyrovych: Привет
[28.05.2025, 09:23:06] ~Yuriy_R: Привет
[28.05.2025, 09:23:53] ~Yuriy_R: А если она будет стоять на камере - ее нужно будет одну оставить или можно будет еще одну аналитику включить?
[28.05.2025, 09:30:41] Vitalii Kazymyrovych: Да, камера 2 аналитики не потянет.
[02.06.2025, 15:11:20] ~Yuriy_R: Виталя привет. Как дела? Есть чтонибудь по метро?
‎[02.06.2025, 17:09:06] Vitalii Kazymyrovych: Привет. Я там ответил на письмо Даниара, показал, как может выглядеть решение. ‎<attached: 00000090-PHOTO-2025-06-02-17-09-06.jpg>
[02.06.2025, 17:09:40] Vitalii Kazymyrovych: Это по поводу пересечения желтой линии. ‎<This message was edited>
[02.06.2025, 17:10:26] Vitalii Kazymyrovych: По FR пока жду. Серверную можем ставить хоть сейчас, а с ACAP пока еще вопросы.
‎[02.06.2025, 17:11:04] ~Yuriy_R: ‎<attached: 00000093-AUDIO-2025-06-02-17-11-04.opus>
[02.06.2025, 17:11:10] Vitalii Kazymyrovych: Да, по поводу этого вопроса. Если мы используем камерную аналитику, мы при этом можем забирать поток с камеры и использовать для серверной аналитики.
‎[02.06.2025, 17:12:34] ~Yuriy_R: ‎<attached: 00000095-AUDIO-2025-06-02-17-12-34.opus>
[02.06.2025, 17:13:49] Vitalii Kazymyrovych: Готово, но есть вопросы по поводу установки. Я сейчас уточняю от разрабов. Позже напишу.
‎[02.06.2025, 17:14:29] ~Yuriy_R: ‎<attached: 00000097-AUDIO-2025-06-02-17-14-29.opus>
[02.06.2025, 17:55:23] Vitalii Kazymyrovych: К концу месяца сможем сделать пилот с ACAP. Но, учитывая, что там будет Object Detection или SmartVA, в любом случае будет сервер, можно туда и FR докинуть, если ресурсы позволят. 

Если нет, нужно будет подождать немного.
‎[02.06.2025, 18:01:46] ~Yuriy_R: ‎<attached: 00000099-AUDIO-2025-06-02-18-01-46.opus>
[03.06.2025, 09:22:00] ~Yuriy_R: Виталя привет. Подскажи по датам когда партнеру сказать?
[03.06.2025, 11:09:19] Vitalii Kazymyrovych: Привет. Созванивался с Даниаром. Напишу письмо.
[03.06.2025, 11:17:57] ~Yuriy_R: Да я слышал что вы общались. Ждем
[03.06.2025, 12:36:32] Vitalii Kazymyrovych: Вы уже знаете, какие камеры в метро будут стоять? Меня интересует разрешение и кодек. И сколько дней видеоархив? 

Это для расчета железа по VMS.
‎[03.06.2025, 12:37:07] ~Yuriy_R: ‎<attached: 00000104-AUDIO-2025-06-03-12-37-07.opus>
[03.06.2025, 12:38:51] Vitalii Kazymyrovych: Ок, без проблем
[03.06.2025, 14:02:00] Vitalii Kazymyrovych: Инфу по камерам мне Данияр скинул
[04.06.2025, 15:05:28] ~Yuriy_R: Виталя привет. Как дела? Есть время на созвон?
[04.06.2025, 15:08:03] Vitalii Kazymyrovych: Привет. Давай через час.
[04.06.2025, 15:08:27] ~Yuriy_R: ох. а если текстом сможешь ответить на вопрос или сильно занят?
[04.06.2025, 15:08:38] Vitalii Kazymyrovych: Текстом могу
[04.06.2025, 15:10:01] ~Yuriy_R: Окей. тогда описываю задачу
Есть спорткомплекс, в нем ест столова. Ставим камеры на входе в столовую. И нужно по FR определять зашел ли спортсмен в столовую или нет. и передавать метаданные на VMS в узловом центре.
[04.06.2025, 15:11:01] Vitalii Kazymyrovych: Министерство спорта Узбекистана?)
[04.06.2025, 15:11:14] ~Yuriy_R: ага
[04.06.2025, 15:11:19] ~Yuriy_R: знакомый проект7
[04.06.2025, 15:54:42] ~Yuriy_R: Виталя, а ты делал расчет на эти 30 камер сервер записи и аналитики?
‎[04.06.2025, 16:01:52] ~Yuriy_R: ‎<attached: 00000116-PHOTO-2025-06-04-16-01-52.jpg>
[04.06.2025, 16:05:01] Vitalii Kazymyrovych: Еще нет
‎[04.06.2025, 16:05:57] ~Yuriy_R: ‎<attached: 00000118-AUDIO-2025-06-04-16-05-57.opus>
[04.06.2025, 16:14:46] Vitalii Kazymyrovych: Не совсем понимаю, зачем им столько LPR
‎[04.06.2025, 16:17:16] ~Yuriy_R: ‎<attached: 00000120-AUDIO-2025-06-04-16-17-16.opus>
[04.06.2025, 16:18:25] Vitalii Kazymyrovych: Схема корректная. Вопрос только в пропускной способности каналов. Нам же на VMS все равно придется видео передавать.
[04.06.2025, 16:18:48] Vitalii Kazymyrovych: Да, из DAAC
‎[04.06.2025, 16:21:51] ~Yuriy_R: ‎<attached: 00000123-AUDIO-2025-06-04-16-21-51.opus>
[04.06.2025, 16:23:20] Vitalii Kazymyrovych: +373 79 131 915
[04.06.2025, 16:24:19] Vitalii Kazymyrovych: Это технарь из DAAC. Я его предупредил, что ты можешь с ним связаться. WhatsApp есть.
[04.06.2025, 16:24:29] Vitalii Kazymyrovych: Юрий Голиков
‎[04.06.2025, 16:24:35] ~Yuriy_R: ‎<attached: 00000127-AUDIO-2025-06-04-16-24-35.opus>
[04.06.2025, 16:25:10] Vitalii Kazymyrovych: Из Молдовы
‎[04.06.2025, 16:29:52] ~Yuriy_R: ‎<attached: 00000129-AUDIO-2025-06-04-16-29-52.opus>
[05.06.2025, 14:07:00] ~Yuriy_R: Виталя привет. Разговаривал с Олегом из DAAC. Он планирует провести совещание с заказчиком про проекту столовых 10 или 11 числа. Сможешь подключиться? Если да, то скажи на какой день? он будет под тебя подстраиваться
[05.06.2025, 14:08:12] Vitalii Kazymyrovych: Привет. Давай 10-го в первой половине дня.
[05.06.2025, 14:08:54] ~Yuriy_R: Ну как раз у тебя начало дня будет, у нас обед
[05.06.2025, 14:09:01] Vitalii Kazymyrovych: Гуд)
[05.06.2025, 14:09:07] ~Yuriy_R: Позже скину
[06.06.2025, 11:13:31] ~Yuriy_R: Юрий, добрый день!
Высылаю линк на онлайн на 10 июня, в 10.00 по Киеву.
[06.06.2025, 11:13:32] ~Yuriy_R: Oleg Rotaru приглашает вас на запланированную конференцию: Zoom.
Подключиться к конференции Zoom
https://us02web.zoom.us/j/82616187999

Идентификатор конференции: 826 1618 7999
[06.06.2025, 14:56:48] Vitalii Kazymyrovych: Привет, принял. Спасибо.
[09.06.2025, 15:54:56] ~Yuriy_R: ‎This message was deleted.
[09.06.2025, 17:43:47] Vitalii Kazymyrovych: Привет. Ты писал, что завтрашний созвон перенесен?
‎[09.06.2025, 17:46:43] ~Yuriy_R: ‎<attached: 00000140-AUDIO-2025-06-09-17-46-43.opus>
[09.06.2025, 17:47:06] Vitalii Kazymyrovych: А, понял
‎[10.06.2025, 09:59:46] ~Yuriy_R: ‎<attached: 00000142-AUDIO-2025-06-10-09-59-46.opus>
[10.06.2025, 10:00:08] Vitalii Kazymyrovych: Привет. Ок.
[10.06.2025, 10:11:49] Vitalii Kazymyrovych: Я сейлз)
[10.06.2025, 14:37:49] Vitalii Kazymyrovych: Слушай, а по спорт центрам там, получается по 4 камеры на объект, из которых 2 с аналитикой или 4 обычных + 2 с аналитикой, итого 6?
‎[10.06.2025, 14:56:29] ~Yuriy_R: ‎<attached: 00000146-AUDIO-2025-06-10-14-56-29.opus>
[10.06.2025, 17:13:15] Vitalii Kazymyrovych: Какие камеры будем ставить? Мне для VMS надо знать разрешение, кодек, фпс и срок хранения архива.
[10.06.2025, 17:15:03] ~Yuriy_R: Срок хранения архива -30 дней. По камерам завтра скажу. У меня модели записаны на что с аналитикой. А те что обзорные завтра выберу
[11.06.2025, 12:51:04] Vitalii Kazymyrovych: Привет. Есть характеристики камеры?
‎[11.06.2025, 12:51:34] ~Yuriy_R: ‎<attached: 00000150-AUDIO-2025-06-11-12-51-34.opus>
[11.06.2025, 13:04:16] ~Yuriy_R: https://www.axis.com/products/axis-m4215-lv
[11.06.2025, 13:04:32] ~Yuriy_R: это обзорные
[11.06.2025, 13:09:45] ~Yuriy_R: Axis m3216-lve это для аналитики
[11.06.2025, 15:42:00] Vitalii Kazymyrovych: Эта камера не подойдет для ACAP
[11.06.2025, 15:42:07] Vitalii Kazymyrovych: Память ОЗУ: 1024 МБ; флэш-память: 8192 МБ
[11.06.2025, 15:42:13] Vitalii Kazymyrovych: Здесь 1 гиг ОЗУ
‎[11.06.2025, 15:59:34] ~Yuriy_R: ‎<attached: 00000157-AUDIO-2025-06-11-15-59-34.opus>
[11.06.2025, 16:00:09] ~Yuriy_R: P3267-LV
[12.06.2025, 12:14:46] ~Yuriy_R: Виталя привет. Получилось посчитать для спорткомплекса
[12.06.2025, 12:26:52] Vitalii Kazymyrovych: Привет. Жду расчет по vms
[12.06.2025, 12:27:23] ~Yuriy_R: Окей, а то нам еще в Dell нашим отправить нужно чтобы расчет дали
‎[12.06.2025, 18:35:22] Vitalii Kazymyrovych: Quotation - S00398.pdf • ‎1 page ‎<attached: 00000162-Quotation - S00398.pdf>
‎[12.06.2025, 18:36:14] ~Yuriy_R: ‎<attached: 00000163-AUDIO-2025-06-12-18-36-14.opus>
[13.06.2025, 07:55:42] ~Yuriy_R: Виталя привет. А мы же вроде обсуждали что будет ACAP версия FR? А ты даешь на серверную?
[13.06.2025, 09:31:07] Vitalii Kazymyrovych: Привет
[13.06.2025, 09:31:19] Vitalii Kazymyrovych: Странно, я АСАР выбирал
[13.06.2025, 09:31:24] Vitalii Kazymyrovych: Сейчас переделаю
[13.06.2025, 09:31:46] ~Yuriy_R: Бывает, запары случаются=)
‎[13.06.2025, 09:42:10] Vitalii Kazymyrovych: Quotation - S00398-1.pdf • ‎1 page ‎<attached: 00000169-Quotation - S00398-1.pdf>
[13.06.2025, 09:42:45] ~Yuriy_R: Taxes(iSoft) on $ 4,500.00 - подскажи это что?
[13.06.2025, 09:43:10] Vitalii Kazymyrovych: Налоги
[13.06.2025, 09:43:44] Vitalii Kazymyrovych: Я уточню, почему именно на VMS идет налог
[18.06.2025, 14:48:53] ~Yuriy_R: Виталя привет
[18.06.2025, 14:48:59] Vitalii Kazymyrovych: Привет
[18.06.2025, 14:49:12] ~Yuriy_R: Как дела?
[18.06.2025, 14:49:26] ~Yuriy_R: Слушай, давай запланируем обучение от вас на след неделю
[18.06.2025, 14:49:27] Vitalii Kazymyrovych: Норм. Работы как всегда дофига)
[18.06.2025, 14:50:28] Vitalii Kazymyrovych: Для кого?
[18.06.2025, 14:50:38] ~Yuriy_R: для нас пока
[18.06.2025, 14:50:58] ~Yuriy_R: 23го или 26,27
[18.06.2025, 14:52:12] Vitalii Kazymyrovych: Мы планировали после подписания соглашения с каждым филиалом MUK провести онбординг и обсудиль дальнейшие действия, включая обучение.
[18.06.2025, 14:53:12] Vitalii Kazymyrovych: Кстати, вы с Даниаром к Казахстану относитесь, правильно?
[18.06.2025, 14:53:15] ~Yuriy_R: понятно. Но у нас уже идут запросы по аналитике и мы вас закладываем. Хотябы нас троих сможешь обучить?
[18.06.2025, 14:53:21] ~Yuriy_R: ага
[18.06.2025, 14:54:19] Vitalii Kazymyrovych: Давай тогда с вами проведем отдельно как можно раньше. 23 норм.
[18.06.2025, 14:54:47] ~Yuriy_R: Все, супер . давай. время скажи, я встречу создам
[18.06.2025, 14:55:24] Vitalii Kazymyrovych: 12 по Киеву
[18.06.2025, 14:55:33] Vitalii Kazymyrovych: Норм?
[18.06.2025, 14:55:41] ~Yuriy_R: да
‎[20.06.2025, 09:53:45] ~Yuriy_R: UZ_DAAC_SportComplx_1.xlsx ‎document omitted
[20.06.2025, 11:10:05] Vitalii Kazymyrovych: Привет. Это сервер для ВМС?
[20.06.2025, 11:10:28] ~Yuriy_R: Ага
[20.06.2025, 11:45:19] Vitalii Kazymyrovych: Могу набрать?
[20.06.2025, 11:45:25] ~Yuriy_R: дада
[23.06.2025, 13:56:53] ~Yuriy_R: Виталя привет, мы тебя ждем
‎[24.06.2025, 13:17:31] Vitalii Kazymyrovych: VEZHA sales webinar.mp4 ‎document omitted
[24.06.2025, 13:20:42] Vitalii Kazymyrovych: Можем запускать пилот с ACAP FR. Нужна камера и комп с AnyDesk, чтобы мы подключились и все поставили. ‎<This message was edited>
‎[24.06.2025, 13:21:55] ~Yuriy_R: ‎<attached: 00000198-AUDIO-2025-06-24-13-21-55.opus>
[24.06.2025, 13:22:45] Vitalii Kazymyrovych: Лучше завтра.
‎[25.06.2025, 17:37:32] ~Yuriy_R: ‎<attached: 00000200-AUDIO-2025-06-25-17-37-32.opus>
[25.06.2025, 17:43:40] Vitalii Kazymyrovych: Зависит от разрешения камеры
‎[25.06.2025, 17:43:42] Vitalii Kazymyrovych: ‎<attached: 00000202-PHOTO-2025-06-25-17-43-42.jpg>
‎[25.06.2025, 17:44:10] ~Yuriy_R: ‎<attached: 00000203-AUDIO-2025-06-25-17-44-10.opus>
[25.06.2025, 17:45:53] Vitalii Kazymyrovych: Там в крайней модели, которую ты мне скидывал 5 мр
[25.06.2025, 17:46:03] Vitalii Kazymyrovych: На 3 полосы должно хватить
‎[25.06.2025, 17:46:26] ~Yuriy_R: ‎<attached: 00000206-AUDIO-2025-06-25-17-46-26.opus>
[26.06.2025, 13:13:11] ~Yuriy_R: Еще один вопрос касается системы видеоаналитики Incoresoft. Сможет ли она с помощью камер и искусственного интеллекта определять прибытие и убытие поездов на платформу? Поскольку, как Вы знаете, при нахождении поезда на платформе система не должна быть активна. Она должна активироваться только после того, как поезд покинет платформу.
Альтернативно мы можем получать сигнал с PLC-системы управления поездами через реле и передавать его на сервер видеоаналитики. Однако мы бы хотели реализовать это именно с помощью камер и искусственного интеллекта, если такая возможность есть.
[26.06.2025, 13:13:15] ~Yuriy_R: Виталя привет
[26.06.2025, 13:13:23] ~Yuriy_R: тут по метро вопрос поступил
[26.06.2025, 13:13:49] ~Yuriy_R: вроде обсуждали что такое вроде возможно настроить
[26.06.2025, 13:38:09] Vitalii Kazymyrovych: Да, эту задачу решает Motion Detection
[26.06.2025, 13:38:22] ~Yuriy_R: Smart VA?
[26.06.2025, 13:38:36] Vitalii Kazymyrovych: Нет, Motion Detection)
‎[26.06.2025, 13:40:14] ~Yuriy_R: Calculator result (1).pdf • ‎1 page ‎document omitted
[26.06.2025, 13:43:09] Vitalii Kazymyrovych: Не, погоди. Мы при помощи MD будем детектить поезд. А людей - при помощи Object Detection.
[26.06.2025, 13:43:45] ~Yuriy_R: т.е. пересечение линии будет через Object detection?
[26.06.2025, 13:43:51] Vitalii Kazymyrovych: Да
[26.06.2025, 13:44:50] ~Yuriy_R: сколько FPS для OD поставить в расчет?
[26.06.2025, 13:45:15] Vitalii Kazymyrovych: 10
[26.06.2025, 13:45:44] ~Yuriy_R: OD на GPU будем считать?
[26.06.2025, 13:46:01] Vitalii Kazymyrovych: Ага
‎[26.06.2025, 13:46:23] ~Yuriy_R: ‎<attached: 00000222-PHOTO-2025-06-26-13-46-23.jpg>
[26.06.2025, 14:09:30] Vitalii Kazymyrovych: А сколько аналитик мы берем для пилота? Мы с Даниаром обсуждали 4: по 2 на каждую колию.
[26.06.2025, 14:10:11] ~Yuriy_R: да, 2 MD + 2OD. но я расчет сделал на 4 тех и 4 тех
[26.06.2025, 14:12:48] Vitalii Kazymyrovych: Да, там получается в идеале 8 нужно: MD и OD на каждую камеру.
[26.06.2025, 14:13:59] Vitalii Kazymyrovych: Но по цене 2 эти лицензии выходят как 1 SmartVA, так что норм.
[26.06.2025, 14:18:34] ~Yuriy_R: ∙ Нарушение правил использования СИЗ/СЗ  (каски, перчатки, маски, очки и другая рабочая одежда)
∙ Превышение скорости транспортных средств на территории рабочих площадок
∙ Нарушение требований безопасности при работах на высоте/погрузочно-разгрузочных операциях
∙ Повышение температуры оборудования (выше нормы)
∙ Поддержка при расследовании событий?
∙ Обнаружение утечек газа (тепловизор?)?
∙ Любой другой объем?
 Виталь, посмотри, как можем закрыть данные задачи, с помошью каких аналитик?
[26.06.2025, 14:26:37] Vitalii Kazymyrovych: 1. Hard Hat detection + Face Recognition
2. -
3. Нужно уточнение (какие нарушения?)
4. -
5. Тут вообще непонятно. Расследование каких событий? 
6. -
7. Этот пункт тоже не понял.
[26.06.2025, 14:26:50] Vitalii Kazymyrovych: Короче, первый пункт закрываем, все остальные - нужно обсуждать
[26.06.2025, 14:28:21] ~Yuriy_R: Ханва камеры с вами интергируются?
[26.06.2025, 14:28:42] Vitalii Kazymyrovych: В смысле, интегрируются?
[26.06.2025, 14:29:08] Vitalii Kazymyrovych: РТСП поток мы можем обработать с любой камеры, даже с боди камер.
[26.06.2025, 14:29:13] Vitalii Kazymyrovych: Или ты про VMS?
‎[26.06.2025, 14:29:49] ~Yuriy_R: ‎<attached: 00000234-AUDIO-2025-06-26-14-29-49.opus>
‎[26.06.2025, 14:29:52] ~Yuriy_R: ‎<attached: 00000235-AUDIO-2025-06-26-14-29-52.opus>
[26.06.2025, 14:30:56] Vitalii Kazymyrovych: Не, вежа может принимать только видео.
[26.06.2025, 14:31:04] ~Yuriy_R: окей
[26.06.2025, 14:34:31] ~Yuriy_R: Поддержка расследования событий - наверно имеют ввиду умный поиск
[26.06.2025, 14:38:34] Vitalii Kazymyrovych: Если это поиск по визуальным атрибутам, то это SmartVA
[26.06.2025, 14:54:33] Vitalii Kazymyrovych: https://incoresoftcom-my.sharepoint.com/:f:/g/personal/a_stashkevych_incoresoft_com/Elck_hwIK_1EsSX-eXG-KBoBS7NHuEMtpR6lfzVeXC8Axg?e=E6begJ
[26.06.2025, 14:54:39] Vitalii Kazymyrovych: VMS
[26.06.2025, 14:55:39] Vitalii Kazymyrovych: Как поставишь, можем созвониться, я позову одного из разрабов и он проведет краткий обзор
[26.06.2025, 14:56:03] ~Yuriy_R: ок
[26.06.2025, 15:02:28] ~Yuriy_R: Есть время на звонок7
[26.06.2025, 15:02:38] Vitalii Kazymyrovych: Да, можешь набрать
[26.06.2025, 15:02:50] ~Yuriy_R: ‎Voice call  ‎7 min
‎[26.06.2025, 15:10:37] ~Yuriy_R: ‎<attached: 00000247-PHOTO-2025-06-26-15-10-37.jpg>
[26.06.2025, 15:11:31] Vitalii Kazymyrovych: Нормальный сетап)
[26.06.2025, 17:37:55] Vitalii Kazymyrovych: По поводу метаданных - пока такого функционала нет
[26.06.2025, 17:38:22] ~Yuriy_R: Эх
[30.06.2025, 10:25:18] ~Yuriy_R: Виталя привет
[30.06.2025, 10:25:36] ~Yuriy_R: Давай сегодня установим FR?
[30.06.2025, 12:33:40] Vitalii Kazymyrovych: Привет. Сейчас узнаю, получится ли. Чуть позже отпишу.
[30.06.2025, 12:35:28] ~Yuriy_R: Окей
[30.06.2025, 12:37:58] Vitalii Kazymyrovych: Завтра будет возможность в 12. Вежа уже установлена?
[30.06.2025, 12:38:23] ~Yuriy_R: в 12 по нашему или по вашему?
[30.06.2025, 12:38:37] ~Yuriy_R: Да, вежу поставил. Давай подключишься и посмотришь
[30.06.2025, 12:38:45] Vitalii Kazymyrovych: По нашему
[30.06.2025, 12:38:58] ~Yuriy_R: 👍
[30.06.2025, 12:39:03] Vitalii Kazymyrovych: Давай энидеск, гляну
[30.06.2025, 12:39:09] ~Yuriy_R: 1 884 251 685
[30.06.2025, 12:43:31] Vitalii Kazymyrovych: Порядок: все сервисы, по крайней мере, запустились.
[30.06.2025, 12:44:06] ~Yuriy_R: 👍Супер
[30.06.2025, 12:44:21] ~Yuriy_R: Тогда давай завтра поставим. Лицензии будешь ставить?
[30.06.2025, 12:44:25] ~Yuriy_R: а там же на камер
‎[30.06.2025, 12:45:29] ~Yuriy_R: ‎<attached: 00000266-AUDIO-2025-06-30-12-45-29.opus>
[30.06.2025, 12:46:10] Vitalii Kazymyrovych: Будет
[30.06.2025, 12:46:25] Vitalii Kazymyrovych: Давай уже завтра все. Лицензии - это минута дела.
[30.06.2025, 13:03:55] ~Yuriy_R: А в калькуляторе это както рассчитывается?
[30.06.2025, 13:18:10] Vitalii Kazymyrovych: Хороший вопрос. Напрямую - вряд ли. Точно можно посчитать сколько оперативки и места на диске нужно, а все остальное - на глаз. Это CPU система будет?
[30.06.2025, 13:18:46] ~Yuriy_R: Ну вот я у них хочу уточнить какая карту у них есть в распоряжении
[01.07.2025, 11:59:13] Vitalii Kazymyrovych: Привет
[01.07.2025, 11:59:27] ~Yuriy_R: ‎Voice call  ‎1 hr
[01.07.2025, 13:02:10] Vitalii Kazymyrovych: ‎Voice call  ‎15 min
[01.07.2025, 13:10:09] ~Yuriy_R: root
Muk1234!
[01.07.2025, 13:17:02] Vitalii Kazymyrovych: CLTJH-9ZZQU-YASMX-ISK6R-WJBIY
[01.07.2025, 13:18:53] ~Yuriy_R: ‎Voice call  ‎10 min
[02.07.2025, 17:57:49] Vitalii Kazymyrovych: Привет. Как тесты FR? Когда планируете камеру клиенту отправлять?
‎[02.07.2025, 18:40:52] ~Yuriy_R: ‎<attached: 00000279-AUDIO-2025-07-02-18-40-52.opus>
‎[03.07.2025, 08:14:37] ~Yuriy_R: Дароф, как дела? Прикинь в очках Исмаила не распознал в очках=)) ‎<attached: 00000280-PHOTO-2025-07-03-08-14-37.jpg>
[03.07.2025, 11:25:19] Vitalii Kazymyrovych: Понизь уровень конфиденса в списке
[03.07.2025, 11:25:20] Vitalii Kazymyrovych: Привет
[03.07.2025, 11:25:42] Vitalii Kazymyrovych: Могу подключиться, показать
[03.07.2025, 11:26:29] ~Yuriy_R: Дароф. Снизил до 80 и ещё не видит чувака в очках😁
[03.07.2025, 11:26:46] ~Yuriy_R: Да эт я знаю где изменить
[03.07.2025, 12:55:15] Vitalii Kazymyrovych: Хм, интересно
[08.07.2025, 09:20:29] ~Yuriy_R: Виталя привет. Как дела?
[08.07.2025, 11:30:12] Vitalii Kazymyrovych: Привет. Норм, как у тебя?
[08.07.2025, 11:31:12] ~Yuriy_R: Нормуль. Слушай, С утра разговаривал с Олегом из Панаби, в Киргизии которые. Они хотят попробовать LPR на пилот
[08.07.2025, 12:05:01] Vitalii Kazymyrovych: ACAP или сервер?
[08.07.2025, 12:05:13] ~Yuriy_R: ACAP
[08.07.2025, 12:05:18] Vitalii Kazymyrovych: Зарегай проект на портале, смогу выдать тестовые лицензии
[08.07.2025, 12:05:45] ~Yuriy_R: Олег сказал что ты в курме про их проект. Там еще нужно на Milestone вытащить данные
[08.07.2025, 12:37:39] ~Yuriy_R: sales@panabi.kg
[08.07.2025, 12:37:49] ~Yuriy_R: Можешь их к нам привязать?
[08.07.2025, 12:39:06] Vitalii Kazymyrovych: Хм, а тут проблема. Они за софтпромом закреплены.
[08.07.2025, 12:39:45] ~Yuriy_R: О как. и шо делать будем?=)
[08.07.2025, 12:44:56] Vitalii Kazymyrovych: Хороший вопрос. Сейчас подумаю.
[08.07.2025, 13:19:39] Vitalii Kazymyrovych: Нужно зарегать еще одно партнера
[08.07.2025, 13:19:54] Vitalii Kazymyrovych: Не уверен, правда, что получится с той же почтой
[08.07.2025, 13:20:03] Vitalii Kazymyrovych: Но других вариантов нет
[08.07.2025, 13:20:13] ~Yuriy_R: давай спрошу у Олега другую почту
[08.07.2025, 13:21:19] Vitalii Kazymyrovych: И название другое надо. Капсом можно, к примеру.
[08.07.2025, 13:21:30] ~Yuriy_R: 👍
[08.07.2025, 13:34:59] ~Yuriy_R: Все, зарегал
[08.07.2025, 14:34:13] Vitalii Kazymyrovych: Когда будем ставить?
[08.07.2025, 14:34:32] ~Yuriy_R: Ща уточню
[08.07.2025, 15:56:05] ~Yuriy_R: Под сервер , могут использовать виртуальную машину ?

Проект актуален, им нужно  на днях, показать пилот управлению образования. И показать что есть такая система

Есть сервера без gpu 
Могут выделить до 5Тб 128Gb 20Cpu
[08.07.2025, 15:56:23] ~Yuriy_R: Виталь, это под пилот Абайских школ
‎[09.07.2025, 09:33:39] ~Yuriy_R: ‎video omitted
[09.07.2025, 11:21:31] Vitalii Kazymyrovych: Для пилота сгодится
[09.07.2025, 11:21:33] Vitalii Kazymyrovych: Привет
[09.07.2025, 11:22:51] Vitalii Kazymyrovych: Согласен, раздражает. Поговорю с разрабами.
[09.07.2025, 11:24:13] ~Yuriy_R: Привет. Отлично. Я там зарегал два пилота. На школы и на LPR в киргизию.
[14.07.2025, 13:01:34] Vitalii Kazymyrovych: https://teams.microsoft.com/l/meetup-join/19%3ameeting_N2I0ZjdlODctNGQ1MC00YjE1LTg1ZTMtNmE1YmY3ZmQ3NGYw%40thread.v2/0?context=%7b%22Tid%22%3a%22bdac3018-f16c-4509-957a-31f5f963613f%22%2c%22Oid%22%3a%2254a2d224-2974-429e-82ce-dd0a8cd1a545%22%7d
[14.07.2025, 13:13:30] Vitalii Kazymyrovych: ...
[14.07.2025, 13:37:49] ~Yuriy_R: Виталь, давай как будет готовы подключайтесь
[14.07.2025, 13:38:08] ~Yuriy_R: 1 884 251 685
[15.07.2025, 11:45:23] ~Yuriy_R: Виталя привет
[15.07.2025, 11:45:37] ~Yuriy_R: Там панаби планирует завтра ставить LPR
[15.07.2025, 11:45:57] ~Yuriy_R: Уточни во сколько вам будет удобно, перешли Олегу
[15.07.2025, 13:49:16] Vitalii Kazymyrovych: Привет
[15.07.2025, 13:49:37] Vitalii Kazymyrovych: Сегодня ближе к концу рабочего дня можем созвониться, поставить вмс
[15.07.2025, 13:49:51] ~Yuriy_R: окей. давай
[15.07.2025, 13:51:20] Vitalii Kazymyrovych: 17:00 по Киеву
[15.07.2025, 13:51:30] Vitalii Kazymyrovych: Тут инсталл ВМС уже скачан?
[15.07.2025, 13:52:00] ~Yuriy_R: ох блин, я буду в дороге
[15.07.2025, 13:54:26] Vitalii Kazymyrovych: Позже?
[15.07.2025, 13:55:11] ~Yuriy_R: либо позже, либо раньше
[15.07.2025, 13:55:31] Vitalii Kazymyrovych: Насколько раньше и насколько позже?)
[15.07.2025, 13:55:44] Vitalii Kazymyrovych: Скажи пару слотов
[15.07.2025, 13:56:24] ~Yuriy_R: либо с 3 до 4х по вашему
[15.07.2025, 13:56:51] ~Yuriy_R: либо с 6 до 7
[15.07.2025, 13:57:28] ~Yuriy_R: 17 по вашему - это19 по нашему. как раз в пробке буду=)
[15.07.2025, 13:57:45] Vitalii Kazymyrovych: По моему, отличное время для установки вмс)
[15.07.2025, 13:58:13] Vitalii Kazymyrovych: Ок, тогда с 3 до 4
[15.07.2025, 14:05:53] Vitalii Kazymyrovych: У тебя инстал вмс скачан?
[15.07.2025, 14:10:16] ~Yuriy_R: есть
[15.07.2025, 14:10:25] Vitalii Kazymyrovych: гуд
‎[15.07.2025, 14:15:28] ~Yuriy_R: вот что есть ‎<attached: 00000340-PHOTO-2025-07-15-14-15-28.jpg>
[15.07.2025, 14:15:56] ~Yuriy_R: Слушай, а с Олегом из ПАНАБИ завтра во сколько?
[15.07.2025, 14:16:49] Vitalii Kazymyrovych: Гуд. Странно, что файл №2 2 разаскачан, но все ок
[15.07.2025, 14:17:24] ~Yuriy_R: ты про bin?
[15.07.2025, 14:17:32] Vitalii Kazymyrovych: ага
[15.07.2025, 14:17:46] Vitalii Kazymyrovych: Еще не знаю
[15.07.2025, 15:01:47] Vitalii Kazymyrovych: Подключаешься?
[15.07.2025, 15:40:06] Vitalii Kazymyrovych: MDTV5-39IYJ-H7EKH-DQK7D-SZ3JB
‎[15.07.2025, 16:01:00] ~Yuriy_R: ‎audio omitted
[16.07.2025, 14:40:43] Vitalii Kazymyrovych: Привет. Обнови плагин FR для VMS. По идее, должны были пофиксить баг с добавлением аналитик.
[16.07.2025, 14:41:38] ~Yuriy_R: Привет. Окей. Обновлю. Олег ещё не скинул мне фрагменты
По Абайским школам - завтра послезавтра уже будут готовы к установкие
[17.07.2025, 08:24:54] ~Yuriy_R: Виталя привет. По Абайским школам - просят на завтра на после обеда по нашему настроить. Со своими коллегами согласуй какое именно время. Передам ему
[17.07.2025, 12:54:52] ~Yuriy_R: https://drive.google.com/file/d/1ShsIeaoEqWxvSxFr8vpkJo7RJ51D9WhS/view?usp=drive_link
[17.07.2025, 12:54:52] ~Yuriy_R: https://drive.google.com/file/d/18JzURjmsmvAoDVY5iEIPskoovj4Gad3S/view?usp=drive_link
[17.07.2025, 12:54:52] ~Yuriy_R: https://drive.google.com/file/d/1dg5gnsMiV2Y0MNHDxw1LjvNuNBvBCl8d/view?usp=drive_link
[17.07.2025, 12:54:52] ~Yuriy_R: https://drive.google.com/file/d/17A3aXgW8tJ9-HE1qT-8lgGhissFWFaC5/view?usp=drive_link
[17.07.2025, 12:54:52] ~Yuriy_R: https://drive.google.com/file/d/156wmj7ExAnxI_UQySpzDWdG349bfop9K/view?usp=drive_link
[17.07.2025, 12:54:52] ~Yuriy_R: https://drive.google.com/file/d/1RLgE5J9AcRskRxlUFpZcYwL7coW-Nf6T/view?usp=drive_link
[17.07.2025, 12:55:01] ~Yuriy_R: https://drive.google.com/file/d/1qrBAqp0YpOHM60tDE090TptCOgKqbw6V/view?usp=drive_link
[17.07.2025, 13:04:31] Vitalii Kazymyrovych: Привет. Ок, согласую. ‎<This message was edited>
[17.07.2025, 13:05:21] Vitalii Kazymyrovych: Видео принял
[21.07.2025, 10:46:21] ~Yuriy_R: Виталя привет
[21.07.2025, 10:46:30] ~Yuriy_R: Как дела? По датам еще не определились?
[21.07.2025, 11:00:58] Vitalii Kazymyrovych: Привет. Уточню, отпишусь.
[21.07.2025, 11:01:25] ~Yuriy_R: И по тестам для панаби есть результат?
[21.07.2025, 11:48:01] Vitalii Kazymyrovych: По поводу школ. Сможешь на этом сервере поставить 23.3 с MySQL? Или запроси доступ, я поставлю. Потом подключим Лешу.
[21.07.2025, 11:48:08] Vitalii Kazymyrovych: Сегодня скажу
[21.07.2025, 11:48:28] ~Yuriy_R: сейчас узнаю
[21.07.2025, 11:50:20] ~Yuriy_R: Давай если что в двоем подключимся, я посмотрю как что делать, даже наверно запишу. Они ответили что да
[21.07.2025, 11:53:03] ~Yuriy_R: На виндовс 10 же сможем поставить?
[21.07.2025, 12:20:59] Vitalii Kazymyrovych: Естественно
[21.07.2025, 12:21:03] Vitalii Kazymyrovych: Ок
[21.07.2025, 12:22:45] ~Yuriy_R: Жду от него данные Энидеск
[21.07.2025, 12:47:02] ~Yuriy_R: 1 683 215 137
[21.07.2025, 12:47:14] Vitalii Kazymyrovych: После обеда
[21.07.2025, 12:47:27] Vitalii Kazymyrovych: Давай ориентировочно в 15 по Киеву
[21.07.2025, 12:47:34] ~Yuriy_R: окей
[21.07.2025, 14:53:24] ~Yuriy_R: Виталь, ты подключишься?
[21.07.2025, 14:53:37] Vitalii Kazymyrovych: ага
[21.07.2025, 14:53:39] Vitalii Kazymyrovych: 5 минут
[21.07.2025, 14:54:00] ~Yuriy_R: ‎Voice call  ‎1 min
[21.07.2025, 14:59:04] Vitalii Kazymyrovych: Так, ну, пока комп оффлайн
[21.07.2025, 14:59:23] ~Yuriy_R: уточняю
[21.07.2025, 15:01:25] ~Yuriy_R: Подключился7
‎[21.07.2025, 15:02:00] Vitalii Kazymyrovych: ‎<attached: 00000384-PHOTO-2025-07-21-15-02-00.jpg>
[21.07.2025, 15:03:08] ~Yuriy_R: Ща включит. Блин, вот тип
[21.07.2025, 15:04:18] ~Yuriy_R: чек
[21.07.2025, 15:05:22] Vitalii Kazymyrovych: подключаюсь
[21.07.2025, 15:05:28] Vitalii Kazymyrovych: пока не акссептит
‎[21.07.2025, 16:13:33] ~Yuriy_R: ‎<attached: 00000389-AUDIO-2025-07-21-16-13-33.opus>
[21.07.2025, 16:34:22] Vitalii Kazymyrovych: Только закончили
‎[21.07.2025, 16:35:17] Vitalii Kazymyrovych: ‎<attached: 00000391-AUDIO-2025-07-21-16-35-17.opus>
‎[21.07.2025, 16:37:30] ~Yuriy_R: ‎<attached: 00000392-AUDIO-2025-07-21-16-37-30.opus>
[22.07.2025, 19:14:31] Vitalii Kazymyrovych: Привет. По поводу видосов. Есть возможность отзумить и настроить камеру? Сейчас мы банально из-за качества ничего распознать не сможем.
‎[22.07.2025, 19:15:22] ~Yuriy_R: ‎<attached: 00000394-AUDIO-2025-07-22-19-15-22.opus>
[23.07.2025, 11:53:32] Vitalii Kazymyrovych: Привет. Хотел спросить, как там тесты вмс?
[23.07.2025, 11:53:49] Vitalii Kazymyrovych: Может есть какие-то вопросы / пожелания / предложения ‎<This message was edited>
[23.07.2025, 11:54:23] Vitalii Kazymyrovych: И как со школами дела, они камеру еще на объект не отвозили?
[23.07.2025, 11:54:27] ~Yuriy_R: Привет. Пока в процессе
[23.07.2025, 11:55:03] ~Yuriy_R: На счет школ  - вчера его зарегал, показал где что изучить. На счет увезли или нет сейчас уточню. Я думал они еще до этого поставили
[23.07.2025, 11:55:26] Vitalii Kazymyrovych: Не, мы когда им софт ставили, камера в офисе была
[23.07.2025, 12:12:32] Vitalii Kazymyrovych: Сможем в этом месяце на одном из проектов поставить для демо?
[23.07.2025, 12:13:27] ~Yuriy_R: надо подумать
[30.07.2025, 16:26:33] Vitalii Kazymyrovych: Привет
[30.07.2025, 16:26:36] Vitalii Kazymyrovych: Как дела?
[30.07.2025, 16:27:02] Vitalii Kazymyrovych: Новостей никаких? Как демо продвигается? Что там с Панаби - получится камеру настроить?
‎[30.07.2025, 16:27:06] ~Yuriy_R: ‎<attached: 00000406-AUDIO-2025-07-30-16-27-06.opus>
[30.07.2025, 16:27:24] Vitalii Kazymyrovych: Давай сделаем звонок с апдейтом статуса проектов на этой неделе.
[30.07.2025, 16:28:06] Vitalii Kazymyrovych: У меня гуд. Я закончил работу над курсами, так что теперь, весь в продажах)
[30.07.2025, 16:28:24] Vitalii Kazymyrovych: Буду донимать всех вопросами из серии "где мои деньги"
‎[30.07.2025, 16:28:27] ~Yuriy_R: ‎<attached: 00000410-AUDIO-2025-07-30-16-28-27.opus>
‎[30.07.2025, 16:30:03] ~Yuriy_R: ‎<attached: 00000411-AUDIO-2025-07-30-16-30-03.opus>
[30.07.2025, 16:30:08] Vitalii Kazymyrovych: Логично, в принципе. Получается, до сентября по этому проекту подвижек особо не будет.
‎[30.07.2025, 16:30:44] ~Yuriy_R: ‎<attached: 00000413-AUDIO-2025-07-30-16-30-44.opus>
[30.07.2025, 16:31:27] Vitalii Kazymyrovych: Ага, типа того)
[30.07.2025, 16:31:55] Vitalii Kazymyrovych: А ваш филиал в Азербайджане не может им камеры дать?
‎[30.07.2025, 16:32:04] ~Yuriy_R: Вот так получается чекпоинт, коммутатор, и камера наша установлена. Точка вайфай в столовую позже информатик установит.
Другого варианта не было кроме поставить на стол в кабинете информатики. Спец шкафа телекоммуникационного и тд нет там ‎<attached: 00000416-PHOTO-2025-07-30-16-32-04.jpg>
[30.07.2025, 16:32:40] Vitalii Kazymyrovych: Камера путешествует больше чем я😅
‎[30.07.2025, 16:33:23] ~Yuriy_R: ‎<attached: 00000418-AUDIO-2025-07-30-16-33-23.opus>
‎[30.07.2025, 16:33:58] ~Yuriy_R: ‎<attached: 00000419-AUDIO-2025-07-30-16-33-58.opus>
[30.07.2025, 16:34:58] Vitalii Kazymyrovych: Контрабанда камер?
‎[30.07.2025, 16:35:32] ~Yuriy_R: ‎<attached: 00000421-AUDIO-2025-07-30-16-35-32.opus>
[30.07.2025, 16:35:57] Vitalii Kazymyrovych: А причем здесь турки? Аксис же шведская компания.
‎[30.07.2025, 16:36:34] ~Yuriy_R: ‎<attached: 00000423-AUDIO-2025-07-30-16-36-34.opus>
[30.07.2025, 16:37:15] Vitalii Kazymyrovych: Ясно
[30.07.2025, 16:37:41] Vitalii Kazymyrovych: А без аксиса вы туда пойти не можете? Здесь же не ACAP, можем любую камеру использовать.
[30.07.2025, 16:38:04] Vitalii Kazymyrovych: Или у вас только аксис в портфеле?
‎[30.07.2025, 16:38:29] ~Yuriy_R: ‎<attached: 00000427-AUDIO-2025-07-30-16-38-29.opus>
‎[30.07.2025, 16:38:57] ~Yuriy_R: ‎<attached: 00000428-AUDIO-2025-07-30-16-38-57.opus>
[30.07.2025, 16:45:08] Vitalii Kazymyrovych: Так, что насчет созвона? Или лучше с Данияром обсудить?
‎[30.07.2025, 16:45:41] ~Yuriy_R: ‎<attached: 00000430-AUDIO-2025-07-30-16-45-41.opus>
[30.07.2025, 16:46:05] Vitalii Kazymyrovych: Вот
‎[30.07.2025, 16:46:24] ~Yuriy_R: ‎<attached: 00000432-AUDIO-2025-07-30-16-46-24.opus>
[30.07.2025, 16:47:29] Vitalii Kazymyrovych: Давай. В 12 по Астане норм?
‎[30.07.2025, 16:49:11] ~Yuriy_R: ‎<attached: 00000434-AUDIO-2025-07-30-16-49-11.opus>
[30.07.2025, 17:10:17] Vitalii Kazymyrovych: Звучит хорошо. С бизнесом работать куда приятнее, чем с гос структурами.
[30.07.2025, 17:10:39] ~Yuriy_R: 😀
[01.08.2025, 10:02:51] Vitalii Kazymyrovych: Привет
[01.08.2025, 10:03:06] ~Yuriy_R: Привет
[01.08.2025, 10:03:08] Vitalii Kazymyrovych: Сейчас подключусь, у меня с интернетом проблемы
[01.08.2025, 10:03:23] ~Yuriy_R: ой блин, ща тоже подключусь=)
[05.08.2025, 16:56:16] Vitalii Kazymyrovych: Привет еще раз. Если с софтом ты ничего не делал, то достаточно поставить апку на камеру. 

Когда сможешь дать доступ?
[05.08.2025, 16:56:27] Vitalii Kazymyrovych: Проверь, чтобы прошивка на камере была 12.4
‎[05.08.2025, 16:59:32] ~Yuriy_R: ‎<attached: 00000443-AUDIO-2025-08-05-16-59-32.opus>
[05.08.2025, 17:07:12] Vitalii Kazymyrovych: Если на камере работает наша аналитика, аксисовскую ты на ней запустить не сможешь - ресурсов не хватит.
[05.08.2025, 17:07:36] ~Yuriy_R: Да, я знаю. Буду по очереди
[05.08.2025, 17:08:30] Vitalii Kazymyrovych: На крайняк, можно забить на ACAP и запустить серверную.
[05.08.2025, 17:17:55] ~Yuriy_R: Ну вот кстати это наверно лучше будет
[05.08.2025, 17:18:21] Vitalii Kazymyrovych: На компе ресурсов хватит?
[05.08.2025, 17:18:41] ~Yuriy_R: Думаю да
[05.08.2025, 17:19:00] ~Yuriy_R: Как за компом буду - скину характеристики
[06.08.2025, 12:46:47] ~Yuriy_R: Виталя привет
[06.08.2025, 12:46:55] ~Yuriy_R: Будем ставить ?
[06.08.2025, 13:19:12] Vitalii Kazymyrovych: Привет. ACAP или серверная?
[06.08.2025, 13:37:32] ~Yuriy_R: Виталь, сорри, на звонке был
[06.08.2025, 13:38:05] ~Yuriy_R: Давай наверно серверную,  чтобы камеру не занимать
[06.08.2025, 13:38:35] ~Yuriy_R: как раз опрубуем ноут и не будем привязаны к камере
[06.08.2025, 13:45:30] Vitalii Kazymyrovych: Ок. Сейчас узнаю, нужно ли переустанавливать вежу. Мы ж там специфическую сборку ставили.
[06.08.2025, 13:45:46] ~Yuriy_R: Даа точно
[06.08.2025, 13:45:51] ~Yuriy_R: с бубном танцевали=)
[06.08.2025, 13:48:16] Vitalii Kazymyrovych: Давай энидеск. Если повезет, не придется переустанавливать.
[06.08.2025, 13:48:23] ~Yuriy_R: сек
[06.08.2025, 13:48:50] ~Yuriy_R: 1 884 251 685
[06.08.2025, 13:53:51] Vitalii Kazymyrovych: У тебя же еще вмс стоит. Сейчас еще пойду узнаю, будет ли оно с вмс работать.
[06.08.2025, 13:54:25] Vitalii Kazymyrovych: Но сервер аналитический отображается. Это уже хорошо
[06.08.2025, 13:55:25] ~Yuriy_R: Ок. Жду
[06.08.2025, 14:02:26] Vitalii Kazymyrovych: Ты эту камеру в вмс добавлял?
[06.08.2025, 14:02:39] ~Yuriy_R: ‎Missed voice call  ‎Tap to call back
[06.08.2025, 14:03:13] Vitalii Kazymyrovych: набери еще раз
[06.08.2025, 14:03:16] ~Yuriy_R: ‎Voice call  ‎7 min
[06.08.2025, 14:13:48] ~Yuriy_R: Я отошёл от компа
[06.08.2025, 14:13:52] ~Yuriy_R: Пару минут вернусь ‎<This message was edited>
[06.08.2025, 14:13:57] Vitalii Kazymyrovych: Ок
[06.08.2025, 14:33:40] ~Yuriy_R: Как успехи?
[06.08.2025, 14:33:52] Vitalii Kazymyrovych: Ща, почти разобрались
[06.08.2025, 14:42:06] Vitalii Kazymyrovych: Походи перед камерой
[06.08.2025, 14:43:49] ~Yuriy_R: Ща
[06.08.2025, 14:44:29] ~Yuriy_R: Походил
[06.08.2025, 14:44:40] Vitalii Kazymyrovych: Погоди, еще кое-что нужно сделать
[06.08.2025, 14:54:55] Vitalii Kazymyrovych: Все, работает
[06.08.2025, 14:55:20] Vitalii Kazymyrovych: Только события с камерной аналитики теперь без фоток, потому что там кадры были в другом хранилище
[06.08.2025, 14:55:38] Vitalii Kazymyrovych: И возможно списки  придется по новой создать. Но в остальном - работает.
[06.08.2025, 14:56:18] ~Yuriy_R: Окей. Списки создадим
[06.08.2025, 14:57:12] Vitalii Kazymyrovych: Я вам 10 лицензий сгенерировал. У тебя комп еще пару тройку аналитик потянет. Видеокарта мощная и почти не загружена.
[06.08.2025, 14:57:17] Vitalii Kazymyrovych: И оперативы хватит.
[06.08.2025, 14:57:46] Vitalii Kazymyrovych: Но с текущим сетапом, по идее, будут работать только фейсы😅
[06.08.2025, 14:57:48] ~Yuriy_R: Виталь, скажи ваша вмс на сколько тянет камер?
[06.08.2025, 14:58:18] ~Yuriy_R: Ну гуд. Будем тестить
[06.08.2025, 14:58:24] Vitalii Kazymyrovych: То есть, сколько туда можно максимально добавить?
[06.08.2025, 14:58:43] ~Yuriy_R: Да
[06.08.2025, 14:58:51] Vitalii Kazymyrovych: Один рекординг около 300 камер фул хд
[06.08.2025, 15:00:07] ~Yuriy_R: Даник говорит что вы вчера общались по цене. Поможешь со спинкой по ВМС? Что есть что может, тех описание
‎[06.08.2025, 15:01:31] Vitalii Kazymyrovych: V 1.8 IncoreSoft VMS Product Overview (4) 2.pdf • ‎4 pages ‎<attached: 00000492-V 1.8 IncoreSoft VMS Product Overview (4) 2.pdf>
‎[06.08.2025, 15:01:32] Vitalii Kazymyrovych: EN_IncoreSoft_VMS_v1 (1).pdf • ‎12 pages ‎<attached: 00000493-EN_IncoreSoft_VMS_v1 (1).pdf>
[06.08.2025, 15:01:35] Vitalii Kazymyrovych: Презентация и спека
[06.08.2025, 15:03:22] ~Yuriy_R: ‎This message was deleted.
[06.08.2025, 15:03:38] Vitalii Kazymyrovych: Что?
[06.08.2025, 15:03:47] ~Yuriy_R: Сорри
[06.08.2025, 15:03:51] ~Yuriy_R: 👍
[06.08.2025, 15:03:54] Vitalii Kazymyrovych: 🤣
[06.08.2025, 15:03:54] ~Yuriy_R: Это хотел
[06.08.2025, 15:04:01] ~Yuriy_R: Промазал🤣
[06.08.2025, 15:04:04] Vitalii Kazymyrovych: Бывает)
‎[06.08.2025, 15:25:33] ~Yuriy_R: ‎<attached: 00000503-VIDEO-2025-08-06-15-25-33.mp4>
[06.08.2025, 15:34:28] ~Yuriy_R: А на русском нету?
[06.08.2025, 15:34:36] ~Yuriy_R: я про презентации
[06.08.2025, 15:36:48] Vitalii Kazymyrovych: Не, могу дать на перевод
[06.08.2025, 15:37:44] ~Yuriy_R: Да, будет лучше на русском. Мы наши. Сейлам перешлём два варианта
[06.08.2025, 15:37:55] Vitalii Kazymyrovych: Сейчас спрошу у маркетологов, сколько времени надо
[06.08.2025, 15:38:05] ~Yuriy_R: Гуд
[06.08.2025, 15:39:52] Vitalii Kazymyrovych: До завтра сделаем
[06.08.2025, 15:41:36] ~Yuriy_R: 👍
[07.08.2025, 10:38:46] ~Yuriy_R: Виталя привет. Подскажи на этот интерком FR ACAP встанет?
[07.08.2025, 10:38:49] ~Yuriy_R: https://www.axis.com/products/axis-i8307-ve
[07.08.2025, 10:42:44] Vitalii Kazymyrovych: Привет. Хороший вопрос. По характеристикам подходит. Сейчас узнаю.
[07.08.2025, 10:45:16] Vitalii Kazymyrovych: Можем
[07.08.2025, 10:48:31] ~Yuriy_R: О супер. Как прийдет давай демо поставим
[07.08.2025, 10:49:44] Vitalii Kazymyrovych: Давай)
[07.08.2025, 13:59:24] ~Yuriy_R: Виталя, там презентации еще не готовы?
‎[07.08.2025, 14:00:10] Vitalii Kazymyrovych: V 1.8 IncoreSoft VMS Product Overview_RU.pdf • ‎4 pages ‎<attached: 00000519-V 1.8 IncoreSoft VMS Product Overview_RU.pdf>
‎[07.08.2025, 14:00:11] Vitalii Kazymyrovych: RU_IncoreSoft_VMS_v1.pdf • ‎12 pages ‎<attached: 00000520-RU_IncoreSoft_VMS_v1.pdf>
[07.08.2025, 14:00:13] Vitalii Kazymyrovych: Забыл сбросить)
[07.08.2025, 14:01:24] ~Yuriy_R: ооо, гуд
[07.08.2025, 14:01:27] ~Yuriy_R: пасиб
[18.08.2025, 14:52:56] Vitalii Kazymyrovych: Привет. Из того документа, что ты на почту прислал в данный момент важно только распознавание СИЗов?
[18.08.2025, 14:58:33] ~Yuriy_R: Привет. Да, там только СИЗ, но там каска, маска и желет
[18.08.2025, 14:59:06] Vitalii Kazymyrovych: Каски - да, жилеты - возможно, маски - маловероятно
[18.08.2025, 15:42:24] Vitalii Kazymyrovych: От Панаби есть новости?
[18.08.2025, 15:42:57] Vitalii Kazymyrovych: Там софтпром активно интересуется, не участвуем ли мы вместе в этом проекте🙃
‎[18.08.2025, 15:47:22] ~Yuriy_R: ‎<attached: 00000529-AUDIO-2025-08-18-15-47-22.opus>
[18.08.2025, 15:48:42] Vitalii Kazymyrovych: Не, по проекту с панаби
[18.08.2025, 15:49:03] ~Yuriy_R: ааа, пусть гуляют=) мы работаем
[19.08.2025, 12:59:19] ~Yuriy_R: Виталя привет
[19.08.2025, 13:00:11] Vitalii Kazymyrovych: Привет
[19.08.2025, 13:00:26] ~Yuriy_R: Как дела:?
[19.08.2025, 13:00:39] ~Yuriy_R: Жив-здоров?
[19.08.2025, 13:01:23] Vitalii Kazymyrovych: Хах
[19.08.2025, 13:01:31] Vitalii Kazymyrovych: Порядок, цвету и пахну)
[19.08.2025, 13:01:39] ~Yuriy_R: Это прекрасно
[19.08.2025, 13:01:52] Vitalii Kazymyrovych: Сам как?)
[19.08.2025, 13:01:55] ~Yuriy_R: По вчерашнему запросу по КРО сможешь сделать кп?
[19.08.2025, 13:02:38] ~Yuriy_R: Да как обычно - попа в мыле. полжня сегодня разбирался с бизнес-процессом, откуда куда ноги растут
[19.08.2025, 13:02:44] ~Yuriy_R: пока так и не нашел
[19.08.2025, 13:18:11] Vitalii Kazymyrovych: Что за процесс?
[19.08.2025, 13:18:39] ~Yuriy_R: Да внутренняя кухню. вникаю в нюансы
[19.08.2025, 13:18:48] Vitalii Kazymyrovych: Что ты подразумеваешь под КП?
[19.08.2025, 13:19:47] ~Yuriy_R: Цены на VMS и аналитику, которую сможете дать из вчерашнего КП на 30 камер
[19.08.2025, 13:20:15] ~Yuriy_R: еще опционально хотим им добавить обнаружения пожара
[19.08.2025, 13:22:04] Vitalii Kazymyrovych: Давай чуть позже созвонимся по этому проекту
[19.08.2025, 13:50:20] ~Yuriy_R: Сегодня?
[19.08.2025, 14:10:51] Vitalii Kazymyrovych: А кп нужно сегодня ?)
[19.08.2025, 14:12:36] ~Yuriy_R: Было бы хорошо
[19.08.2025, 14:38:02] Vitalii Kazymyrovych: В сколько созвонимся?
[19.08.2025, 14:38:13] ~Yuriy_R: lfdfq d 5 gj yfitve
[19.08.2025, 14:38:18] ~Yuriy_R: давай в 5 по нашему
[19.08.2025, 14:38:34] Vitalii Kazymyrovych: Через 20 минут?
[19.08.2025, 14:53:46] ~Yuriy_R: создашь ?
[19.08.2025, 14:58:05] ~Yuriy_R: ‎Missed voice call  ‎Tap to call back
[19.08.2025, 15:04:47] Vitalii Kazymyrovych: KG/PANABI/MIA
[19.08.2025, 15:27:21] Vitalii Kazymyrovych: Я посчитал аналитику и стоимость. ВМС посчитай сам, ты лучше знаешь, какие там камеры и в каком режиме будут работать, ок?
[19.08.2025, 15:28:43] Vitalii Kazymyrovych: Погоди, квота неправильная
[19.08.2025, 15:30:06] ~Yuriy_R: Мне посчитать железо для вмс?
[19.08.2025, 15:31:48] Vitalii Kazymyrovych: Ага
[19.08.2025, 15:45:03] Vitalii Kazymyrovych: А какой реселлер на этом проекте?
[19.08.2025, 15:45:12] ~Yuriy_R: Altezza
‎[19.08.2025, 15:52:05] ~Yuriy_R: ‎<attached: 00000565-AUDIO-2025-08-19-15-52-05.opus>
[19.08.2025, 17:00:10] Vitalii Kazymyrovych: Над этим работают)
[20.08.2025, 11:30:40] ~Yuriy_R: Виталя привет
[20.08.2025, 11:35:04] Vitalii Kazymyrovych: Привет
[20.08.2025, 11:35:23] ~Yuriy_R: Как дела?
[20.08.2025, 11:35:36] ~Yuriy_R: Мы там зарегали пилот на VMS
[20.08.2025, 11:37:18] Vitalii Kazymyrovych: Норм
[20.08.2025, 11:37:23] Vitalii Kazymyrovych: Для Marine?
[20.08.2025, 11:38:01] Vitalii Kazymyrovych: А
[20.08.2025, 11:38:10] Vitalii Kazymyrovych: Не для marine
[20.08.2025, 11:38:18] Vitalii Kazymyrovych: Это по вчерашнему проекту?
[20.08.2025, 11:38:33] ~Yuriy_R: Не, для Азербайджана. Исмаил вроде вчера зарегал
[20.08.2025, 11:38:37] ~Yuriy_R: Там два проекта
[20.08.2025, 11:38:48] ~Yuriy_R: один для КРО
[20.08.2025, 11:39:01] Vitalii Kazymyrovych: Вижу пока только один. Тот, что для КРО.
[20.08.2025, 11:39:05] Vitalii Kazymyrovych: Окнул
[20.08.2025, 11:39:25] ~Yuriy_R: Сейчас Исмаил вернется и спрошу на счет второго
[20.08.2025, 11:39:33] ~Yuriy_R: Он там еще партнера завел
[20.08.2025, 11:40:01] ~Yuriy_R: Да, проект для Marine
[20.08.2025, 11:41:22] Vitalii Kazymyrovych: Там, по идее, должны тебя позвать, ставить VMS нашу, они у себя в офисе хотят потестить. 


Поставь VMS, заведи камеры, а я потом подключусь и сделаю интеграцию с вежей.
[20.08.2025, 11:42:04] ~Yuriy_R: Это в Азербайджане=)
[20.08.2025, 11:42:08] ~Yuriy_R: только удаленно
[20.08.2025, 11:42:20] Vitalii Kazymyrovych: Ну, понятное дело
[20.08.2025, 11:42:42] ~Yuriy_R: На сайте актуальная версия?
[20.08.2025, 11:44:59] Vitalii Kazymyrovych: На сайте нет инстала вмс
[20.08.2025, 11:45:15] Vitalii Kazymyrovych: Мы ее официально не релизнули еще
[20.08.2025, 11:45:19] Vitalii Kazymyrovych: Только для избранных)
[20.08.2025, 11:45:31] ~Yuriy_R: круто, я избранный=)
[20.08.2025, 11:45:42] ~Yuriy_R: я могу им свою поставить?
[20.08.2025, 11:46:03] Vitalii Kazymyrovych: Ну, на территории СНГ нашу вмс может продавать только MUK, так что, да
[20.08.2025, 11:46:57] Vitalii Kazymyrovych: Погодь, я сейчас попрошу у коллег актуальную линку на случае, если что-то изменилось.
[20.08.2025, 11:47:05] ~Yuriy_R: давай
[20.08.2025, 12:21:40] Vitalii Kazymyrovych: https://incoresoftcom-my.sharepoint.com/personal/a_stashkevych_incoresoft_com/_layouts/15/onedrive.aspx?id=%2Fpersonal%2Fa%5Fstashkevych%5Fincoresoft%5Fcom%2FDocuments%2Fvms&ga=1
[20.08.2025, 12:21:43] Vitalii Kazymyrovych: Cсылка на скачивание та же, но файлы там обновили. Так что, скачай инсталл по новой.
[20.08.2025, 12:28:39] ~Yuriy_R: окей. сейчас Исмаил регает проект
‎[20.08.2025, 14:47:58] ~Yuriy_R: Виталь, у вас есть маркетологи? Смогут помочь с рекламой? А то наши маркетологи заняты по уши до ноября ‎<attached: 00000600-PHOTO-2025-08-20-14-47-58.jpg>
[20.08.2025, 15:34:52] Vitalii Kazymyrovych: Привет. Ну, маркетологи у нас есть. Вам нужно просто эту пикчу задизайнить? Или еще какие материалы нужны? Как будет выглядеть кампания?
[20.08.2025, 15:35:26] ~Yuriy_R: Да
‎[20.08.2025, 15:36:08] ~Yuriy_R: ‎<attached: 00000603-AUDIO-2025-08-20-15-36-08.opus>
[20.08.2025, 15:46:50] Vitalii Kazymyrovych: Какой формат изображения?
[20.08.2025, 15:47:07] Vitalii Kazymyrovych: Сколько на сколько пх, в смысле?
‎[20.08.2025, 15:48:25] ~Yuriy_R: ‎<attached: 00000606-AUDIO-2025-08-20-15-48-25.opus>
[20.08.2025, 16:24:20] Vitalii Kazymyrovych: То есть, это рассылка будет?
[20.08.2025, 16:28:00] Vitalii Kazymyrovych: Сделаем
‎[20.08.2025, 16:33:16] ~Yuriy_R: ‎<attached: 00000609-AUDIO-2025-08-20-16-33-16.opus>
[20.08.2025, 16:35:31] Vitalii Kazymyrovych: Скинь текст с пикчи, которую ты прислал
[20.08.2025, 16:37:44] ~Yuriy_R: Специальное предложение от компании МУК и Incoresoft! 
До конца октября лицензии VMS Incoresoft — всего 50 USD за канал при покупке от 100 каналов.

Incoresoft — это современные решения в сфере видеоменеджмента и видеоаналитики, которые помогают бизнесу быть эффективнее и безопаснее.

Подробности о решениях: incoresoft.com

Предложение ограничено по времени!
[20.08.2025, 16:41:04] ~Yuriy_R: МУК - MUK Computers
‎[20.08.2025, 16:41:13] ~Yuriy_R: ‎<attached: 00000613-AUDIO-2025-08-20-16-41-13.opus>
[22.08.2025, 13:33:05] Vitalii Kazymyrovych: Привет. Ты ВМС для тестов не ставил Marine?
[22.08.2025, 13:33:43] ~Yuriy_R: Привет. Я им отправил ссылку, предложил помощь, но пока не получил ответа
[22.08.2025, 13:34:22] Vitalii Kazymyrovych: Понял. А то он мне жалуется на проблемы с софтом, и я хз, это он про вежу или вмс.
[22.08.2025, 13:34:40] ~Yuriy_R: кто жалуется?
[22.08.2025, 13:34:52] Vitalii Kazymyrovych: Джейхун
[22.08.2025, 13:35:04] ~Yuriy_R: А че он мне не пишет?
[22.08.2025, 13:35:11] Vitalii Kazymyrovych: Хороший вопрос)
[22.08.2025, 13:35:28] ~Yuriy_R: странно
[22.08.2025, 13:36:11] Vitalii Kazymyrovych: Слушай, а вы хотите, чтобы весь этот текст в баннере был? А в самом письме какой текст?
[22.08.2025, 13:37:10] ~Yuriy_R: Хм. Даже хз как бы лучше сделать. Обычно маркетологи этим занимаются
[22.08.2025, 13:37:20] ~Yuriy_R: Есть другие идеи?
[22.08.2025, 13:37:54] Vitalii Kazymyrovych: Ну, я бы какие-то ключевые тезисы в баннер поставил, а все остальное - в тексте письма.
[22.08.2025, 13:38:15] ~Yuriy_R: Давай попробуем. Остальное в письме напишем
[22.08.2025, 13:38:15] Vitalii Kazymyrovych: Специальное предложение от компании MUK Computers и Incoresoft! 

До конца октября лицензии VMS Incoresoft — всего 50 USD за канал при покупке от 100 каналов.

Предложение ограничено по времени!
[22.08.2025, 13:38:21] Vitalii Kazymyrovych: Вот так, например
[22.08.2025, 13:38:27] Vitalii Kazymyrovych: Чтобы сильно не заморачиваться
[22.08.2025, 13:38:36] ~Yuriy_R: 👍
[22.08.2025, 14:15:34] Vitalii Kazymyrovych: Должен написать тебе
[22.08.2025, 14:15:41] Vitalii Kazymyrovych: Джейхун
[22.08.2025, 14:15:46] ~Yuriy_R: 👍
[22.08.2025, 14:16:03] Vitalii Kazymyrovych: Он сказал, что его из МУК все послали, сказали, мол, в отпуске. Хз, кому он писал.
[22.08.2025, 14:16:26] ~Yuriy_R: Всмысле послали? Кто?
[22.08.2025, 14:16:36] Vitalii Kazymyrovych: Говорю же, не знаю
[22.08.2025, 14:16:42] ~Yuriy_R: фигассе
[25.08.2025, 11:00:38] ~Yuriy_R: Виталя привет
[25.08.2025, 11:12:57] Vitalii Kazymyrovych: Привет
[25.08.2025, 11:13:15] ~Yuriy_R: Как дела?
[25.08.2025, 11:27:05] Vitalii Kazymyrovych: Да ничего, вроде. У тебя как?
[25.08.2025, 11:27:26] ~Yuriy_R: Относительно средний понедельник
[25.08.2025, 11:27:43] ~Yuriy_R: Хотел узнать получилось ли с рекламой акции?
[25.08.2025, 11:28:10] ~Yuriy_R: И ещё Даник хочет организовать обучение для наших сейлов по инкоресфт
[25.08.2025, 11:28:17] Vitalii Kazymyrovych: Дизайнер работает сейчас
[25.08.2025, 11:28:22] ~Yuriy_R: Супер
[25.08.2025, 11:29:00] Vitalii Kazymyrovych: Ксавьер попросил рассылку делать не раньше сентября
[25.08.2025, 11:29:29] Vitalii Kazymyrovych: Давай тоже на сентябрь запланируем. Им только сейлз вебинар прочитать, правильно?
[25.08.2025, 11:29:38] Vitalii Kazymyrovych: Без технической части?
[25.08.2025, 11:30:02] ~Yuriy_R: Без проблем
[25.08.2025, 11:30:14] ~Yuriy_R: Да, только для сейлов
‎[25.08.2025, 16:15:04] ~Yuriy_R: ‎<attached: 00000652-AUDIO-2025-08-25-16-15-04.opus>
[26.08.2025, 10:11:56] ~Yuriy_R: Виталя привет. Слушай, это сслыка на облако Microoft. Можешь выложить на гугл драйв?
[26.08.2025, 10:22:00] Vitalii Kazymyrovych: Могу
[26.08.2025, 10:22:20] Vitalii Kazymyrovych: Ему на почту при регистрации должны приходить креды для входа в кабинет
[26.08.2025, 10:22:21] ~Yuriy_R: А то ДЖейхун никак не может скачать
[26.08.2025, 10:22:28] Vitalii Kazymyrovych: Щас сделаю
[26.08.2025, 10:22:44] ~Yuriy_R: Да, но там нету на портале VMS
[26.08.2025, 10:22:57] Vitalii Kazymyrovych: Само собой)
[26.08.2025, 10:23:15] ~Yuriy_R: так как бы мы скачали?=)
[26.08.2025, 10:23:31] Vitalii Kazymyrovych: Никак)
[26.08.2025, 10:23:42] ~Yuriy_R: 🤣👍
[26.08.2025, 10:23:56] Vitalii Kazymyrovych: 👌
[26.08.2025, 11:50:07] ~Yuriy_R: ceyhunmohsunovarmy@gmail.com
[26.08.2025, 11:50:20] ~Yuriy_R: U.roshupkin@gmail.com
[26.08.2025, 11:50:31] Vitalii Kazymyrovych: Грузится
[26.08.2025, 11:50:34] Vitalii Kazymyrovych: Еще 2 минуты
[26.08.2025, 11:50:38] ~Yuriy_R: Добавь эти почты плиз
[26.08.2025, 11:50:42] Vitalii Kazymyrovych: У меня интернет медленный
[26.08.2025, 11:51:22] Vitalii Kazymyrovych: Господи, когда ВМС и вежу 25.1 наконец релизнут, я напьюсь от счастья
[26.08.2025, 11:52:07] ~Yuriy_R: 🤣🤣👍
[26.08.2025, 11:54:39] Vitalii Kazymyrovych: Лови письмо
‎[26.08.2025, 12:51:48] ~Yuriy_R: ‎<attached: 00000673-AUDIO-2025-08-26-12-51-48.opus>
[26.08.2025, 12:51:58] ~Yuriy_R: 1 292 906 273 AnyDesk
[26.08.2025, 13:30:50] Vitalii Kazymyrovych: Постараюсь сегодня подключиться
[26.08.2025, 13:31:16] ~Yuriy_R: ОКей. А то он завтра собрался идти показывать систему
[26.08.2025, 13:47:58] Vitalii Kazymyrovych: Могу набрать?
[26.08.2025, 13:49:17] ~Yuriy_R: даа
[26.08.2025, 13:49:27] Vitalii Kazymyrovych: ‎Voice call  ‎19 min
[26.08.2025, 14:53:35] ~Yuriy_R: Слушай, а на счет рекламы по акции - ваши маркетологи не сделали еще7
[26.08.2025, 14:53:57] Vitalii Kazymyrovych: В процессе
[26.08.2025, 14:54:37] ~Yuriy_R: 👍
‎[01.09.2025, 09:08:59] Vitalii Kazymyrovych: Slide 16_9 - 1.png ‎<attached: 00000683-Slide 16_9 - 1.png>
[01.09.2025, 09:09:03] Vitalii Kazymyrovych: Хелло
[01.09.2025, 09:10:29] ~Yuriy_R: Даров
[01.09.2025, 09:10:51] ~Yuriy_R: Ооо крутяк.
[01.09.2025, 09:10:54] ~Yuriy_R: 👍👍
[01.09.2025, 09:15:09] Vitalii Kazymyrovych: 👌
[01.09.2025, 09:16:21] ~Yuriy_R: Пасиб. С праздником осени ‎<This message was edited>
[01.09.2025, 09:16:42] Vitalii Kazymyrovych: Ой, забыл, тебя тоже. У меня сегодня рабочий день)
[01.09.2025, 09:17:28] ~Yuriy_R: А мы халяаим🤣
[01.09.2025, 09:17:42] Vitalii Kazymyrovych: Хорошо отдохнуть)
[01.09.2025, 09:17:57] ~Yuriy_R: Пасиб
‎[03.09.2025, 12:29:38] ~Yuriy_R: ‎<attached: 00000694-VIDEO-2025-09-03-12-29-38.mp4>
[03.09.2025, 12:31:52] ~Yuriy_R: Виталя привет. Это видео от Джейхуна. У него есть вопросы
[03.09.2025, 15:09:53] Vitalii Kazymyrovych: Первый интегратор на моей памяти, который смог сам настроить отправку оповещений в тг
[03.09.2025, 15:10:02] Vitalii Kazymyrovych: Привет
[03.09.2025, 15:16:35] Vitalii Kazymyrovych: Видео без звука, я не понимаю, в чем вопрос
‎[03.09.2025, 15:18:40] ~Yuriy_R: ‎<attached: 00000699-AUDIO-2025-09-03-15-18-40.opus>
[09.09.2025, 17:36:57] Vitalii Kazymyrovych: Слушай, а что там абайские школы тестируют, если у них лицензия закончилась?
[09.09.2025, 17:36:57] Vitalii Kazymyrovych: Привет
‎[09.09.2025, 17:38:59] ~Yuriy_R: ‎<attached: 00000702-AUDIO-2025-09-09-17-38-59.opus>
[09.09.2025, 17:52:04] Vitalii Kazymyrovych: Звучит как-то размыто. Может созвониться с интегратором, обсудить результаты демо и дальнейшие шаги?
[09.09.2025, 17:52:59] ~Yuriy_R: Да он сам по себе мутный тип, сильно много не говорит. Но я попробуй узнать кто главнее его
[09.09.2025, 17:53:53] Vitalii Kazymyrovych: Понял, спасибо
[22.09.2025, 11:55:57] Vitalii Kazymyrovych: Привет. Как там Абайские школы?
‎[22.09.2025, 12:02:37] ~Yuriy_R: ‎<attached: 00000707-AUDIO-2025-09-22-12-02-37.opus>
[22.09.2025, 12:07:37] Vitalii Kazymyrovych: Хорошо, сделаем. Пни кого-нибудь по поводу школ, пожалуйста.
[22.09.2025, 12:07:54] ~Yuriy_R: Да, сейчас с обеда вернусь
[22.09.2025, 12:08:23] Vitalii Kazymyrovych: Спасибо
[22.09.2025, 12:50:03] ~Yuriy_R: Есть 5 минут на звонок?
[22.09.2025, 12:50:42] Vitalii Kazymyrovych: Есть
[22.09.2025, 12:50:46] ~Yuriy_R: ‎Missed voice call  ‎Tap to call back
[22.09.2025, 12:50:58] Vitalii Kazymyrovych: ‎Voice call  ‎11 min
[22.09.2025, 13:01:56] ~Yuriy_R: ‎Voice call  ‎14 min
‎[23.09.2025, 15:11:35] ~Yuriy_R: ‎<attached: 00000716-AUDIO-2025-09-23-15-11-35.opus>
‎[23.09.2025, 15:11:36] ~Yuriy_R: ‎<attached: 00000717-AUDIO-2025-09-23-15-11-36.opus>
‎[23.09.2025, 15:14:39] ~Yuriy_R: ‎<attached: 00000718-AUDIO-2025-09-23-15-14-39.opus>
[23.09.2025, 15:31:47] Vitalii Kazymyrovych: Хорошо, сделаю
‎[23.09.2025, 15:36:33] ~Yuriy_R: ‎<attached: 00000720-AUDIO-2025-09-23-15-36-33.opus>
[23.09.2025, 15:42:29] Vitalii Kazymyrovych: То есть, 12 Acap fr?
‎[23.09.2025, 15:43:17] ~Yuriy_R: ‎<attached: 00000722-AUDIO-2025-09-23-15-43-17.opus>
[23.09.2025, 15:49:47] Vitalii Kazymyrovych: Ясно, ок
[23.09.2025, 15:49:53] Vitalii Kazymyrovych: Проект зарегайте
‎[23.09.2025, 15:50:10] ~Yuriy_R: ‎<attached: 00000725-AUDIO-2025-09-23-15-50-10.opus>
‎[24.09.2025, 08:09:38] ~Yuriy_R: datasheet-axis-p3737-ple-panoramic-camera-en-US-487430.pdf • ‎7 pages ‎<attached: 00000726-datasheet-axis-p3737-ple-panoramic-camera-en-US-487430.pdf>
[24.09.2025, 13:08:02] Vitalii Kazymyrovych: Да, должна подойти
[24.09.2025, 13:08:03] Vitalii Kazymyrovych: Привет
‎[24.09.2025, 13:31:34] Vitalii Kazymyrovych: Calculator result (5).pdf ‎<attached: 00000729-Calculator result (5).pdf>
[24.09.2025, 13:31:39] Vitalii Kazymyrovych: Рассчет для цехов
[24.09.2025, 13:32:10] Vitalii Kazymyrovych: По 3 камеры на цех - 9 камер. 

Взял Object Detection, Smoke & Fire и Hard Had Detection
[24.09.2025, 13:35:05] ~Yuriy_R: А FR Acap не будешь добавлять? Понимаю что аналитика на борту, но все же запас может нужен?
[24.09.2025, 13:35:40] Vitalii Kazymyrovych: Не
[24.09.2025, 13:36:01] Vitalii Kazymyrovych: Там вообще никаких ресурсов со стороны сервера не надо
[24.09.2025, 13:36:24] ~Yuriy_R: Ок
[24.09.2025, 13:48:47] Vitalii Kazymyrovych: KZ/PromStroyServiсe LLP/ Food Solutions KZ LLP

Это этот проект?
[24.09.2025, 13:48:50] Vitalii Kazymyrovych: или другой?
‎[24.09.2025, 13:49:14] ~Yuriy_R: ‎<attached: 00000738-AUDIO-2025-09-24-13-49-14.opus>
[24.09.2025, 13:53:05] Vitalii Kazymyrovych: ок
[24.09.2025, 13:53:19] Vitalii Kazymyrovych: Как там школы?
‎[24.09.2025, 13:53:37] ~Yuriy_R: ‎<attached: 00000741-AUDIO-2025-09-24-13-53-37.opus>
‎[24.09.2025, 13:58:20] ~Yuriy_R: ‎<attached: 00000742-AUDIO-2025-09-24-13-58-20.opus>
[24.09.2025, 14:01:20] Vitalii Kazymyrovych: Ладно, подождем
‎[24.09.2025, 14:02:16] ~Yuriy_R: ‎<attached: 00000744-AUDIO-2025-09-24-14-02-16.opus>
‎[24.09.2025, 14:02:55] ~Yuriy_R: ‎<attached: 00000745-AUDIO-2025-09-24-14-02-55.opus>
‎[24.09.2025, 14:28:10] ~Yuriy_R: ‎<attached: 00000746-AUDIO-2025-09-24-14-28-10.opus>
[24.09.2025, 14:44:18] Vitalii Kazymyrovych: На какую фигню?😅
[24.09.2025, 14:45:17] ~Yuriy_R: 9 fr acap, вмс на все канали и общую аналитику которую мы с тобой обсуждали, Смоук и огонь
‎[24.09.2025, 14:54:40] Vitalii Kazymyrovych: Quotation - S00572.pdf ‎<attached: 00000749-Quotation - S00572.pdf>
[24.09.2025, 15:01:03] ~Yuriy_R: HH там не будет. т.к. это пищевой цех
[24.09.2025, 15:01:17] ~Yuriy_R: заготовки для Макдональдся
‎[24.09.2025, 15:01:42] Vitalii Kazymyrovych: Quotation - S00572 (1).pdf ‎<attached: 00000752-Quotation - S00572 (1).pdf>
[24.09.2025, 15:46:16] ~Yuriy_R: Применение: таможенные посты. Эти решения должны фиксировать движение авто, людей и анализировать паттерны поведения, в общем нужно решение видео аналитика без камер. Камеры скорее всего будут бюджетные Хик,  не аксис, им нужен сам софт, который будет работать на выбранных ими камерах .
‎[24.09.2025, 15:46:52] ~Yuriy_R: ‎<attached: 00000754-AUDIO-2025-09-24-15-46-52.opus>
[25.09.2025, 10:12:47] Vitalii Kazymyrovych: Мне Исмаил уже это присылал. Надо уточнить у заказчика, что за паттерны. Слишком размыто. ‎<This message was edited>
[25.09.2025, 10:12:51] Vitalii Kazymyrovych: Привет
[25.09.2025, 10:14:41] ~Yuriy_R: Привет. Исмаил обижается когда его Измаилом называют=)
[25.09.2025, 10:15:26] Vitalii Kazymyrovych: Я уже исправил
[25.09.2025, 10:15:30] Vitalii Kazymyrovych: 🙃
[25.09.2025, 10:15:42] ~Yuriy_R: 🤣👍
‎[26.09.2025, 09:25:50] ~Yuriy_R: Виталя привет. Как дела? Подскажи сколько Тех поддержки по количеству поставить. Запрос есть на 250 каналов и 250 аналитик СИЗ ‎<attached: 00000761-PHOTO-2025-09-26-09-25-50.jpg>
[26.09.2025, 09:26:26] Vitalii Kazymyrovych: Привет
[26.09.2025, 09:28:19] Vitalii Kazymyrovych: 1 час сапорта на 10 каналов вмс.
[26.09.2025, 09:28:52] Vitalii Kazymyrovych: На сами каски сапорт не закладываем - детекторы не требуют серьезной настройки
[26.09.2025, 09:29:18] ~Yuriy_R: получается если 250 каналов то 25 сапорта
[26.09.2025, 09:33:26] ~Yuriy_R: Слушай, а вот Акция на 50; за канал, а наш вход какой?
[26.09.2025, 09:38:21] Vitalii Kazymyrovych: Мы вам даем скидку 70% на канал при покупке от 100 каналов.
[26.09.2025, 09:38:35] ~Yuriy_R: а вот это мне и нужно. Спасибо
[26.09.2025, 13:28:21] ~Yuriy_R: Виталя
[26.09.2025, 13:28:30] ~Yuriy_R: хелп нужен
[26.09.2025, 13:41:31] ~Yuriy_R: Виталя, помоги рассчет сделать по железу на 50 камер 4МР на HH. Оптимальный вариант нужен по железу
[26.09.2025, 13:44:17] Vitalii Kazymyrovych: ‎You deleted this message.
[26.09.2025, 13:44:31] Vitalii Kazymyrovych: VMS ?
[26.09.2025, 13:45:11] ~Yuriy_R: Там и вмс и сервер аналитика на каски нужен
[26.09.2025, 13:45:37] Vitalii Kazymyrovych: А, вот, каски не увидел
[26.09.2025, 13:45:56] ~Yuriy_R: 4мр на Hard Hat
[26.09.2025, 13:46:13] Vitalii Kazymyrovych: Срок хранения архива, FPS и кодек
[26.09.2025, 13:46:23] ~Yuriy_R: 45 дней
[26.09.2025, 13:46:36] ~Yuriy_R: Ну fps сколько норм - 15?
[26.09.2025, 13:46:58] ~Yuriy_R: Кодек да думаю 265 пусть юудет
[26.09.2025, 13:47:31] Vitalii Kazymyrovych: пойдет
[26.09.2025, 13:47:51] Vitalii Kazymyrovych: ок
[26.09.2025, 13:48:25] ~Yuriy_R: Там карту gpu не сильно крутую. А то я им на 20Gb поставил они ахренели
[26.09.2025, 13:49:07] Vitalii Kazymyrovych: SSD или HDD?
[26.09.2025, 13:49:15] Vitalii Kazymyrovych: Ахах, ок
[26.09.2025, 13:49:18] ~Yuriy_R: Да хдд
[26.09.2025, 13:51:59] Vitalii Kazymyrovych: Ладно, не ок
[26.09.2025, 13:52:11] Vitalii Kazymyrovych: мне посчитало Tesla V100 32GB🤣
[26.09.2025, 13:52:16] ~Yuriy_R: 🤣🤣👍
‎[26.09.2025, 13:52:53] Vitalii Kazymyrovych: VMS Calculator result (3).pdf • ‎2 pages ‎<attached: 00000790-VMS Calculator result (3).pdf>
[26.09.2025, 13:52:59] Vitalii Kazymyrovych: Это для ВМС
‎[26.09.2025, 13:54:57] Vitalii Kazymyrovych: Calculator result (6).pdf • ‎1 page ‎<attached: 00000792-Calculator result (6).pdf>
[26.09.2025, 13:55:40] Vitalii Kazymyrovych: Это для аналитики. Ничего не поделаешь, надо много гигабайт
[26.09.2025, 13:56:00] ~Yuriy_R: Ну вот мы им и говорим так
[26.09.2025, 13:56:08] Vitalii Kazymyrovych: можно 2 RTX 4080 взять
[26.09.2025, 13:56:18] Vitalii Kazymyrovych: Вместо 1 теслы
‎[26.09.2025, 14:31:54] ~Yuriy_R: Calculator result (5).pdf • ‎1 page ‎<attached: 00000797-Calculator result (5).pdf>
[26.09.2025, 14:32:03] ~Yuriy_R: должно быть бюджетнее
[26.09.2025, 14:39:39] Vitalii Kazymyrovych: Ну, по идее
[26.09.2025, 14:39:50] Vitalii Kazymyrovych: Главное, чтобы было 2 одинаковых карты
[26.09.2025, 14:39:59] ~Yuriy_R: Ну да
[26.09.2025, 14:40:10] Vitalii Kazymyrovych: Потому что если будет одна 4080, а другая, допустим 4090, мы работать не будем
[26.09.2025, 14:40:42] ~Yuriy_R: Понимаю. И те товарищи тоже шарят. Просто серверно решение оно само по себе дороже из-за платформы
[29.09.2025, 14:59:37] Vitalii Kazymyrovych: Привет. У вас там партнер был, которому хотели ВМС презентовать. Есть от него новости?
[29.09.2025, 15:00:02] ~Yuriy_R: Привет. Он пока притих. Кп отправили
[29.09.2025, 16:04:30] Vitalii Kazymyrovych: дернешь?
‎[29.09.2025, 16:04:48] ~Yuriy_R: ‎<attached: 00000807-AUDIO-2025-09-29-16-04-48.opus>
[29.09.2025, 16:07:17] Vitalii Kazymyrovych: и школы заодно😅
‎[29.09.2025, 16:07:45] ~Yuriy_R: ‎<attached: 00000809-AUDIO-2025-09-29-16-07-45.opus>
[29.09.2025, 16:08:25] Vitalii Kazymyrovych: задержались они там
[29.09.2025, 16:08:31] Vitalii Kazymyrovych: пусть домой едут)
[29.09.2025, 16:08:36] ~Yuriy_R: 🤣🤣👍
[29.09.2025, 16:08:44] Vitalii Kazymyrovych: мы их ждем
[30.09.2025, 13:14:15] ~Yuriy_R: https://polytron.ai/main.html?id=w5nz8y7p
[30.09.2025, 13:14:20] ~Yuriy_R: Знаешь такие камеры?
[30.09.2025, 13:14:44] ~Yuriy_R: Сейчас общался с партнером. Говорит что наши камеры с аналитикой любой - тьфу, гамно
[30.09.2025, 13:14:47] ~Yuriy_R: 🤣
[30.09.2025, 13:15:13] Vitalii Kazymyrovych: Не пересекался
[30.09.2025, 13:15:36] Vitalii Kazymyrovych: Сайт зачетный, конечно
[30.09.2025, 13:15:49] Vitalii Kazymyrovych: Наши, в смысле наш ACAP?
[30.09.2025, 13:16:39] ~Yuriy_R: Аксис и все остальные
[30.09.2025, 13:17:14] Vitalii Kazymyrovych: Ну, в дизайн они точно денег дохрена вложили
[30.09.2025, 13:17:47] ~Yuriy_R: 🤣🤣
‎[30.09.2025, 13:18:25] Vitalii Kazymyrovych: Меня смущает только ссылка на Google + на сайте ‎<attached: 00000824-PHOTO-2025-09-30-13-18-25.jpg>
[30.09.2025, 13:18:34] Vitalii Kazymyrovych: Который мертв, сколько я себя помню
[30.09.2025, 13:18:47] Vitalii Kazymyrovych: Ну и тот факт, что их ссылки вообще никуда не ведут
‎[30.09.2025, 13:19:20] ~Yuriy_R: ‎<attached: 00000827-AUDIO-2025-09-30-13-19-20.opus>
‎[30.09.2025, 13:19:35] ~Yuriy_R: ‎<attached: 00000828-AUDIO-2025-09-30-13-19-35.opus>
[30.09.2025, 13:20:25] Vitalii Kazymyrovych: Ну, вот, да
[30.09.2025, 13:20:32] Vitalii Kazymyrovych: Есть такое ощущение
‎[01.10.2025, 12:50:26] ~Yuriy_R: ‎<attached: 00000831-AUDIO-2025-10-01-12-50-26.opus>
[01.10.2025, 14:36:06] Vitalii Kazymyrovych: Привет
[01.10.2025, 14:36:09] Vitalii Kazymyrovych: Могу
[01.10.2025, 14:36:18] Vitalii Kazymyrovych: Но время еще уточнить надо
[01.10.2025, 14:36:32] ~Yuriy_R: Уточни плиз, скинь Исмаилу
[01.10.2025, 14:36:39] ~Yuriy_R: Он договорится с заказчиком
‎[02.10.2025, 12:46:04] ~Yuriy_R: ‎<attached: 00000837-AUDIO-2025-10-02-12-46-04.opus>
[02.10.2025, 12:47:11] Vitalii Kazymyrovych: Привет
[02.10.2025, 13:23:38] ~Yuriy_R: Виталя, А что если мы вашу ВМС по ставим на регистратор AXIS?
[02.10.2025, 13:24:16] Vitalii Kazymyrovych: А какая там ОС?
[02.10.2025, 13:35:40] ~Yuriy_R: Винда
[02.10.2025, 13:43:10] Vitalii Kazymyrovych: В таком случае, да, без проблем
[02.10.2025, 13:44:21] ~Yuriy_R: ок, тогда с портала скачаю
[02.10.2025, 13:45:02] Vitalii Kazymyrovych: Так ее там все еще нет) ‎<This message was edited>
[02.10.2025, 13:45:09] ~Yuriy_R: скинь плиз
[02.10.2025, 13:45:44] Vitalii Kazymyrovych: https://storage.googleapis.com/incoresoft-install/vms/25.1/incoresoft-vms-install-x64.zip
[02.10.2025, 13:46:28] ~Yuriy_R: Качаю
[02.10.2025, 13:46:41] ~Yuriy_R: Там же просто ставить, без бубна?
[02.10.2025, 13:47:22] Vitalii Kazymyrovych: Вроде бы без
‎[02.10.2025, 14:28:36] ~Yuriy_R: ‎<attached: 00000850-AUDIO-2025-10-02-14-28-36.opus>
‎[02.10.2025, 14:30:08] ~Yuriy_R: В сервисах запущено ‎<attached: 00000851-PHOTO-2025-10-02-14-30-08.jpg>
[02.10.2025, 15:46:14] Vitalii Kazymyrovych: А почему ты заходишь на 2443?)
[02.10.2025, 15:46:16] Vitalii Kazymyrovych: 2002
‎[02.10.2025, 15:47:23] ~Yuriy_R: ‎<attached: 00000854-AUDIO-2025-10-02-15-47-23.opus>
‎[02.10.2025, 15:48:11] ~Yuriy_R: ‎<attached: 00000855-AUDIO-2025-10-02-15-48-11.opus>
[02.10.2025, 15:48:39] Vitalii Kazymyrovych: Ща, погоди, может я неправ
[02.10.2025, 15:49:17] Vitalii Kazymyrovych: Ладно, 2443 правильно
[02.10.2025, 15:49:19] Vitalii Kazymyrovych: Я неправ
[02.10.2025, 15:49:29] Vitalii Kazymyrovych: А
[02.10.2025, 15:49:30] ~Yuriy_R: 🤣👍
[02.10.2025, 15:49:31] Vitalii Kazymyrovych: Погоди
[02.10.2025, 15:50:02] Vitalii Kazymyrovych: При первом коннекте таки 2002
‎[02.10.2025, 15:50:42] ~Yuriy_R: ‎<attached: 00000863-AUDIO-2025-10-02-15-50-42.opus>
[02.10.2025, 15:50:58] Vitalii Kazymyrovych: Там сконфигурируешь бд
[02.10.2025, 15:51:06] Vitalii Kazymyrovych: И тебя автоматом редиректнет на 2443
‎[02.10.2025, 15:51:22] ~Yuriy_R: ‎<attached: 00000866-AUDIO-2025-10-02-15-51-22.opus>
[02.10.2025, 15:57:41] Vitalii Kazymyrovych: Ну да
[02.10.2025, 15:57:49] Vitalii Kazymyrovych: Все правильно
[02.10.2025, 15:57:58] Vitalii Kazymyrovych: Про 2001 я тебе и не говорил ничего
‎[02.10.2025, 15:59:37] ~Yuriy_R: ‎<attached: 00000870-AUDIO-2025-10-02-15-59-37.opus>
‎[02.10.2025, 15:59:47] ~Yuriy_R: ‎<attached: 00000871-VIDEO-2025-10-02-15-59-47.mp4>
[02.10.2025, 16:43:28] Vitalii Kazymyrovych: У нас отдельно дока по вмс пишется
[03.10.2025, 13:06:44] Vitalii Kazymyrovych: Это интегратор или конечный заказчик?
[03.10.2025, 13:07:07] ~Yuriy_R: Это походу заказчик
[03.10.2025, 13:07:19] ~Yuriy_R: Привет
[03.10.2025, 13:07:29] ~Yuriy_R: Мы только одно совещание закончили
[03.10.2025, 13:07:30] Vitalii Kazymyrovych: привет
[03.10.2025, 13:07:33] ~Yuriy_R: И сразу второе
[03.10.2025, 13:07:44] Vitalii Kazymyrovych: пхах, ясно
[03.10.2025, 13:07:48] Vitalii Kazymyrovych: веселая пятница
[03.10.2025, 13:07:55] ~Yuriy_R: Да ппц
[03.10.2025, 13:34:31] ~Yuriy_R: Они походу не понимают что им сервер нужен
[03.10.2025, 13:35:18] ~Yuriy_R: Выходи к ним🤣 к зиме прийдешь
[03.10.2025, 13:35:32] Vitalii Kazymyrovych: Ахахаххаха
[03.10.2025, 13:35:38] Vitalii Kazymyrovych: Сложные товарищи
[03.10.2025, 13:53:27] Vitalii Kazymyrovych: Не хочешь смотаться?)
[03.10.2025, 13:55:00] ~Yuriy_R: С удовольствием
[03.10.2025, 13:55:32] Vitalii Kazymyrovych: Намучаемся мы с ними
[03.10.2025, 13:55:39] Vitalii Kazymyrovych: Если нам дадут проект
[03.10.2025, 13:55:42] ~Yuriy_R: Да ппц тупые
[06.10.2025, 10:13:52] ~Yuriy_R: Виталя привет. Как дела?
[06.10.2025, 10:14:18] ~Yuriy_R: Слушай, там деом лицензии получится сегодня сделать?
[06.10.2025, 12:44:52] Vitalii Kazymyrovych: Привет
[06.10.2025, 12:45:36] Vitalii Kazymyrovych: Кого чего?)
[06.10.2025, 12:46:07] ~Yuriy_R: Помнишь проект заводили на FR и LPR для тестов в киргизии
[07.10.2025, 09:31:58] ~Yuriy_R: Виталя привет
[07.10.2025, 09:37:30] Vitalii Kazymyrovych: Привет
[07.10.2025, 09:38:44] ~Yuriy_R: Че там?
[07.10.2025, 09:38:52] ~Yuriy_R: Как дела?
[07.10.2025, 09:39:04] ~Yuriy_R: Чето я демо лицензии не увидел=(
[07.10.2025, 09:39:16] Vitalii Kazymyrovych: Упс
[07.10.2025, 09:39:21] Vitalii Kazymyrovych: Сделаю сейчас
[07.10.2025, 09:39:40] ~Yuriy_R: 🥳👍пасиб
[07.10.2025, 11:29:38] Vitalii Kazymyrovych: 2 канала будет?
[07.10.2025, 11:29:49] ~Yuriy_R: да, две камеры
[07.10.2025, 11:33:00] Vitalii Kazymyrovych: наберу?
[07.10.2025, 11:33:12] ~Yuriy_R: Сек
[07.10.2025, 11:33:28] ~Yuriy_R: ‎Voice call  ‎17 min
[07.10.2025, 11:36:33] ~Yuriy_R: https://ukuk.gp.kg/
[07.10.2025, 13:24:42] Vitalii Kazymyrovych: Юра
[07.10.2025, 13:24:46] Vitalii Kazymyrovych: Где школы?)
[07.10.2025, 13:24:54] ~Yuriy_R: в Китае=)))
[07.10.2025, 13:24:58] ~Yuriy_R: Ща напишу
[07.10.2025, 13:25:16] Vitalii Kazymyrovych: Они туда на ПМЖ уехали?
[07.10.2025, 13:25:40] Vitalii Kazymyrovych: А кто именно в Китае, не пойму? Интегратор? Или администрация?
[07.10.2025, 13:25:50] ~Yuriy_R: Заказчик
[07.10.2025, 13:26:21] Vitalii Kazymyrovych: А заказчик - это администрация школ? Или кто?
[07.10.2025, 13:26:31] Vitalii Kazymyrovych: Что они в Китае забыли😅
[07.10.2025, 13:28:18] ~Yuriy_R: скорее всего это как администрация района
[07.10.2025, 13:28:27] ~Yuriy_R: написал партнеру, жду ответа
[07.10.2025, 15:54:34] ~Yuriy_R: Слушай, не могу в вежу зайти
[07.10.2025, 15:55:02] Vitalii Kazymyrovych: Где?
[07.10.2025, 15:55:09] ~Yuriy_R: на ноуте у себя
[07.10.2025, 15:55:21] ~Yuriy_R: можешь подключиться?
[07.10.2025, 16:28:31] ~Yuriy_R: Так, пока отошёл от компа.  Позже если у тебя будет время
‎[08.10.2025, 10:17:29] Vitalii Kazymyrovych: Incoresoft_VEZHA_Automatic_License-Plate_Recognition(ALPR)_1_0_54_aarch64 1.eap ‎document omitted
‎[08.10.2025, 10:17:29] Vitalii Kazymyrovych: Incoresoft_VEZHA_Face_Recognition_1_0_36_aarch64.eap ‎document omitted
‎[08.10.2025, 10:17:29] Vitalii Kazymyrovych: AXIS ACAP Integration Guide-v30-20250918_104813.pdf • ‎13 pages ‎<attached: 00000928-AXIS ACAP Integration Guide-v30-20250918_104813.pdf>
[08.10.2025, 10:39:27] ~Yuriy_R: Так и не заработало
[08.10.2025, 11:10:25] Vitalii Kazymyrovych: дай энидеск
[08.10.2025, 11:15:38] ~Yuriy_R: 1884251685
‎[08.10.2025, 11:15:54] ~Yuriy_R: ‎<attached: 00000932-AUDIO-2025-10-08-11-15-54.opus>
[08.10.2025, 11:25:54] Vitalii Kazymyrovych: пустишь?
‎[08.10.2025, 11:26:10] ~Yuriy_R: ‎<attached: 00000934-AUDIO-2025-10-08-11-26-10.opus>
[08.10.2025, 11:43:07] Vitalii Kazymyrovych: Можешь ставить ACAP
[08.10.2025, 11:43:16] Vitalii Kazymyrovych: Напишешь, как что-то еще сломается
[08.10.2025, 11:43:23] Vitalii Kazymyrovych: 😅
[08.10.2025, 11:43:29] ~Yuriy_R: Смотри
[08.10.2025, 11:43:34] ~Yuriy_R: почему камеру не видит
[08.10.2025, 11:43:39] ~Yuriy_R: Акап уже на нее поставил
[08.10.2025, 11:45:30] Vitalii Kazymyrovych: Ща
‎[08.10.2025, 11:55:51] ~Yuriy_R: ‎<attached: 00000942-AUDIO-2025-10-08-11-55-51.opus>
[08.10.2025, 11:59:46] ~Yuriy_R: 🤣🤣🤣
[08.10.2025, 11:59:57] ~Yuriy_R: У меня лицензия истекла
[08.10.2025, 12:01:14] Vitalii Kazymyrovych: ‎Video call  ‎15 min
[08.10.2025, 12:26:54] Vitalii Kazymyrovych: Камеру нельзя удалить, потому что система перед удалением пытается к ней подключиться
[08.10.2025, 12:27:10] Vitalii Kazymyrovych: Так что, для того, чтобы удалить камеру, нужно скначала ее подключить
[08.10.2025, 12:27:10] Vitalii Kazymyrovych: Вот
[08.10.2025, 12:27:17] Vitalii Kazymyrovych: 🤣
[08.10.2025, 12:27:47] ~Yuriy_R: 🤣🤣👍
[08.10.2025, 12:27:53] ~Yuriy_R: А она на работе
‎[08.10.2025, 12:28:42] ~Yuriy_R: ‎<attached: 00000952-AUDIO-2025-10-08-12-28-42.opus>
[08.10.2025, 12:29:41] Vitalii Kazymyrovych: Напиши логин и пароль от камеры
[08.10.2025, 12:29:47] Vitalii Kazymyrovych: попробую добавить
[08.10.2025, 12:29:58] ~Yuriy_R: root root
‎[08.10.2025, 12:39:49] ~Yuriy_R: ‎<attached: 00000956-AUDIO-2025-10-08-12-39-49.opus>
‎[08.10.2025, 12:55:25] Vitalii Kazymyrovych: Все ‎<attached: 00000957-PHOTO-2025-10-08-12-55-25.jpg>
[08.10.2025, 12:55:32] Vitalii Kazymyrovych: Лайва с ACAP в ВМС нету)
[08.10.2025, 12:55:39] Vitalii Kazymyrovych: Но распознавания есть
[08.10.2025, 12:57:14] Vitalii Kazymyrovych: Для LPR сначала добавляешь камеру, потом уже ставишь приложуху
‎[08.10.2025, 12:59:01] ~Yuriy_R: ‎<attached: 00000961-AUDIO-2025-10-08-12-59-01.opus>
‎[08.10.2025, 12:59:35] Vitalii Kazymyrovych: ‎<attached: 00000962-PHOTO-2025-10-08-12-59-35.jpg>
‎[08.10.2025, 12:59:35] Vitalii Kazymyrovych: ‎<attached: 00000963-PHOTO-2025-10-08-12-59-35.jpg>
‎[08.10.2025, 12:59:35] Vitalii Kazymyrovych: ‎<attached: 00000964-PHOTO-2025-10-08-12-59-35.jpg>
[08.10.2025, 12:59:46] Vitalii Kazymyrovych: Это то, что надо на камере сделать
[08.10.2025, 13:00:02] Vitalii Kazymyrovych: Не знаю, что именно из этого помогло нам ее подключить
‎[08.10.2025, 13:00:06] ~Yuriy_R: ‎<attached: 00000967-AUDIO-2025-10-08-13-00-06.opus>
[08.10.2025, 13:00:09] Vitalii Kazymyrovych: Поэтому делай все
[08.10.2025, 13:00:12] Vitalii Kazymyrovych: И подключай через ONVIF
[08.10.2025, 13:00:29] Vitalii Kazymyrovych: типа того
‎[08.10.2025, 13:00:32] ~Yuriy_R: ‎<attached: 00000971-AUDIO-2025-10-08-13-00-32.opus>
[08.10.2025, 13:31:23] Vitalii Kazymyrovych: Нит
[10.10.2025, 10:11:31] ~Yuriy_R: Хотел спросить-распознавание номеров камер Axis Афганистана конкретно или Саудовской Аравии был опыт? Где есть арабская вязь
[10.10.2025, 10:11:48] ~Yuriy_R: Салам. Это партнёр один спрашивает
[10.10.2025, 11:28:16] Vitalii Kazymyrovych: Привет
[10.10.2025, 11:29:42] Vitalii Kazymyrovych: Сейчас уточню
[10.10.2025, 11:29:48] ~Yuriy_R: 👍
‎[10.10.2025, 11:30:31] Vitalii Kazymyrovych: ‎<attached: 00000978-PHOTO-2025-10-10-11-30-31.jpg>
‎[10.10.2025, 11:30:59] ~Yuriy_R: ‎<attached: 00000979-AUDIO-2025-10-10-11-30-59.opus>
[10.10.2025, 14:22:38] Vitalii Kazymyrovych: Как там твои тесты?
[10.10.2025, 14:22:57] Vitalii Kazymyrovych: Когда будешь камеру отправлять партнеру?
[10.10.2025, 14:23:11] Vitalii Kazymyrovych: Как там дела у школ?)
[10.10.2025, 14:23:15] Vitalii Kazymyrovych: И как твои дела?
‎[10.10.2025, 14:24:04] ~Yuriy_R: ‎<attached: 00000984-AUDIO-2025-10-10-14-24-04.opus>
‎[12.10.2025, 21:11:08] ~Yuriy_R: ‎<attached: 00000985-PHOTO-2025-10-12-21-11-08.jpg>
‎[12.10.2025, 21:11:21] ~Yuriy_R: ‎<attached: 00000986-PHOTO-2025-10-12-21-11-21.jpg>
‎[12.10.2025, 21:11:36] ~Yuriy_R: ‎<attached: 00000987-PHOTO-2025-10-12-21-11-36.jpg>
‎[12.10.2025, 21:11:53] ~Yuriy_R: ‎<attached: 00000988-PHOTO-2025-10-12-21-11-53.jpg>
[12.10.2025, 21:12:14] ~Yuriy_R: Виталя привет. Сорри что поздно. только сел поработать. Поставил LPR, но не запускается.
‎[12.10.2025, 21:12:24] ~Yuriy_R: LRP_log.txt ‎document omitted
[12.10.2025, 21:12:39] ~Yuriy_R: Вот лог. Я так понял что ругается на лицензию
[13.10.2025, 11:14:35] Vitalii Kazymyrovych: Привет. Дашь подключиться?
[13.10.2025, 11:14:56] ~Yuriy_R: привет. пока немогу. не дома
[13.10.2025, 11:19:51] Vitalii Kazymyrovych: Ок
‎[13.10.2025, 11:25:22] ~Yuriy_R: ‎<attached: 00000995-AUDIO-2025-10-13-11-25-22.opus>
‎[13.10.2025, 11:25:46] ~Yuriy_R: ‎<attached: 00000996-AUDIO-2025-10-13-11-25-46.opus>
[13.10.2025, 11:41:13] Vitalii Kazymyrovych: Понял. Давай завтра тогда. Удачи там)
‎[13.10.2025, 11:41:57] ~Yuriy_R: ‎<attached: 00000998-AUDIO-2025-10-13-11-41-57.opus>
[13.10.2025, 11:42:25] Vitalii Kazymyrovych: Да я сам не знаю, куда смотреть
[13.10.2025, 11:42:39] Vitalii Kazymyrovych: Надо подключаться и смотреть везде, где можно
[13.10.2025, 11:42:45] Vitalii Kazymyrovych: Это творческий процесс
‎[13.10.2025, 11:42:59] ~Yuriy_R: ‎<attached: 00001002-AUDIO-2025-10-13-11-42-59.opus>
[13.10.2025, 11:43:31] Vitalii Kazymyrovych: Я, когда тебе FR настраивал, 4-х людей еще подключил, чтобы разобраться, что там где поломалось.
‎[13.10.2025, 11:44:28] ~Yuriy_R: ‎<attached: 00001004-AUDIO-2025-10-13-11-44-28.opus>
[13.10.2025, 17:03:17] Vitalii Kazymyrovych: Да, в основном проблема из-за того, что инстал не чистый. 

Но то, что система сырая и с багами - отрицать не буду)
[13.10.2025, 17:03:56] Vitalii Kazymyrovych: Стандартный вопрос: как дела у школ?
[13.10.2025, 17:03:57] Vitalii Kazymyrovych: )
[13.10.2025, 17:05:56] Vitalii Kazymyrovych: И да
[13.10.2025, 17:06:04] Vitalii Kazymyrovych: Поздравляю с пополнением в семье)
‎[13.10.2025, 17:06:25] ~Yuriy_R: ‎<attached: 00001010-AUDIO-2025-10-13-17-06-25.opus>
‎[13.10.2025, 17:06:53] ~Yuriy_R: ‎<attached: 00001011-PHOTO-2025-10-13-17-06-53.jpg>
[13.10.2025, 17:08:49] Vitalii Kazymyrovych: СРОЧНО НАПИСАТЬ РЕШЕНИЕ🤣
[13.10.2025, 17:09:26] Vitalii Kazymyrovych: Но, при этом, не так быстро...
[14.10.2025, 12:41:50] ~Yuriy_R: Виталя привет
[14.10.2025, 12:42:01] ~Yuriy_R: Как дел? могу дать доступ
[14.10.2025, 13:20:35] Vitalii Kazymyrovych: Привет
[14.10.2025, 13:20:39] Vitalii Kazymyrovych: Давай
[14.10.2025, 13:20:44] Vitalii Kazymyrovych: Посмотрим, что у тебя там
[14.10.2025, 13:21:01] ~Yuriy_R: 🤣а теперь пока не могу. Ща другой совещание будет
[14.10.2025, 13:21:15] Vitalii Kazymyrovych: щит
[14.10.2025, 13:21:17] Vitalii Kazymyrovych: ладно
[14.10.2025, 13:21:19] Vitalii Kazymyrovych: напишешь
[14.10.2025, 13:21:25] ~Yuriy_R: Ага:)
‎[14.10.2025, 14:54:44] ~Yuriy_R: ‎<attached: 00001024-AUDIO-2025-10-14-14-54-44.opus>
[14.10.2025, 14:58:51] ~Yuriy_R: 1 884 251 685
[14.10.2025, 14:59:15] Vitalii Kazymyrovych: теперь я на звонке
[14.10.2025, 14:59:18] Vitalii Kazymyrovych: гы
[14.10.2025, 14:59:22] ~Yuriy_R: 🤣🤣👍
‎[14.10.2025, 14:59:28] ~Yuriy_R: ‎<attached: 00001029-AUDIO-2025-10-14-14-59-28.opus>
[14.10.2025, 14:59:44] Vitalii Kazymyrovych: не могу послушать
[14.10.2025, 14:59:55] ~Yuriy_R: Потом напиши
[14.10.2025, 15:01:59] Vitalii Kazymyrovych: подключаюсь
[14.10.2025, 15:02:46] Vitalii Kazymyrovych: ‎Voice call  ‎15 min
‎[14.10.2025, 15:19:42] ~Yuriy_R: ‎<attached: 00001034-AUDIO-2025-10-14-15-19-42.opus>
[14.10.2025, 15:21:56] Vitalii Kazymyrovych: Уже лучше
[14.10.2025, 17:06:28] Vitalii Kazymyrovych: Сори, задержался на звонке
[14.10.2025, 17:06:32] Vitalii Kazymyrovych: Могу подключиться?
[14.10.2025, 17:06:49] ~Yuriy_R: Блин, ща дочку мыть будем
[14.10.2025, 17:07:12] Vitalii Kazymyrovych: Давай завтра утром)
‎[14.10.2025, 17:28:11] ~Yuriy_R: ‎<attached: 00001040-AUDIO-2025-10-14-17-28-11.opus>
[14.10.2025, 17:28:36] Vitalii Kazymyrovych: ок
‎[14.10.2025, 17:29:34] ~Yuriy_R: ‎<attached: 00001042-AUDIO-2025-10-14-17-29-34.opus>
‎[14.10.2025, 17:29:50] ~Yuriy_R: ‎<attached: 00001043-AUDIO-2025-10-14-17-29-50.opus>
[14.10.2025, 17:45:44] ~Yuriy_R: Как успехи?
[14.10.2025, 17:45:57] Vitalii Kazymyrovych: мы все сломали
[14.10.2025, 17:45:58] ~Yuriy_R: Смотрю танцуешь, да и бубен уже принес
[14.10.2025, 17:46:02] ~Yuriy_R: 🤣🤣👍
[14.10.2025, 17:46:08] Vitalii Kazymyrovych: капитально
‎[14.10.2025, 17:46:36] ~Yuriy_R: ‎<attached: 00001049-AUDIO-2025-10-14-17-46-36.opus>
[14.10.2025, 17:55:36] Vitalii Kazymyrovych: 19 - новый айпишник?
‎[14.10.2025, 17:55:54] ~Yuriy_R: ‎<attached: 00001051-AUDIO-2025-10-14-17-55-54.opus>
[14.10.2025, 17:57:59] ~Yuriy_R:
‎[14.10.2025, 17:58:12] ~Yuriy_R: ‎video omitted
‎[14.10.2025, 17:58:13] ~Yuriy_R: ‎video omitted
[14.10.2025, 18:02:28] ~Yuriy_R: Чё думаешь?
[14.10.2025, 18:04:21] Vitalii Kazymyrovych: Хорошо. Но нам еще нужно разобраться, почему мы поломались. Или тебе уже комп нужен? ‎<This message was edited>
[14.10.2025, 18:04:39] ~Yuriy_R: Пока нет. Ковыряй
[14.10.2025, 18:18:21] Vitalii Kazymyrovych: Чтобы ты понимал, у нас система никогда еще так не ломалась. По крайней мере, на моей памяти.
‎[14.10.2025, 18:19:26] ~Yuriy_R: ‎<attached: 00001059-AUDIO-2025-10-14-18-19-26.opus>
‎[14.10.2025, 18:19:31] ~Yuriy_R: ‎<attached: 00001060-AUDIO-2025-10-14-18-19-31.opus>
[14.10.2025, 18:20:04] Vitalii Kazymyrovych: Так вот в том и дело, что сломалось где-то там, где обычно не ломается
[14.10.2025, 18:20:10] Vitalii Kazymyrovych: И мы не можем понять, где
[14.10.2025, 18:37:55] ~Yuriy_R: Ну я ничего не ковырял
[14.10.2025, 19:05:51] Vitalii Kazymyrovych: Короче
[14.10.2025, 19:06:31] Vitalii Kazymyrovych: Сноси все и ставь по новой
[14.10.2025, 19:06:36] Vitalii Kazymyrovych: Восстановлению не подлежит
[14.10.2025, 19:06:59] ~Yuriy_R: Зашибись:) архивы последних версий скинешь?
[14.10.2025, 19:07:19] Vitalii Kazymyrovych: Скину. Тебе сегодня нужны?
‎[14.10.2025, 19:07:57] ~Yuriy_R: ‎<attached: 00001069-AUDIO-2025-10-14-19-07-57.opus>
[14.10.2025, 19:08:33] Vitalii Kazymyrovych: Да, к камерам вопросов нет
‎[14.10.2025, 19:17:33] ~Yuriy_R: ‎video omitted
[14.10.2025, 19:17:40] ~Yuriy_R: Поржать
[14.10.2025, 19:18:36] Vitalii Kazymyrovych: КАК
[14.10.2025, 19:18:44] ~Yuriy_R: 😀
[14.10.2025, 19:18:44] Vitalii Kazymyrovych: это можно было не заметить?
[14.10.2025, 19:19:19] ~Yuriy_R: Другой вопрос - почему он не остановился и не посмотрел насколько сильно вшатал
[20.10.2025, 16:51:11] Vitalii Kazymyrovych: Привет
[20.10.2025, 16:51:14] Vitalii Kazymyrovych: как дела?
[20.10.2025, 17:07:55] ~Yuriy_R: Привет. Все хорошо. Отдыхаю:)
[20.10.2025, 17:08:17] ~Yuriy_R: Ты как?
[20.10.2025, 17:08:44] Vitalii Kazymyrovych: Тоже
[20.10.2025, 17:08:56] Vitalii Kazymyrovych: Я с четверга намотал тыщи 3 километров
[20.10.2025, 17:09:27] ~Yuriy_R: Ого, где катаешься?
[20.10.2025, 17:09:52] ~Yuriy_R: Чё там у вас обстрелы стихли? Чето в новостях смотрел что вроде чето подписали
[20.10.2025, 17:11:02] Vitalii Kazymyrovych: Хз, кто что подписал и по обстрелам тоже ничего не могу сказать. Я на это вообще внимания не обращаю.
[20.10.2025, 18:29:44] ~Yuriy_R: Как ты не обращаешь. Очкова же
‎[20.10.2025, 18:30:48] Vitalii Kazymyrovych: ‎<attached: 00001087-AUDIO-2025-10-20-18-30-48.opus>
‎[20.10.2025, 18:31:33] Vitalii Kazymyrovych: ‎<attached: 00001088-AUDIO-2025-10-20-18-31-33.opus>
[20.10.2025, 18:33:50] ~Yuriy_R: Блин ты с таким спокойствием об этом всем говоришь. Не пожелаю никому такую жизнь
[20.10.2025, 18:36:49] ~Yuriy_R: Поскорей бы все это дерьмо закончилось
[03.11.2025, 11:22:53] ~Yuriy_R: Виталя привет. Как дела? Я вышел на работу=)
[03.11.2025, 11:23:04] Vitalii Kazymyrovych: Привет
[03.11.2025, 11:23:08] Vitalii Kazymyrovych: Отлично
[03.11.2025, 11:23:15] Vitalii Kazymyrovych: Ты как?
[03.11.2025, 11:23:20] ~Yuriy_R: Че там за пилот вы ставите?
[03.11.2025, 11:23:24] Vitalii Kazymyrovych: Аххаха
[03.11.2025, 11:23:31] Vitalii Kazymyrovych: Вежа + ВМС
[03.11.2025, 11:23:31] ~Yuriy_R: Нормуль, соскучился по работе=)
[03.11.2025, 11:23:33] Vitalii Kazymyrovych: 25 каналов
[03.11.2025, 11:24:10] ~Yuriy_R: Кому ставите?
[03.11.2025, 11:24:54] ~Yuriy_R: если занят с ними, то потом спишемся
[03.11.2025, 14:10:51] Vitalii Kazymyrovych: занят, но вообще не с ними
[03.11.2025, 14:11:27] Vitalii Kazymyrovych: У меня сегодня день сумасшедший сегодня
[03.11.2025, 14:11:45] ~Yuriy_R: поэтому не дергаю тебя=)
[17.11.2025, 13:12:52] Vitalii Kazymyrovych: Привет. Ксавьер попросил звонок организовать. Данияр подключился. У тебя есть время?

https://teams.microsoft.com/meet/31232389118228?p=4I4Balcs4A6O4lBinU
[24.12.2025, 11:32:41] ~Yuriy_R: Вит привет
[24.12.2025, 11:32:44] ~Yuriy_R: Как дела?
[24.12.2025, 12:24:04] Vitalii Kazymyrovych: Привет. Чем ближе к концу года, тем веселее.
[24.12.2025, 12:24:16] ~Yuriy_R: Аналогично
[24.12.2025, 12:24:23] ~Yuriy_R: Завтра пойдем в Билайн
[24.12.2025, 12:24:29] ~Yuriy_R: Почитал твои ответы
[24.12.2025, 12:24:36] ~Yuriy_R: готовлюсь
[24.12.2025, 12:25:10] Vitalii Kazymyrovych: Помощь нужна?
[24.12.2025, 12:25:29] ~Yuriy_R: да думал пробежаться с тобой, минут на 10
[24.12.2025, 12:25:53] Vitalii Kazymyrovych: Можем хоть сейчас
[24.12.2025, 12:25:57] ~Yuriy_R: давай
[24.12.2025, 12:26:08] ~Yuriy_R: по ватсапу?
[24.12.2025, 12:36:36] Vitalii Kazymyrovych: Area control: 100 x 4 MP cameras client
Core i7/i9 or Ryzen 7/9, RTX 4070, 64 GB RAM, NVMe SSD, Windows 11 Pro, 1–10 GbE
[24.12.2025, 12:40:07] Vitalii Kazymyrovych: Guard room: 64 x 4 MP cameras client
Intel Core i5/i7 or Ryzen 5/7, RTX 2060+, 32–64 GB RAM, 256 GB+ NVMe SSD, Windows 11 Pro, 1–10 GbE
[24.12.2025, 12:43:03] Vitalii Kazymyrovych: VMS
https://storage.googleapis.com/incoresoft-install/vms/dev-25.1/incoresoft-vms-core.tgz
https://storage.googleapis.com/incoresoft-install/vms/dev-25.1/incoresoft-vms-recording.tgz
 
https://storage.googleapis.com/incoresoft-install/vms/dev-25.1/incoresoft-vms-core-x64.zip
https://storage.googleapis.com/incoresoft-install/vms/dev-25.1/incoresoft-vms-recording-x64.zip
 
VEZHA
https://storage.googleapis.com/incoresoft-install/dev-25.1/incoresoft-middleware-core.tgz
https://storage.googleapis.com/incoresoft-install/dev-25.1/incoresoft-process-runner.tgz
 
https://storage.googleapis.com/incoresoft-install/dev-25.1/incoresoft-middleware-core-x64.zip
https://storage.googleapis.com/incoresoft-install/dev-25.1/incoresoft-process-runner-x64.zip
[02.01.2026, 11:50:53] ~Yuriy_R: Вит привет. С новым годом🥳🥳
[05.01.2026, 11:23:48] ~Yuriy_R: Вит привет. Как дела?
[05.01.2026, 17:23:35] Vitalii Kazymyrovych: Привет. С Новым Годом)
[05.01.2026, 17:23:48] ~Yuriy_R: Ооо, Вит, ты вернулся
[05.01.2026, 17:23:49] Vitalii Kazymyrovych: Весело, как всегда)
[05.01.2026, 17:27:18] ~Yuriy_R: Жив, здоров?
[05.01.2026, 17:27:34] Vitalii Kazymyrovych: Ага
[05.01.2026, 17:27:37] ~Yuriy_R: Сегодня звонил чувак из Kcell
[05.01.2026, 17:27:46] ~Yuriy_R: Хотят пилот
[05.01.2026, 17:28:08] Vitalii Kazymyrovych: После отпуска как-то полегче. Все равно задач дофига, но, по крайней мере, все разгребаемо.
[05.01.2026, 17:28:21] Vitalii Kazymyrovych: Напомни, что за проект
[05.01.2026, 17:28:52] ~Yuriy_R: Ты в отпуске был?
[05.01.2026, 17:30:01] Vitalii Kazymyrovych: У нас каникулы были
[05.01.2026, 17:30:05] Vitalii Kazymyrovych: С 31 по сегодня
[05.01.2026, 17:30:07] ~Yuriy_R: Kcell это наш оператор сотовой связи. У них есть различные объекты, офисы, магазины. Все обвязано видеонаблюдением. У них сейчас Milestone стоит. Хотят заменить
[05.01.2026, 17:32:00] ~Yuriy_R: А мы сегодня вышли на работу
[05.01.2026, 17:43:48] ~Yuriy_R: Завтра сможем созвон с Кселл?
[05.01.2026, 18:16:54] Vitalii Kazymyrovych: Без проблем
[05.01.2026, 18:17:04] Vitalii Kazymyrovych: В первой половине дня было бы отлично
[05.01.2026, 18:17:24] ~Yuriy_R: Напиши время, я с утра создам.
[05.01.2026, 18:17:46] ~Yuriy_R: Ещё согласую с ними время
[05.01.2026, 20:07:58] Vitalii Kazymyrovych: 10 по Киеву
[05.01.2026, 20:08:32] ~Yuriy_R: С утра напишу им. Поздно у нас уже
[06.01.2026, 07:10:09] ~Yuriy_R: Вит привет. Слушай, сможем на час вперед сместить встречу? 11 по твоему времени. У них там накладка получается
[06.01.2026, 08:51:36] ~Yuriy_R: Вит
[06.01.2026, 09:25:18] Vitalii Kazymyrovych: Доброе утро
[06.01.2026, 09:25:21] Vitalii Kazymyrovych: Не вопрос
[06.01.2026, 09:30:11] ~Yuriy_R: Отлично. Давай ща переделаем
[06.01.2026, 12:41:38] ~Yuriy_R: По камерам 
Кодек 254 
Камеры есть минимум 2 мегапикселя максимум 4
[06.01.2026, 12:42:06] ~Yuriy_R: еще есть другой проект. Там есть регистратор такой https://www.hanwhavision.com/en/products/video-recorder/appliance/A/prp-5000h16/
[06.01.2026, 12:42:34] ~Yuriy_R: Посмотри  характеристики , получиться ли поставить на него Incoresoft?
[06.01.2026, 12:43:30] ~Yuriy_R: Первичный поток у нас 25 fps
[06.01.2026, 12:43:30] ~Yuriy_R: Вторичный 6 fps
[06.01.2026, 12:43:30] ~Yuriy_R: По камерам вроде только эта инфа нужна была
‎[06.01.2026, 12:51:16] ~Yuriy_R: ‎<attached: 00001155-AUDIO-2026-01-06-12-51-16.opus>
[06.01.2026, 21:23:03] Vitalii Kazymyrovych: 3 раза можно отключить/включить лицензию
[07.01.2026, 08:09:03] ~Yuriy_R: Если её от дельно в бекапе держать потом залить можно короче да
[07.01.2026, 08:09:03] ~Yuriy_R: Не важно какой интервал времени пройдёт с момента приобретения
[07.01.2026, 08:09:03] ~Yuriy_R: И сколько стоит
[07.01.2026, 08:09:04] ~Yuriy_R: Мне надо начинать считать уже
[07.01.2026, 10:42:47] Vitalii Kazymyrovych: Привет
[07.01.2026, 10:43:07] Vitalii Kazymyrovych: Не понял вопрос
[07.01.2026, 10:43:10] Vitalii Kazymyrovych: Да
[07.01.2026, 10:43:24] Vitalii Kazymyrovych: $100 мсрп
[07.01.2026, 10:48:32] Vitalii Kazymyrovych: Сколько точно камер? 200?
[07.01.2026, 11:30:49] ~Yuriy_R: 100 на пилот
[07.01.2026, 11:41:49] Vitalii Kazymyrovych: Я считаю тогда навскидку 70 - по 2 МП и 30 по 4 МП. Ок?
[07.01.2026, 11:52:47] ~Yuriy_R: Ну думаю да
[07.01.2026, 12:16:57] Vitalii Kazymyrovych: Подожди, а разрешение сабстрима такое же как у основного?
[07.01.2026, 12:17:09] Vitalii Kazymyrovych: Только фпс отличается?
‎[07.01.2026, 12:25:43] ~Yuriy_R: ‎<attached: 00001171-AUDIO-2026-01-07-12-25-43.opus>
[07.01.2026, 12:31:50] Vitalii Kazymyrovych: Жду
[08.01.2026, 06:49:56] ~Yuriy_R: Intel(R) Xeon(R) CPU E5-2630 v3 @ 2.40GHz
[08.01.2026, 06:49:56] ~Yuriy_R: 32 гб оперативы
[08.01.2026, 06:49:56] ~Yuriy_R: Накатил виндовс сервер 22 стандарт
[08.01.2026, 06:49:56] ~Yuriy_R: Таких 2
‎[08.01.2026, 06:54:20] ~Yuriy_R: ‎<attached: 00001177-AUDIO-2026-01-08-06-54-20.opus>
[08.01.2026, 06:57:49] ~Yuriy_R: 81 терабайт пространства
[08.01.2026, 10:27:37] Vitalii Kazymyrovych: Привет. Если ты переустанавливаешь систему, тебе нужно удалить ключ и добавить заново. Если система та же, но ты из бекапа восстанавливаешь данные, ничего повторно активировать не нужно.
[08.01.2026, 10:27:49] Vitalii Kazymyrovych: Разрешение сабстрима узнал?
[08.01.2026, 10:28:34] ~Yuriy_R: Привет. Нет, забил написать ему🤦‍♂️ Он уже готов ставить
[08.01.2026, 10:33:35] Vitalii Kazymyrovych: Сразу скажу, что проц 100 каналов не вытянет
[08.01.2026, 10:35:12] ~Yuriy_R: а то что у них их два?
[08.01.2026, 10:35:35] Vitalii Kazymyrovych: а
[08.01.2026, 10:35:36] ~Yuriy_R: Один как менеджер и рекордер, и второй как рекордер
[08.01.2026, 10:35:38] Vitalii Kazymyrovych: Пропустил
[08.01.2026, 10:35:47] Vitalii Kazymyrovych: Да, 2 - отлично
[08.01.2026, 10:35:53] Vitalii Kazymyrovych: даже с запасом
[08.01.2026, 10:37:53] ~Yuriy_R: Два в одной мамке
[08.01.2026, 10:38:08] ~Yuriy_R: Оперативы хватает?
[08.01.2026, 10:38:19] ~Yuriy_R: 1 поток 
1920*1080р
15фпс
[08.01.2026, 10:38:19] ~Yuriy_R: 2 поток 
640*360
6fps
[08.01.2026, 10:43:16] Vitalii Kazymyrovych: С головой
[08.01.2026, 10:44:10] Vitalii Kazymyrovych: Хах, на самом деле, с такими параметрами, может и один проц вывезет)
‎[08.01.2026, 10:44:25] Vitalii Kazymyrovych: VMS Calculator result (7).pdf • ‎2 pages ‎<attached: 00001195-VMS Calculator result (7).pdf>
[08.01.2026, 10:46:38] ~Yuriy_R: Слушай, он просит КП на 1000 каналов пока что. Для бюджетирования. Ты можешь посчитать с ех поддержкой и остальными делами?
[08.01.2026, 10:55:26] ~Yuriy_R: На месяц же им будем давать на пилот?
‎[08.01.2026, 10:56:25] ~Yuriy_R: ‎<attached: 00001198-AUDIO-2026-01-08-10-56-25.opus>
[08.01.2026, 11:47:07] Vitalii Kazymyrovych: Ага
[08.01.2026, 11:48:11] Vitalii Kazymyrovych: Вы проект зарегали?
[08.01.2026, 11:48:28] ~Yuriy_R: Сейчас Исмаил освободиться и зарегает
[08.01.2026, 11:48:51] Vitalii Kazymyrovych: Ок. Я без проекта не могу квоту сделать.
[08.01.2026, 11:50:07] ~Yuriy_R: Да конечно. Все равно к ним в понедельник поеду. На завтра не смогут перенести, т.к. там по процедуре безопасности долга процедура
‎[08.01.2026, 14:25:34] ~Yuriy_R: ‎<attached: 00001204-AUDIO-2026-01-08-14-25-34.opus>
[08.01.2026, 14:26:27] Vitalii Kazymyrovych: Один, конечно
[08.01.2026, 14:27:08] ~Yuriy_R: 👍
‎[08.01.2026, 14:33:51] ~Yuriy_R: ‎<attached: 00001207-AUDIO-2026-01-08-14-33-51.opus>
‎[08.01.2026, 19:01:48] Vitalii Kazymyrovych: Quotation - S00713.pdf • ‎1 page ‎<attached: 00001208-Quotation - S00713.pdf>
[09.01.2026, 13:00:43] Vitalii Kazymyrovych: Привет
[09.01.2026, 13:00:50] ~Yuriy_R: Даров
[09.01.2026, 13:00:51] Vitalii Kazymyrovych: Ты квоту кселл уже отправлял?
[09.01.2026, 13:01:03] ~Yuriy_R: Я сейлу нашему отправил, он уже будет отправлять
[09.01.2026, 13:01:08] Vitalii Kazymyrovych: Стоп
[09.01.2026, 13:01:14] Vitalii Kazymyrovych: Не отправляйте
[09.01.2026, 13:01:16] Vitalii Kazymyrovych: Новости есть
[09.01.2026, 13:01:17] ~Yuriy_R: блин
[09.01.2026, 13:01:20] Vitalii Kazymyrovych: Тебе понравится)
[09.01.2026, 13:01:21] ~Yuriy_R: че там?
[09.01.2026, 13:03:14] Vitalii Kazymyrovych: Ща
[09.01.2026, 13:04:23] Vitalii Kazymyrovych: ‎Group call  ‎2 invited
[09.01.2026, 13:16:05] Vitalii Kazymyrovych: https://docs.vms.incoresoft.com/vd/vms-documentation-home-8849238.html
[09.01.2026, 13:16:28] Vitalii Kazymyrovych: https://storage.googleapis.com/incoresoft-install/vms/dev-25.1/incoresoft-vms-core-x64.zip
https://storage.googleapis.com/incoresoft-install/vms/dev-25.1/incoresoft-vms-recording-x64.zip
[09.01.2026, 13:27:42] Vitalii Kazymyrovych: Интернет здох
[09.01.2026, 13:27:58] ~Yuriy_R: понтяно. Ладно, давай, хорошоих выходных
[09.01.2026, 13:28:05] ~Yuriy_R: в понедельник напишу
[09.01.2026, 13:29:11] Vitalii Kazymyrovych: Взаимно
‎[09.01.2026, 13:37:47] ~Yuriy_R: ‎<attached: 00001227-AUDIO-2026-01-09-13-37-47.opus>
[09.01.2026, 13:50:04] ~Yuriy_R: Пожалуйста, укажите минимальные требования к интернет-трафику для:
-	1 (одной) камеры;
[09.01.2026, 13:50:04] ~Yuriy_R: просим предоставить информацию о подтверждённых положительных результатах применения системы в части повышения уровня безопасности на производственных объектах.
[09.01.2026, 13:50:14] ~Yuriy_R: Это вопросы от Альтезы
[09.01.2026, 13:51:54] Vitalii Kazymyrovych: У тебя ж должен быть прайс, не?
[09.01.2026, 13:52:00] Vitalii Kazymyrovych: От кого?)
[09.01.2026, 13:52:45] Vitalii Kazymyrovych: Что за странный вопрос
[09.01.2026, 13:52:51] Vitalii Kazymyrovych: Ну, 4–6 Мбит/с
[09.01.2026, 13:53:40] Vitalii Kazymyrovych: Какой именно системы? VMS или VEZHA?
[09.01.2026, 13:53:41] ~Yuriy_R: На эту аналитику дай плиз MSRP:
1) Age & Gender Detection
2) Face Recognition
3) Gun Detection
4) Heat Map
5) LPR
6) Smoke & Fire Detection
7) Traffic Analytics
8) Operator AI
‎[09.01.2026, 13:54:23] ~Yuriy_R: ‎<attached: 00001237-AUDIO-2026-01-09-13-54-23.opus>
‎[09.01.2026, 13:54:49] ~Yuriy_R: ‎<attached: 00001238-AUDIO-2026-01-09-13-54-49.opus>
‎[09.01.2026, 13:55:00] ~Yuriy_R: ‎<attached: 00001239-AUDIO-2026-01-09-13-55-00.opus>
‎[09.01.2026, 13:55:00] Vitalii Kazymyrovych: https://docs.portal.incoresoft.com/partners_documents/Price%20IncoreSoft%202025%20Incoresoft%20MSRP.pdf ‎<attached: 00001240-PHOTO-2026-01-09-13-55-00.jpg>
[09.01.2026, 13:55:27] ~Yuriy_R: Оперативненько=)
[09.01.2026, 13:56:20] Vitalii Kazymyrovych: На портале лежит. У дистрибьюторов есть доступ.
‎[09.01.2026, 13:56:33] ~Yuriy_R: ‎<attached: 00001243-AUDIO-2026-01-09-13-56-33.opus>
[09.01.2026, 13:56:55] Vitalii Kazymyrovych: Там только OPerator AI нет, по моему. Для него MSRP - 500$
[09.01.2026, 13:57:09] ~Yuriy_R: 👍
[12.01.2026, 11:08:13] ~Yuriy_R: Вит привет. Я у заказчика. Ща будем ставить
[12.01.2026, 11:12:35] Vitalii Kazymyrovych: Привет
[12.01.2026, 11:13:08] Vitalii Kazymyrovych: Сейчас сделаю ключ
[12.01.2026, 11:13:33] ~Yuriy_R: Давай. Амир ща воткнет флэшку в сервер. Начнем ставить
[12.01.2026, 11:14:16] Vitalii Kazymyrovych: RSTAT-5FM9Q-4ZXS7-6QFM6-RT22C
[12.01.2026, 12:20:56] ~Yuriy_R: Так, поставили, запустили. Ща скину файлик
‎[12.01.2026, 12:28:09] ~Yuriy_R: key.txt ‎document omitted
‎[12.01.2026, 12:33:20] Vitalii Kazymyrovych: license_RSTAT-5FM9Q-4ZXS7-6QFM6-RT22C.txt ‎<attached: 00001253-license_RSTAT-5FM9Q-4ZXS7-6QFM6-RT22C.txt>
‎[12.01.2026, 12:50:09] ~Yuriy_R: ‎<attached: 00001254-AUDIO-2026-01-12-12-50-09.opus>
‎[12.01.2026, 13:06:24] ~Yuriy_R: ‎<attached: 00001255-PHOTO-2026-01-12-13-06-24.jpg>
[12.01.2026, 13:06:36] ~Yuriy_R: Уточни что тут вписывать плиз
[12.01.2026, 13:07:49] Vitalii Kazymyrovych: Не понял вопрос, давай еще раз. Под разные кого?)
‎[12.01.2026, 13:08:13] ~Yuriy_R: ‎<attached: 00001258-AUDIO-2026-01-12-13-08-13.opus>
[12.01.2026, 13:09:12] Vitalii Kazymyrovych: Это я уточню. А причем здесь rtsp?)
[12.01.2026, 13:09:43] Vitalii Kazymyrovych: Вот пример: 

Server URL: ldap://ad-1.corp.incoresoft.com:389
Admin, Password: логин пароль от твоей учетки
Search Base: CN=Users,DC=corp,DC=incoresoft,DC=com
Search filter: пустой
‎[12.01.2026, 13:09:48] ~Yuriy_R: ‎<attached: 00001261-AUDIO-2026-01-12-13-09-48.opus>
[12.01.2026, 13:10:21] Vitalii Kazymyrovych: Еще раз переслушай свое первое голосовое)
‎[12.01.2026, 13:10:23] ~Yuriy_R: ‎<attached: 00001263-VIDEO-2026-01-12-13-10-23.mp4>
‎[12.01.2026, 13:11:47] ~Yuriy_R: ‎<attached: 00001264-AUDIO-2026-01-12-13-11-47.opus>
‎[12.01.2026, 13:13:07] Vitalii Kazymyrovych: Стрим другой попробуй выбрать ‎<attached: 00001265-PHOTO-2026-01-12-13-13-07.jpg>
‎[12.01.2026, 13:14:13] ~Yuriy_R: ‎<attached: 00001266-AUDIO-2026-01-12-13-14-13.opus>
[12.01.2026, 13:14:41] Vitalii Kazymyrovych: Эта история?

https://docs.incoresoft.com/ivug/latest/rtsp-stream-url-examples-142540970.html
‎[12.01.2026, 13:15:37] ~Yuriy_R: ‎<attached: 00001268-AUDIO-2026-01-12-13-15-37.opus>
[12.01.2026, 13:20:52] Vitalii Kazymyrovych: Ты путаешь добавление в вмс и вежу ‎<This message was edited>
[12.01.2026, 13:21:15] ~Yuriy_R: Точно🤦‍♂️
‎[12.01.2026, 13:21:25] Vitalii Kazymyrovych: ‎<attached: 00001271-PHOTO-2026-01-12-13-21-25.jpg>
[12.01.2026, 13:21:32] Vitalii Kazymyrovych: Это в веже
[12.01.2026, 13:32:04] ~Yuriy_R: А может видео не идти из-за отсутствия видеокарты на сервере?
‎[12.01.2026, 13:46:09] ~Yuriy_R: ‎<attached: 00001274-AUDIO-2026-01-12-13-46-09.opus>
‎[12.01.2026, 13:48:36] ~Yuriy_R: ‎<attached: 00001275-VIDEO-2026-01-12-13-48-36.mp4>
‎[12.01.2026, 14:02:30] ~Yuriy_R: ‎<attached: 00001276-PHOTO-2026-01-12-14-02-30.jpg>
‎[12.01.2026, 14:03:04] ~Yuriy_R: ‎<attached: 00001277-PHOTO-2026-01-12-14-03-04.jpg>
‎[12.01.2026, 14:06:39] ~Yuriy_R: ‎<attached: 00001278-VIDEO-2026-01-12-14-06-39.mp4>
[12.01.2026, 14:34:50] Vitalii Kazymyrovych: Сейчас буду разбираться
[12.01.2026, 14:35:08] Vitalii Kazymyrovych: Слушай, а в админ панели есть картинка?
‎[12.01.2026, 14:35:48] ~Yuriy_R: ‎<attached: 00001281-AUDIO-2026-01-12-14-35-48.opus>
‎[12.01.2026, 14:36:51] Vitalii Kazymyrovych: ‎<attached: 00001282-PHOTO-2026-01-12-14-36-51.jpg>
[12.01.2026, 14:36:54] Vitalii Kazymyrovych: Вот так пробовал смотреть?
‎[12.01.2026, 14:38:44] ~Yuriy_R: ‎<attached: 00001284-AUDIO-2026-01-12-14-38-44.opus>
‎[12.01.2026, 14:47:25] ~Yuriy_R: ‎<attached: 00001285-AUDIO-2026-01-12-14-47-25.opus>
‎[12.01.2026, 14:47:46] ~Yuriy_R: ‎<attached: 00001286-AUDIO-2026-01-12-14-47-46.opus>
‎[12.01.2026, 14:50:43] ~Yuriy_R: ‎<attached: 00001287-PHOTO-2026-01-12-14-50-43.jpg>
‎[12.01.2026, 14:50:43] ~Yuriy_R: ‎<attached: 00001288-AUDIO-2026-01-12-14-50-43.opus>
[12.01.2026, 14:51:01] Vitalii Kazymyrovych: Та 100% не рдп
[12.01.2026, 14:51:09] Vitalii Kazymyrovych: Надо логи
[12.01.2026, 14:51:18] Vitalii Kazymyrovych: Как подключали камеры?
‎[12.01.2026, 14:52:42] ~Yuriy_R: ‎<attached: 00001292-AUDIO-2026-01-12-14-52-42.opus>
[12.01.2026, 14:53:23] Vitalii Kazymyrovych: Ну, все правильно
[12.01.2026, 14:53:43] Vitalii Kazymyrovych: Подключаешь регистратор и забираешь все потоки
‎[12.01.2026, 14:54:56] ~Yuriy_R: ‎<attached: 00001295-AUDIO-2026-01-12-14-54-56.opus>
[12.01.2026, 14:55:24] Vitalii Kazymyrovych: У меня завтра отгул
‎[12.01.2026, 14:55:56] ~Yuriy_R: ‎<attached: 00001297-AUDIO-2026-01-12-14-55-56.opus>
[12.01.2026, 14:56:03] Vitalii Kazymyrovych: Вечером только буду за компом
[12.01.2026, 14:56:10] Vitalii Kazymyrovych: Забери логи с сервера
‎[12.01.2026, 14:57:03] ~Yuriy_R: ‎<attached: 00001300-AUDIO-2026-01-12-14-57-03.opus>
‎[12.01.2026, 14:59:31] ~Yuriy_R: ‎<attached: 00001301-AUDIO-2026-01-12-14-59-31.opus>
[12.01.2026, 15:40:25] Vitalii Kazymyrovych: Договорились
[12.01.2026, 15:40:35] Vitalii Kazymyrovych: Когда Данияр с выставки возвращается?
‎[12.01.2026, 15:41:14] ~Yuriy_R: ‎<attached: 00001304-AUDIO-2026-01-12-15-41-14.opus>
[12.01.2026, 15:44:38] ~Yuriy_R: Ты лучше ему напиши
[12.01.2026, 15:46:18] Vitalii Kazymyrovych: Ок
‎[13.01.2026, 06:38:55] ~Yuriy_R: ‎<attached: 00001307-VIDEO-2026-01-13-06-38-55.mp4>
‎[13.01.2026, 06:42:48] ~Yuriy_R: ‎<attached: 00001308-VIDEO-2026-01-13-06-42-48.mp4>
[13.01.2026, 18:48:31] ~Yuriy_R: Привет. Как дела? Получилось посмотреть?
[14.01.2026, 09:45:27] Vitalii Kazymyrovych: Привет. Логи забрал?
‎[14.01.2026, 09:46:09] ~Yuriy_R: ‎<attached: 00001311-AUDIO-2026-01-14-09-46-09.opus>
‎[14.01.2026, 09:46:23] ~Yuriy_R: ‎<attached: 00001312-AUDIO-2026-01-14-09-46-23.opus>
[14.01.2026, 09:54:48] ~Yuriy_R: Нашел?
[14.01.2026, 09:55:10] Vitalii Kazymyrovych: Да, есть
[14.01.2026, 09:55:13] Vitalii Kazymyrovych: Смотрим
[14.01.2026, 09:55:22] ~Yuriy_R: 👍
[14.01.2026, 10:53:49] Vitalii Kazymyrovych: открой обновления и сфоткай версии
[14.01.2026, 10:54:28] ~Yuriy_R: Сейчас попрошу. Я не там=)
[14.01.2026, 10:56:56] Vitalii Kazymyrovych: Давай
‎[14.01.2026, 11:03:03] ~Yuriy_R: ‎<attached: 00001320-AUDIO-2026-01-14-11-03-03.opus>
[14.01.2026, 11:03:07] ~Yuriy_R: ЖДемс
[14.01.2026, 11:03:28] ~Yuriy_R: Пока к вашему экзамену готовлюсь
[14.01.2026, 11:03:51] Vitalii Kazymyrovych: Обновляли все, как поставили?
[14.01.2026, 11:28:59] ~Yuriy_R: ‎Voice call  ‎8 sec
