[26.05.2025, 14:21:23] ~Daniyar: ‎Messages and calls are end-to-end encrypted. Only people in this chat can read, listen to, or share them.
[26.05.2025, 14:21:23] ~Daniyar:
[12.05.2025, 13:00:10] Vitalii Kazymyrovych: ‎Waiting for this message. This may take a while.
[12.05.2025, 13:00:25] ~Daniyar: ‎Waiting for this message. This may take a while.
[12.05.2025, 13:00:46] Vitalii Kazymyrovych: ‎Waiting for this message. This may take a while.
[12.05.2025, 13:01:04] ~Daniyar: ‎Waiting for this message. This may take a while.
[12.05.2025, 13:40:17] ~Daniyar:
[12.05.2025, 14:12:08] ~Daniyar: ‎Waiting for this message. This may take a while.
[12.05.2025, 17:44:54] Vitalii Kazymyrovych: ‎Waiting for this message. This may take a while.
[12.05.2025, 17:45:58] Vitalii Kazymyrovych: ‎Waiting for this message. This may take a while.
[12.05.2025, 17:47:49] ~Daniyar: ‎Waiting for this message. This may take a while.
[12.05.2025, 17:50:25] Vitalii Kazymyrovych: ‎Waiting for this message. This may take a while.
[12.05.2025, 17:55:52] ~Daniyar: ‎Waiting for this message. This may take a while.
[12.05.2025, 18:12:31] Vitalii Kazymyrovych: ‎Waiting for this message. This may take a while.
[12.05.2025, 18:13:08] ~Daniyar: ‎Waiting for this message. This may take a while.
[12.05.2025, 18:13:24] ~Daniyar: ‎Waiting for this message. This may take a while.
[12.05.2025, 18:44:17] Vitalii Kazymyrovych: ‎Waiting for this message. This may take a while.
[12.05.2025, 20:47:31] ~Daniyar: ‎Waiting for this message. This may take a while.
[13.05.2025, 09:03:06] Vitalii Kazymyrovych: ‎Waiting for this message. This may take a while.
[13.05.2025, 09:03:20] ~Daniyar: ‎Waiting for this message. This may take a while.
[13.05.2025, 09:03:24] ~Daniyar: ‎Waiting for this message. This may take a while.
[13.05.2025, 09:03:33] ~Daniyar: ‎Waiting for this message. This may take a while.
[13.05.2025, 09:47:54] Vitalii Kazymyrovych: ‎Waiting for this message. This may take a while.
[13.05.2025, 09:48:14] ~Daniyar: ‎Waiting for this message. This may take a while.
[13.05.2025, 09:48:16] ~Daniyar: ‎Waiting for this message. This may take a while.
[13.05.2025, 10:59:06] Vitalii Kazymyrovych: ‎Waiting for this message. This may take a while.
[13.05.2025, 11:02:13] ~Daniyar: ‎Waiting for this message. This may take a while.
[13.05.2025, 11:02:17] ~Daniyar:
[13.05.2025, 13:04:58] ~Daniyar: ‎Waiting for this message. This may take a while.
[13.05.2025, 13:44:36] Vitalii Kazymyrovych: ‎Waiting for this message. This may take a while.
[13.05.2025, 13:56:34] ~Daniyar: ‎Waiting for this message. This may take a while.
[13.05.2025, 13:56:45] ~Daniyar: ‎Waiting for this message. This may take a while.
[13.05.2025, 13:57:24] ~Daniyar: ‎Waiting for this message. This may take a while.
[13.05.2025, 16:04:21] Vitalii Kazymyrovych: ‎Waiting for this message. This may take a while.
[13.05.2025, 16:04:57] ~Daniyar: ‎Waiting for this message. This may take a while.
[13.05.2025, 16:05:18] ~Daniyar: ‎Waiting for this message. This may take a while.
[13.05.2025, 16:05:34] Vitalii Kazymyrovych: ‎Waiting for this message. This may take a while.
[13.05.2025, 16:07:48] Vitalii Kazymyrovych: ‎Waiting for this message. This may take a while.
[13.05.2025, 16:08:03] ~Daniyar: ‎Waiting for this message. This may take a while.
[13.05.2025, 17:35:49] Vitalii Kazymyrovych: ‎Waiting for this message. This may take a while.
[13.05.2025, 18:01:34] ~Daniyar: ‎Waiting for this message. This may take a while.
[13.05.2025, 18:04:56] Vitalii Kazymyrovych: ‎Waiting for this message. This may take a while.
[13.05.2025, 18:05:03] ~Daniyar: ‎Waiting for this message. This may take a while.
[14.05.2025, 12:59:46] Vitalii Kazymyrovych: ‎Waiting for this message. This may take a while.
[14.05.2025, 14:21:32] ~Daniyar: ‎Waiting for this message. This may take a while.
[14.05.2025, 14:21:39] ~Daniyar: ‎Waiting for this message. This may take a while.
[14.05.2025, 14:22:14] Vitalii Kazymyrovych: ‎Waiting for this message. This may take a while.
[14.05.2025, 14:24:43] ~Daniyar: ‎Waiting for this message. This may take a while.
[15.05.2025, 15:45:48] ~Daniyar: ‎Waiting for this message. This may take a while.
[15.05.2025, 15:45:49] ~Daniyar: ‎Waiting for this message. This may take a while.
[15.05.2025, 15:45:53] ~Daniyar: ‎Waiting for this message. This may take a while.
[15.05.2025, 15:45:58] ~Daniyar: ‎Waiting for this message. This may take a while.
[15.05.2025, 15:46:06] ~Daniyar: ‎Waiting for this message. This may take a while.
[15.05.2025, 15:46:07] ~Daniyar: ‎Waiting for this message. This may take a while.
[15.05.2025, 15:46:24] ~Daniyar: ‎Waiting for this message. This may take a while.
[15.05.2025, 15:46:47] ~Daniyar: ‎Waiting for this message. This may take a while.
[15.05.2025, 15:47:18] Vitalii Kazymyrovych: ‎Waiting for this message. This may take a while.
[15.05.2025, 15:47:23] ~Daniyar: ‎Waiting for this message. This may take a while.
[15.05.2025, 15:48:02] Vitalii Kazymyrovych: ‎Waiting for this message. This may take a while.
[15.05.2025, 15:48:13] ~Daniyar: ‎Waiting for this message. This may take a while.
[15.05.2025, 15:48:17] ~Daniyar: ‎Waiting for this message. This may take a while.
[15.05.2025, 15:48:36] ~Daniyar: ‎Waiting for this message. This may take a while.
[15.05.2025, 15:49:10] ~Daniyar: ‎Waiting for this message. This may take a while.
[15.05.2025, 15:49:16] ~Daniyar: ‎Waiting for this message. This may take a while.
[15.05.2025, 15:49:29] ~Daniyar: ‎Waiting for this message. This may take a while.
[15.05.2025, 15:49:38] ~Daniyar: ‎Waiting for this message. This may take a while.
[15.05.2025, 15:50:22] Vitalii Kazymyrovych: ‎Waiting for this message. This may take a while.
[15.05.2025, 15:52:59] ~Daniyar: ‎Waiting for this message. This may take a while.
[15.05.2025, 15:54:28] Vitalii Kazymyrovych: ‎Waiting for this message. This may take a while.
[15.05.2025, 15:54:57] ~Daniyar: ‎Waiting for this message. This may take a while.
[15.05.2025, 15:54:59] ~Daniyar: ‎Waiting for this message. This may take a while.
[15.05.2025, 15:58:08] Vitalii Kazymyrovych: ‎Waiting for this message. This may take a while.
[15.05.2025, 15:59:32] ~Daniyar: ‎Waiting for this message. This may take a while.
[15.05.2025, 16:09:30] Vitalii Kazymyrovych: ‎Waiting for this message. This may take a while.
[15.05.2025, 16:28:23] Vitalii Kazymyrovych: ‎Waiting for this message. This may take a while.
[15.05.2025, 16:29:15] Vitalii Kazymyrovych: ‎Waiting for this message. This may take a while.
[15.05.2025, 16:31:16] ~Daniyar: ‎Waiting for this message. This may take a while.
[15.05.2025, 16:31:58] Vitalii Kazymyrovych: ‎Waiting for this message. This may take a while.
[15.05.2025, 16:33:38] Vitalii Kazymyrovych: ‎Waiting for this message. This may take a while.
[15.05.2025, 16:35:47] ~Daniyar: ‎Waiting for this message. This may take a while.
[15.05.2025, 17:03:49] Vitalii Kazymyrovych: ‎Waiting for this message. This may take a while.
[15.05.2025, 17:07:13] ~Daniyar:
[15.05.2025, 19:25:54] Vitalii Kazymyrovych: ‎Waiting for this message. This may take a while.
[15.05.2025, 19:29:41] ~Daniyar: ‎Waiting for this message. This may take a while.
[15.05.2025, 19:33:27] ~Daniyar: ‎Waiting for this message. This may take a while.
[15.05.2025, 19:39:07] ~Daniyar: ‎Waiting for this message. This may take a while.
[15.05.2025, 19:39:19] ~Daniyar: ‎Waiting for this message. This may take a while.
[15.05.2025, 19:41:51] Vitalii Kazymyrovych: ‎Waiting for this message. This may take a while.
[15.05.2025, 19:52:14] Vitalii Kazymyrovych: ‎Waiting for this message. This may take a while.
[15.05.2025, 20:11:16] ~Daniyar: ‎Waiting for this message. This may take a while.
[15.05.2025, 20:12:50] ~Daniyar: ‎Waiting for this message. This may take a while.
[15.05.2025, 20:13:08] ~Daniyar: ‎Waiting for this message. This may take a while.
[15.05.2025, 20:13:24] ~Daniyar: ‎Waiting for this message. This may take a while.
[15.05.2025, 20:13:36] ~Daniyar: ‎Waiting for this message. This may take a while.
[15.05.2025, 20:16:37] Vitalii Kazymyrovych: ‎Waiting for this message. This may take a while.
[15.05.2025, 20:16:51] ~Daniyar: ‎Waiting for this message. This may take a while.
[15.05.2025, 20:17:03] ~Daniyar: ‎Waiting for this message. This may take a while.
[15.05.2025, 20:17:05] ~Daniyar: ‎Waiting for this message. This may take a while.
[15.05.2025, 20:17:13] ~Daniyar: ‎Waiting for this message. This may take a while.
[15.05.2025, 20:17:20] Vitalii Kazymyrovych: ‎Waiting for this message. This may take a while.
[15.05.2025, 20:17:32] Vitalii Kazymyrovych: ‎Waiting for this message. This may take a while.
[15.05.2025, 20:19:23] Vitalii Kazymyrovych: ‎Waiting for this message. This may take a while.
[15.05.2025, 20:20:00] ~Daniyar: ‎Waiting for this message. This may take a while.
[15.05.2025, 21:00:35] ~Daniyar: ‎Waiting for this message. This may take a while.
[15.05.2025, 21:00:38] ~Daniyar: ‎Waiting for this message. This may take a while.
[15.05.2025, 21:00:46] ~Daniyar: ‎Waiting for this message. This may take a while.
[15.05.2025, 21:00:53] ~Daniyar: ‎Waiting for this message. This may take a while.
[15.05.2025, 21:00:57] ~Daniyar: ‎Waiting for this message. This may take a while.
[15.05.2025, 21:01:03] ~Daniyar: ‎Waiting for this message. This may take a while.
[15.05.2025, 21:01:11] Vitalii Kazymyrovych: ‎Waiting for this message. This may take a while.
[15.05.2025, 21:20:50] Vitalii Kazymyrovych: ‎Waiting for this message. This may take a while.
[15.05.2025, 21:23:37] ~Daniyar: ‎Waiting for this message. This may take a while.
[16.05.2025, 06:56:46] ~Daniyar: ‎Waiting for this message. This may take a while.
[16.05.2025, 06:56:46] ~Daniyar: ‎Waiting for this message. This may take a while.
[16.05.2025, 06:56:47] ~Daniyar: ‎Waiting for this message. This may take a while.
[16.05.2025, 06:56:52] ~Daniyar: ‎Waiting for this message. This may take a while.
[16.05.2025, 08:03:13] Vitalii Kazymyrovych: ‎Waiting for this message. This may take a while.
[16.05.2025, 14:40:59] Vitalii Kazymyrovych: ‎Waiting for this message. This may take a while.
[16.05.2025, 15:34:25] ~Daniyar: ‎Waiting for this message. This may take a while.
[19.05.2025, 10:29:56] ~Daniyar: ‎Waiting for this message. This may take a while.
[19.05.2025, 10:29:59] ~Daniyar: ‎Waiting for this message. This may take a while.
[19.05.2025, 10:30:11] ~Daniyar: ‎Waiting for this message. This may take a while.
[19.05.2025, 10:30:14] ~Daniyar: ‎Waiting for this message. This may take a while.
[19.05.2025, 10:30:28] ~Daniyar: ‎Waiting for this message. This may take a while.
[19.05.2025, 10:30:33] ~Daniyar: ‎Waiting for this message. This may take a while.
[19.05.2025, 10:34:51] Vitalii Kazymyrovych: ‎Waiting for this message. This may take a while.
[19.05.2025, 10:34:54] Vitalii Kazymyrovych: ‎Waiting for this message. This may take a while.
[19.05.2025, 10:36:03] ~Daniyar: ‎Waiting for this message. This may take a while.
[19.05.2025, 12:45:40] ~Daniyar: ‎Waiting for this message. This may take a while.
[19.05.2025, 12:45:50] ~Daniyar: ‎Waiting for this message. This may take a while.
[19.05.2025, 13:05:16] ~Daniyar: ‎Waiting for this message. This may take a while.
[19.05.2025, 13:05:20] ~Daniyar: ‎Waiting for this message. This may take a while.
[19.05.2025, 13:05:28] ~Daniyar: ‎Waiting for this message. This may take a while.
[19.05.2025, 13:06:55] Vitalii Kazymyrovych: ‎Waiting for this message. This may take a while.
[19.05.2025, 14:58:44] ~Daniyar: ‎Waiting for this message. This may take a while.
[19.05.2025, 14:58:46] ~Daniyar: ‎Waiting for this message. This may take a while.
[19.05.2025, 15:09:30] Vitalii Kazymyrovych: ‎Waiting for this message. This may take a while.
[19.05.2025, 15:10:03] Vitalii Kazymyrovych: ‎Waiting for this message. This may take a while.
[19.05.2025, 15:10:36] Vitalii Kazymyrovych: ‎Waiting for this message. This may take a while.
[19.05.2025, 15:45:39] ~Daniyar: ‎Waiting for this message. This may take a while.
[19.05.2025, 15:45:40] ~Daniyar: ‎Waiting for this message. This may take a while.
[19.05.2025, 15:45:41] ~Daniyar: ‎Waiting for this message. This may take a while.
[19.05.2025, 15:47:10] Vitalii Kazymyrovych: ‎Waiting for this message. This may take a while.
[19.05.2025, 15:47:42] ~Daniyar: ‎Waiting for this message. This may take a while.
[19.05.2025, 16:12:26] Vitalii Kazymyrovych: ‎Waiting for this message. This may take a while.
[19.05.2025, 16:12:36] Vitalii Kazymyrovych: ‎Waiting for this message. This may take a while.
[19.05.2025, 16:13:01] ~Daniyar: ‎Waiting for this message. This may take a while.
[21.05.2025, 16:29:14] Vitalii Kazymyrovych: ‎Waiting for this message. This may take a while.
[21.05.2025, 16:31:21] ~Daniyar: ‎Waiting for this message. This may take a while.
[21.05.2025, 16:31:49] ~Daniyar: ‎Waiting for this message. This may take a while.
[21.05.2025, 16:33:14] ~Daniyar: ‎Waiting for this message. This may take a while.
[21.05.2025, 16:33:54] ~Daniyar: ‎Waiting for this message. This may take a while.
[21.05.2025, 16:34:35] ~Daniyar: ‎Waiting for this message. This may take a while.
[21.05.2025, 16:35:31] ~Daniyar: ‎Waiting for this message. This may take a while.
[21.05.2025, 16:39:41] ~Daniyar: ‎Waiting for this message. This may take a while.
[21.05.2025, 16:40:13] Vitalii Kazymyrovych: ‎Waiting for this message. This may take a while.
[21.05.2025, 16:40:27] ~Daniyar: ‎Waiting for this message. This may take a while.
[21.05.2025, 16:40:40] ~Daniyar: ‎Waiting for this message. This may take a while.
[21.05.2025, 16:40:43] ~Daniyar: ‎Waiting for this message. This may take a while.
[21.05.2025, 16:40:43] ~Daniyar: ‎Waiting for this message. This may take a while.
[21.05.2025, 16:40:43] ~Daniyar: ‎Waiting for this message. This may take a while.
[21.05.2025, 16:40:43] ~Daniyar: ‎Waiting for this message. This may take a while.
[21.05.2025, 16:52:17] Vitalii Kazymyrovych: ‎Waiting for this message. This may take a while.
[21.05.2025, 16:53:27] Vitalii Kazymyrovych: ‎Waiting for this message. This may take a while.
[21.05.2025, 16:54:12] ~Daniyar: ‎Waiting for this message. This may take a while.
[22.05.2025, 11:27:15] ~Daniyar: ‎Waiting for this message. This may take a while.
[22.05.2025, 11:27:17] ~Daniyar: ‎Waiting for this message. This may take a while.
[22.05.2025, 11:27:29] ~Daniyar: ‎Waiting for this message. This may take a while.
[22.05.2025, 11:27:32] ~Daniyar: ‎Waiting for this message. This may take a while.
[22.05.2025, 14:21:34] Vitalii Kazymyrovych: ‎Waiting for this message. This may take a while.
[22.05.2025, 14:27:08] ~Daniyar: ‎Waiting for this message. This may take a while.
[22.05.2025, 14:27:40] ~Daniyar: ‎Waiting for this message. This may take a while.
[22.05.2025, 17:11:40] Vitalii Kazymyrovych: ‎Waiting for this message. This may take a while.
[22.05.2025, 17:12:04] Vitalii Kazymyrovych: ‎Waiting for this message. This may take a while.
[22.05.2025, 17:13:03] Vitalii Kazymyrovych: ‎Waiting for this message. This may take a while.
[22.05.2025, 17:16:00] Vitalii Kazymyrovych: ‎Waiting for this message. This may take a while.
[22.05.2025, 17:17:19] ~Daniyar: ‎Waiting for this message. This may take a while.
[22.05.2025, 17:17:22] ~Daniyar: ‎Waiting for this message. This may take a while.
[22.05.2025, 17:17:27] ~Daniyar: ‎Waiting for this message. This may take a while.
[22.05.2025, 17:25:44] Vitalii Kazymyrovych: ‎Waiting for this message. This may take a while.
[22.05.2025, 17:39:37] ~Daniyar: ‎Waiting for this message. This may take a while.
[22.05.2025, 17:40:07] Vitalii Kazymyrovych: ‎Waiting for this message. This may take a while.
[26.05.2025, 12:14:30] ~Daniyar:
[26.05.2025, 13:02:28] ~Daniyar:
[26.05.2025, 13:32:51] ~Daniyar:
[26.05.2025, 13:48:28] ~Daniyar:
[26.05.2025, 17:09:35] Vitalii Kazymyrovych: Привет) У меня все ок, такая светомузыка в последнее время довольно часто.
[26.05.2025, 17:10:16] Vitalii Kazymyrovych: Давай личные вопросы тут обсуждать, на почте только то, что касается работы. А то бардак в письмах будет)
[26.05.2025, 17:10:41] ~Daniyar: Да ок
[26.05.2025, 17:10:55] ~Daniyar: Привет
‎[26.05.2025, 17:11:37] ~Daniyar: ‎<attached: 00000191-AUDIO-2025-05-26-17-11-37.opus>
[26.05.2025, 17:12:58] Vitalii Kazymyrovych: Гуд, но я сам, если будет время, тоже поищу футажи. По любому должны быть подходящие видосы.
[29.05.2025, 12:04:24] ~Daniyar: Виталя привет
[29.05.2025, 12:04:27] ~Daniyar: как дела?
[29.05.2025, 12:26:49] Vitalii Kazymyrovych: Привет. Все гуд, как у тебя? Есть новости?
[29.05.2025, 12:30:18] ~Daniyar: Все хорошо
[29.05.2025, 12:30:24] ~Daniyar: У нас нет новостей
[29.05.2025, 12:30:30] ~Daniyar: Сейл забегался
[29.05.2025, 12:30:35] ~Daniyar: Забыл походу про видео
[29.05.2025, 12:30:56] ~Daniyar: Мы щас один проект отгружаем
[29.05.2025, 12:31:00] ~Daniyar: Он этим занят
[29.05.2025, 12:31:03] ~Daniyar: Напомню ему
[29.05.2025, 12:31:14] ~Daniyar: В целом у нас же есть понимание
[29.05.2025, 12:34:42] ~Daniyar: написал партнеру
[29.05.2025, 12:34:50] ~Daniyar: запросил видео
[30.05.2025, 13:28:39] ~Daniyar: Виталий привет
[30.05.2025, 13:28:52] ~Daniyar: опять партнер звонил на счет Xprotect screen recorder
[30.05.2025, 13:28:57] ~Daniyar: есть что предложить
[30.05.2025, 13:28:59] ~Daniyar: ?
[30.05.2025, 13:29:08] ~Daniyar: это экзамены кто на права сдает
[30.05.2025, 13:29:13] ~Daniyar: хотят записывать
[30.05.2025, 13:33:48] Vitalii Kazymyrovych: Привет. Такого функционала в VMS сейчас нет и я даже примерно не могу сказать, когда появится.
[30.05.2025, 13:37:26] ~Daniyar: ок
[30.05.2025, 13:37:32] ~Daniyar: по метро скину письмо
[03.06.2025, 10:49:43] ~Daniyar: ‎Voice call  ‎59 sec
[03.06.2025, 10:51:21] Vitalii Kazymyrovych: ‎Voice call  ‎5 sec
[03.06.2025, 10:52:51] ~Daniyar: ‎Voice call  ‎4 min
[03.06.2025, 11:01:04] ~Daniyar: Виталя
напиши письмо  плиз и поставь в копию
-Alexandr.Davydov@muk.kz сейл кто ведет проект
- Vassiliy.Tsoy@muk.kz ген дир
[03.06.2025, 11:01:14] ~Daniyar: это по школам
[03.06.2025, 11:09:01] Vitalii Kazymyrovych: А что по школам?
[03.06.2025, 11:09:29] ~Daniyar: это же проект по школам
[03.06.2025, 11:09:36] ~Daniyar: FR на камеру
[03.06.2025, 11:09:41] Vitalii Kazymyrovych: А, понял
[03.06.2025, 11:09:46] Vitalii Kazymyrovych: Я думал, это тоже для метро
[03.06.2025, 11:10:39] ~Daniyar: нет
[03.06.2025, 11:11:10] Vitalii Kazymyrovych: Напиши модель камеры
[03.06.2025, 11:12:30] ~Daniyar: а с ARTPEC-7 работать не будет?
[03.06.2025, 11:12:35] Vitalii Kazymyrovych: Нет
[03.06.2025, 11:13:08] ~Daniyar: AXIS Q1808-LE
[03.06.2025, 11:13:11] ~Daniyar: такая есть
[03.06.2025, 11:13:34] ~Daniyar: а ты же говорил что это серверная часть
[03.06.2025, 11:13:38] ~Daniyar: я про метро
[03.06.2025, 11:14:20] Vitalii Kazymyrovych: Просто шла речь о том, что в метро тоже нужен FR.
[03.06.2025, 11:14:38] Vitalii Kazymyrovych: Чтобы распознавать людей, которые пересекают линию на постоянной основе
[03.06.2025, 11:14:45] ~Daniyar: мы же любую камеру можем использовать
ваше VMS+Object Detection или Smart VA
[03.06.2025, 11:14:56] Vitalii Kazymyrovych: С сервером - да
[03.06.2025, 11:15:05] ~Daniyar: это как опция
[03.06.2025, 11:15:12] ~Daniyar: хотят предложить заказчику
[03.06.2025, 11:15:17] ~Daniyar: чтобы он еще докупил
[03.06.2025, 11:16:00] ~Daniyar: вот такая камера есть https://www.axis.com/products/axis-q3538-lve
[03.06.2025, 11:16:17] Vitalii Kazymyrovych: Вроде подходит
[03.06.2025, 11:16:25] Vitalii Kazymyrovych: По характеристикам - точно
[03.06.2025, 11:41:24] Vitalii Kazymyrovych: Письмо сделаем ближе к вечеру. 

По срокам, предварительно, до 20 числа ACAP FR можно будет ставить.
[03.06.2025, 11:41:39] Vitalii Kazymyrovych: Расчет по метро сейчас сделаю.
[03.06.2025, 11:45:55] ~Daniyar: ок
[03.06.2025, 12:05:08] Vitalii Kazymyrovych: Зарегистрируйте проект по метро на платформе.
[03.06.2025, 12:06:50] ~Daniyar: Ок
[03.06.2025, 12:34:05] Vitalii Kazymyrovych: Вы уже знаете, какие камеры в метро будут стоять? Меня интересует разрешение и кодек. И сколько дней видеоархив? 

Это для расчета железа по VMS.
[03.06.2025, 12:36:00] ~Daniyar: Надо Юре написать
[03.06.2025, 12:36:13] ~Daniyar: Он соорентирует
[03.06.2025, 12:36:24] Vitalii Kazymyrovych: ок ‎<This message was edited>
[03.06.2025, 12:48:12] ~Daniyar: Виталя мне надо внести партнера для начало
[03.06.2025, 12:48:17] ~Daniyar: чтобы потом проект создать?
[03.06.2025, 12:49:58] Vitalii Kazymyrovych: Да, желательно
[03.06.2025, 12:51:45] ~Daniyar: отпрвил ссылку https://www.youtube.com/watch?v=eSzkjcXn28s партеру
[03.06.2025, 12:51:48] ~Daniyar: им понравилось
[03.06.2025, 12:52:01] ~Daniyar: наше у вас в ютубе
‎[03.06.2025, 12:52:16] ~Daniyar: ‎<attached: 00000258-PHOTO-2025-06-03-12-52-16.jpg>
[03.06.2025, 12:52:17] ~Daniyar: вот что пишут
[03.06.2025, 12:53:01] ~Daniyar: им нужен звуковой сигнал из звуковой колонки
[03.06.2025, 12:53:28] ~Daniyar: ну и кончено чтобы аларм отработал в VMS как событие для оператора
‎[03.06.2025, 12:58:32] Vitalii Kazymyrovych: У нас есть внутренние оповещения в VEZHA и можно для них устанавливать кастомные звуки ‎<attached: 00000262-PHOTO-2025-06-03-12-58-32.jpg>
[03.06.2025, 13:01:50] Vitalii Kazymyrovych: Но это, возможно, не лучший вариант, так как во внутненних оповещениях нельзя настраивать сложную логику, как в Event Manager. Соответственно, мы не сможем заблокировать отправку оповещений во время прибытия поезда. 

У них же есть система оповещения, которая сейчас работает? Если там есть API, мы можем просто отправлять аларм в их систему и дальше они там пусть используют звук, какой хотят. ‎<This message was edited>
[03.06.2025, 13:02:04] Vitalii Kazymyrovych: Ну и в VMS алармы будут, само собой. ‎<This message was edited>
[03.06.2025, 13:03:34] ~Daniyar: Ок
‎[03.06.2025, 13:03:59] ~Daniyar: ‎<attached: 00000266-AUDIO-2025-06-03-13-03-59.opus>
[03.06.2025, 13:04:28] Vitalii Kazymyrovych: Да, я помню, что ты прайс просил, скину.
[03.06.2025, 13:04:42] Vitalii Kazymyrovych: Для рассчета жду от Юры инфу по характеристикам камер.
‎[03.06.2025, 13:07:34] ~Daniyar: ‎<attached: 00000269-AUDIO-2025-06-03-13-07-34.opus>
[03.06.2025, 13:07:54] ~Daniyar: https://www.axis.com/products/axis-p1455-le
[03.06.2025, 13:08:53] ~Daniyar: в идеале можно использовать купольные камеры https://www.axis.com/products/axis-p3265-lve
[03.06.2025, 13:10:49] Vitalii Kazymyrovych: О, то, что нужно
[03.06.2025, 13:10:59] Vitalii Kazymyrovych: И сколько дней видеоархив?
[03.06.2025, 13:11:20] ~Daniyar: 30 l
[03.06.2025, 13:11:21] ~Daniyar: д
[03.06.2025, 13:46:09] ~Daniyar: ‎Voice call  ‎Answered on other device
[03.06.2025, 13:49:58] Vitalii Kazymyrovych: Если не получится, добавляй его просто как нового реселлера и я поставлю MUK дистрибьютором для него.
[03.06.2025, 13:50:01] ~Daniyar: ‎Video call  ‎Answered on other device
[03.06.2025, 13:52:14] ~Daniyar: Создал
[03.06.2025, 13:52:24] ~Daniyar: MicroTech LLC
[03.06.2025, 13:52:57] Vitalii Kazymyrovych: Готово
[03.06.2025, 13:53:21] ~Daniyar: дякую
[03.06.2025, 13:53:22] ~Daniyar: регаю
[03.06.2025, 13:56:04] ~Daniyar: у меня страна Азербайджанне прописывается
[03.06.2025, 13:56:11] ~Daniyar: только КЗ
[03.06.2025, 13:59:29] Vitalii Kazymyrovych: Попроси реселлера залогиниться и зарегать проект. У него же стоит страна Азербайджан. Я позже уточню, почему вы только в Казахстане можете регистрировать. 

Скорее всего потому, что MUK на платформе зарегистрирован со страной Казахстан.
‎[03.06.2025, 13:59:47] ~Daniyar: ‎<attached: 00000287-PHOTO-2025-06-03-13-59-47.jpg>
[03.06.2025, 14:00:01] Vitalii Kazymyrovych: А, гуд
‎[03.06.2025, 14:00:20] ~Daniyar: ‎<attached: 00000289-AUDIO-2025-06-03-14-00-20.opus>
[03.06.2025, 14:00:21] Vitalii Kazymyrovych: Все, жду инфу по требованиям к ВМС от разрабов и пишу письмо.
[03.06.2025, 14:00:51] Vitalii Kazymyrovych: Количество модулей и прочую информацию нужно прописывать в Description
[03.06.2025, 14:12:29] ~Daniyar: а как добавить теперь
[03.06.2025, 14:12:30] ~Daniyar: ?
‎[03.06.2025, 14:13:13] Vitalii Kazymyrovych: ‎<attached: 00000294-PHOTO-2025-06-03-14-13-13.jpg>
[03.06.2025, 14:16:24] ~Daniyar: прписал
[03.06.2025, 14:16:43] ~Daniyar: ты пока можешь расчет скинуть
[03.06.2025, 14:16:46] ~Daniyar: я подготовлю
[03.06.2025, 14:16:54] ~Daniyar: у меня по Axis уже готов
‎[03.06.2025, 14:17:24] Vitalii Kazymyrovych: Quotation - S00359.pdf • ‎1 page ‎<attached: 00000299-Quotation - S00359.pdf>
‎[03.06.2025, 14:17:24] Vitalii Kazymyrovych: Calculator result-4.pdf • ‎1 page ‎<attached: 00000300-Calculator result-4.pdf>
[03.06.2025, 15:01:10] ~Daniyar: cкинул расчет
[03.06.2025, 15:13:40] Vitalii Kazymyrovych: В письме не нужно дублировать? Просто тебе написать расчет по ВМС, когда получу?
[03.06.2025, 15:15:03] ~Daniyar: Продублируй плиз
[03.06.2025, 15:15:12] Vitalii Kazymyrovych: Ок
[10.06.2025, 12:37:22] ~Daniyar: ‎Voice call  ‎Answered on other device
[10.06.2025, 14:55:50] ~Daniyar: ‎Voice call  ‎2 min
[10.06.2025, 15:12:56] Vitalii Kazymyrovych: Погоди, а в VMS тоже пойдут только 23 камеры? Или все 83?
[10.06.2025, 15:13:34] ~Daniyar: все
‎[10.06.2025, 15:13:58] ~Daniyar: ‎<attached: 00000309-AUDIO-2025-06-10-15-13-58.opus>
[10.06.2025, 15:15:16] Vitalii Kazymyrovych: Из того, что сюда 100% можно добавить - это Smoke&Fire для обнаружения пожаров и Object Detection для контроля периметра (проход в запрещенные зоны, оставленные предметы и т. д.)

Еще опционально можно добавить Face Recognition для контроля доступа, но это если есть камеры на входах / выходах. ‎<This message was edited>
[10.06.2025, 15:15:21] Vitalii Kazymyrovych: А что там за камеры?
[10.06.2025, 15:16:40] ~Daniyar: Да давай
[10.06.2025, 15:16:49] ~Daniyar: Axis P серия
[10.06.2025, 15:17:19] Vitalii Kazymyrovych: Тогда без проблем
[10.06.2025, 15:18:02] Vitalii Kazymyrovych: Я сделаю без FR. Потом добавим, если что.
[10.06.2025, 15:18:13] ~Daniyar: Давай сразу добавим
[10.06.2025, 15:18:29] Vitalii Kazymyrovych: Хорошо. Штук 5 будет достаточно.
[10.06.2025, 15:19:41] ~Daniyar: Да
‎[10.06.2025, 15:30:33] Vitalii Kazymyrovych: Quotation - S00382.pdf • ‎2 pages ‎<attached: 00000319-Quotation - S00382.pdf>
‎[10.06.2025, 15:30:33] Vitalii Kazymyrovych: Calculator result-5.pdf • ‎1 page ‎<attached: 00000320-Calculator result-5.pdf>
[10.06.2025, 15:31:19] Vitalii Kazymyrovych: Рассчет по железу для VMS, как обычно, позже. С каким разрешением, FPS и кодеком будут работать камеры?
‎[10.06.2025, 15:36:16] ~Daniyar: ‎<attached: 00000322-AUDIO-2025-06-10-15-36-16.opus>
[10.06.2025, 17:25:09] Vitalii Kazymyrovych: Approximate results for 83 IP cameras (Main stream - 5MP, 15fps, H264/Sub stream - 640x360, 15fps, H264):
Number of servers: 1
Server platform: Intel Xeon Silver 4509Y/Intel Core i5-12500 or better
CPU load on server: up to 75%
Server RAM: 2x16 GB
Storage requirements for 30 days archive:  332.1 TB
LAN bandwidth: 615 Mbit/s
Required storage write speed: 64 MB/s
[10.06.2025, 17:25:14] Vitalii Kazymyrovych: Это для шахт
[10.06.2025, 19:07:04] ~Daniyar: Виталя отправь пожалуйста в почту, Исмаил переправит в делл
[11.06.2025, 10:57:28] Vitalii Kazymyrovych: Привет. Хорошо, сейчас
[11.06.2025, 16:01:00] ~Daniyar: Виталий
[11.06.2025, 16:01:04] ~Daniyar: Привет
[11.06.2025, 16:02:39] ~Daniyar: ‎Voice call  ‎3 min
[11.06.2025, 16:05:37] Vitalii Kazymyrovych: Сейчас я уточню по поводу диска
[11.06.2025, 16:05:40] ~Daniyar: ‎Voice call  ‎3 min
[11.06.2025, 16:17:01] Vitalii Kazymyrovych: Да, это для 60 дней хранения
[11.06.2025, 16:20:20] ~Daniyar: Ок
[11.06.2025, 16:20:30] ~Daniyar: На 200 tb будут собирать
‎[11.06.2025, 16:20:44] ~Daniyar: ‎<attached: 00000335-AUDIO-2025-06-11-16-20-44.opus>
[11.06.2025, 17:33:47] Vitalii Kazymyrovych: Сколько камер одновременно будет развернуто на видео стене?
[11.06.2025, 17:35:47] ~Daniyar: 87
[11.06.2025, 17:36:27] Vitalii Kazymyrovych: То есть все, окей. И один экран для алармов, я правильно понял?
‎[11.06.2025, 17:36:28] ~Daniyar: ‎<attached: 00000339-AUDIO-2025-06-11-17-36-28.opus>
[11.06.2025, 17:37:02] Vitalii Kazymyrovych: ‎You deleted this message.
[11.06.2025, 17:37:37] Vitalii Kazymyrovych: Узнай модели камер. То есть, 207 в общей сложности? И все одновременно нужно выводить на видео стену?
[11.06.2025, 18:11:44] ~Daniyar: Ок
[02.07.2025, 17:59:08] Vitalii Kazymyrovych: Привет. У нас довольно много проектов - предлагаю запланировать созвон и обсудить каждый. Статус, перспективы, возможные действия.
‎[02.07.2025, 20:12:47] ~Daniyar: ‎<attached: 00000344-AUDIO-2025-07-02-20-12-47.opus>
[02.07.2025, 20:13:19] Vitalii Kazymyrovych: Ок, договорились
‎[07.07.2025, 17:44:14] ~Daniyar: ‎<attached: 00000346-AUDIO-2025-07-07-17-44-14.opus>
‎[08.07.2025, 11:27:28] Vitalii Kazymyrovych: Привет. Там Ксавьер отвечал на этот вопрос. Отсрочка платежа - не проблема, но подписываться мы будем, когда будут первые 3 проекта с деньгами. ‎<attached: 00000347-PHOTO-2025-07-08-11-27-28.jpg>
‎[08.07.2025, 12:28:01] ~Daniyar: ‎<attached: 00000348-AUDIO-2025-07-08-12-28-01.opus>
‎[08.07.2025, 12:28:25] ~Daniyar: ‎<attached: 00000349-AUDIO-2025-07-08-12-28-25.opus>
[08.07.2025, 14:18:23] Vitalii Kazymyrovych: Можем обсудить на созвоне.
[08.07.2025, 14:21:12] ~Daniyar: Ок на след неделе
[11.07.2025, 14:36:23] Vitalii Kazymyrovych: Привет. Давай запланируем звонок. В понедельник во второй половине дня — норм?
[11.07.2025, 14:36:42] ~Daniyar: Привет
[11.07.2025, 14:37:08] ~Daniyar: Давай
[11.07.2025, 14:37:14] ~Daniyar: Приглашалку скинешь
[11.07.2025, 14:37:49] Vitalii Kazymyrovych: У тебя +2?
[11.07.2025, 14:40:37] ~Daniyar: Да
[11.07.2025, 14:45:23] Vitalii Kazymyrovych: Сделал. На 13:00 по Киеву.
[23.07.2025, 10:11:36] Vitalii Kazymyrovych: Привет. Вопрос по поводу ивента AXIS. Там заложен бюджет $4000. Это общий или отдельно каждый участник платит?
[23.07.2025, 10:14:06] ~Daniyar: привет
[23.07.2025, 10:14:08] ~Daniyar: это общий
[23.07.2025, 10:14:23] Vitalii Kazymyrovych: А какую часть мы должны будем оплатить?
[23.07.2025, 10:14:33] ~Daniyar: все пополам
[23.07.2025, 10:14:52] ~Daniyar: у нас есть фонд с Axis на этот год
[23.07.2025, 10:15:00] ~Daniyar: они обычно 2000-2500 дают
[23.07.2025, 10:15:06] ~Daniyar: также Genetec
[23.07.2025, 11:22:14] Vitalii Kazymyrovych: То есть, с нас +\- $1000?
[23.07.2025, 11:22:34] ~Daniyar: 1500
[23.07.2025, 11:22:40] Vitalii Kazymyrovych: Ок
[23.07.2025, 11:22:44] ~Daniyar: Бюджет увеличить на 4500
‎[23.07.2025, 11:26:29] ~Daniyar: ‎<attached: 00000371-AUDIO-2025-07-23-11-26-29.opus>
[23.07.2025, 11:40:57] Vitalii Kazymyrovych: Могу набрать?
[23.07.2025, 11:48:16] ~Daniyar: ‎Voice call  ‎1 min
[01.08.2025, 10:36:28] Vitalii Kazymyrovych: Привет
[01.08.2025, 10:36:59] ~Daniyar: Приветствую
[01.08.2025, 10:37:16] Vitalii Kazymyrovych: Мы с Юрой договорились провести еще один звонок сегодня. Когда ты сможешь?
[01.08.2025, 10:37:35] Vitalii Kazymyrovych: 17:00 по Астане - норм?
[01.08.2025, 10:38:33] ~Daniyar: Сегодня не  смогу
[01.08.2025, 10:38:39] ~Daniyar: Давай на след .неделе
[01.08.2025, 10:38:45] Vitalii Kazymyrovych: Понедельник?
[01.08.2025, 10:39:05] ~Daniyar: Пн у нас уже 2 встречи 
Давай во вторник
[01.08.2025, 10:39:52] Vitalii Kazymyrovych: Давай. 12 по вашему времени.
[01.08.2025, 10:40:40] ~Daniyar: Ок
[05.08.2025, 16:13:06] Vitalii Kazymyrovych: Привет еще раз. Есть предложение по поводу VMS. Если найдете заказчика, готового купить 100+ каналов, мы продадим по 30$ за канал. 

Меньше ста - обычная цена, 100$. 

Вы единственный дистрибьютор в регионе, которому мы даем VMS. Так что, надо показать результат)
[05.08.2025, 16:14:55] Vitalii Kazymyrovych: Нам нужно хотя бы пару демок с VMS запустить. В Латинской Америке мы ее уже вовсю продаем, а в СНГ пока никаких подвижек.
‎[05.08.2025, 16:19:15] ~Daniyar: ‎<attached: 00000386-AUDIO-2025-08-05-16-19-15.opus>
[05.08.2025, 16:37:55] Vitalii Kazymyrovych: Да, это для вас
‎[05.08.2025, 16:44:18] ~Daniyar: ‎<attached: 00000388-AUDIO-2025-08-05-16-44-18.opus>
[05.08.2025, 16:53:59] Vitalii Kazymyrovych: Не, у нас все просто. Цена за 1 канал.
[06.08.2025, 14:40:26] ~Daniyar: Виталя Салам
[06.08.2025, 14:41:32] ~Daniyar: 26 сентября 2025 года (пятница) планируем провести мультивендорное сейловое мероприятие — MUK Day в Азербайджане с участием вендоров APC, Dell, Axis и Ruckus.
[06.08.2025, 14:41:45] ~Daniyar: Формат мероприятия: выездной однодневный ивент с ночёвкой, включающий винную экскурсию и активности на территории отеля Shamakhi Palace (https://shamakhipalace.az/).
Целевая аудитория: проектные партнёры.
Ожидаемое количество гостей: около 30 человек.
Ориентировочный бюджет: $10 000 – $12 000.
[06.08.2025, 14:42:16] ~Daniyar: хочу вам предложить участие вместо Ruckus
[06.08.2025, 14:42:28] ~Daniyar: с каждого по 3000
[06.08.2025, 14:42:36] ~Daniyar: интересно?
[06.08.2025, 14:53:42] Vitalii Kazymyrovych: Привет. Я 25-го сентября должен быть на ивенте Майлстоуна в Германии. Но надо с коллегами посоветоваться, может ваш ивент будет интереснее.
[06.08.2025, 15:00:35] ~Daniyar: напиши своим
[07.08.2025, 10:51:01] Vitalii Kazymyrovych: Привет. Участие в ивенте Milestone запланировано давно и мы туда едем втроем с Олегом и Ксавьером, так что в Азербайджан я не попадаю.
[07.08.2025, 10:53:22] ~Daniyar: привет
[07.08.2025, 10:53:33] ~Daniyar: все понял
[07.08.2025, 10:53:37] ~Daniyar: с вашей стороны отбой
[07.08.2025, 10:53:53] ~Daniyar: может Олег к нам приедет)))
[07.08.2025, 10:53:59] ~Daniyar: зачем вас там так много
[07.08.2025, 11:33:23] Vitalii Kazymyrovych: Ахаха
[07.08.2025, 11:35:10] Vitalii Kazymyrovych: Мы там скорее, как конкуренты, чем как партнеры. Будем собирать клиентскую базу для нашей VMS😉
[07.08.2025, 11:39:27] ~Daniyar: Ааа
[07.08.2025, 11:39:31] ~Daniyar: Хитро
[07.08.2025, 11:39:50] ~Daniyar: Ну да, можно майлстон списывать со счетов ‎<This message was edited>
[07.08.2025, 11:42:42] Vitalii Kazymyrovych: Ну, не так категорично, конечно. Но постепенно все будет)
[07.08.2025, 18:13:46] Vitalii Kazymyrovych: У меня вопрос по поводу метро Баку. Я понимаю ситуацию, но у этого проекта есть шансы или мы его закрываем?
[07.08.2025, 18:14:22] ~Daniyar: Пока рано что-то говорить
[07.08.2025, 18:14:36] ~Daniyar: Пилот даже не начался
[07.08.2025, 18:14:48] ~Daniyar: Из-за того что мы не можем предоставить им 3 камеры
[07.08.2025, 18:14:52] Vitalii Kazymyrovych: А начнется? Если у вас камер нет.
[07.08.2025, 18:15:11] ~Daniyar: Да хотим заказать им 3 камеры до Дубая
[07.08.2025, 18:15:21] ~Daniyar: Потом они сами заберут из в Баку
[07.08.2025, 18:15:28] Vitalii Kazymyrovych: Как сложно
[07.08.2025, 18:15:29] ~Daniyar: Чтобы ускорить процесс и начать пилот
[07.08.2025, 18:15:35] Vitalii Kazymyrovych: Понял
[07.08.2025, 18:15:53] Vitalii Kazymyrovych: Аналогичный вопрос по МВД Астаны
[07.08.2025, 18:16:07] Vitalii Kazymyrovych: Ситуацию я понимаю, вопрос есть ли шансы?
[07.08.2025, 18:16:20] ~Daniyar: 50/50
[07.08.2025, 18:17:46] Vitalii Kazymyrovych: 😅
[07.08.2025, 18:18:54] Vitalii Kazymyrovych: Надеюсь, пилот со школами выгорит. Я хочу начать полноценно с вами сотрудничать: проводить вебинары, общаться с рселлерами, но не могу из-за условия Ксавьера.
[07.08.2025, 18:19:01] Vitalii Kazymyrovych: Нам нужен проект
‎[07.08.2025, 18:49:15] ~Daniyar: ‎<attached: 00000426-AUDIO-2025-08-07-18-49-15.opus>
[07.08.2025, 18:55:32] Vitalii Kazymyrovych: Так что давай постараемся кого-нибудь дожать поскорее. Если нужна помощь с моей стороны, пиши.
[07.08.2025, 19:19:37] ~Daniyar: Ок
[08.08.2025, 14:44:22] Vitalii Kazymyrovych: Привет. Чем ты так Алене из Софтпрома насолил?😅 Несколько раз сегодня тебя упоминала на созвоне.
[08.08.2025, 14:44:40] ~Daniyar: Привет
[08.08.2025, 14:44:42] ~Daniyar: Да ты че
[08.08.2025, 14:44:46] ~Daniyar: Что говорит ?
[08.08.2025, 14:44:49] ~Daniyar: Опять гадости
[08.08.2025, 14:45:04] ~Daniyar: Я просто ушел с Софтпрома и все
[08.08.2025, 14:45:05] Vitalii Kazymyrovych: А как же)
[08.08.2025, 14:45:42] Vitalii Kazymyrovych: Ну, видимо, она думала, что вы будете вместе вечно
[08.08.2025, 14:45:46] ~Daniyar: А мне как-то фиолетова до ее слов
[08.08.2025, 14:46:50] Vitalii Kazymyrovych: Да мне так-то тоже. Просто забавно и немного любопытно стало, может там какая история)
[08.08.2025, 14:49:24] Vitalii Kazymyrovych: Боюсь представить, что она про нас будет рассказывать, если мы таки лишим ее дистрибуции)
[08.08.2025, 14:54:17] ~Daniyar: Ндааа, прячьте уши
[08.08.2025, 14:54:25] ~Daniyar: 😁😁😁
[14.08.2025, 11:43:24] Vitalii Kazymyrovych: Привет. Есть новости?
[14.08.2025, 11:43:36] ~Daniyar: привет
[14.08.2025, 11:43:39] ~Daniyar: какие?
[14.08.2025, 11:43:53] Vitalii Kazymyrovych: Желательно хорошие
[14.08.2025, 11:43:56] Vitalii Kazymyrovych: По проектам)
[14.08.2025, 11:44:06] ~Daniyar: мы в Атырау
[14.08.2025, 11:44:12] ~Daniyar: сейчас 2 встречи будут
[14.08.2025, 11:44:14] Vitalii Kazymyrovych: Как ваш ивент?
[14.08.2025, 11:44:20] ~Daniyar: будем презентовать
[14.08.2025, 11:44:22] ~Daniyar: супер
[14.08.2025, 11:44:24] ~Daniyar: 40 человек
[14.08.2025, 11:44:32] ~Daniyar: все двовльны
[14.08.2025, 11:44:32] Vitalii Kazymyrovych: Круто
[14.08.2025, 11:44:44] ~Daniyar: в пн планиурем рассылку по VMS
[14.08.2025, 11:44:55] ~Daniyar: подключу маркетологов
[14.08.2025, 11:46:41] ~Daniyar: будем предлагать нашим партнерам
[14.08.2025, 11:46:55] ~Daniyar: и пробежимся по проектам, где заложены только камеры
[14.08.2025, 11:47:02] ~Daniyar: пока такой план на ПН
[14.08.2025, 12:10:11] Vitalii Kazymyrovych: Звучит хорошо)
[14.08.2025, 12:10:21] Vitalii Kazymyrovych: Удачи вам на ивенете. Держи в курсе)
[14.08.2025, 12:23:40] ~Daniyar: ✊🏻
‎[14.08.2025, 12:32:10] ~Daniyar: ‎<attached: 00000463-PHOTO-2025-08-14-12-32-10.jpg>
[14.08.2025, 12:32:16] ~Daniyar: Юра презентует
[14.08.2025, 12:46:15] Vitalii Kazymyrovych: Ого, круто)
[14.08.2025, 12:46:40] Vitalii Kazymyrovych: Если что, можете меня онлайн подключить, отвечу на вопросы)
[14.08.2025, 13:03:18] ~Daniyar: Все норм сами справляемся
[14.08.2025, 13:03:28] ~Daniyar: Твой ученик Марку  держит
[15.08.2025, 11:16:43] Vitalii Kazymyrovych: Привет. Что у тебя по времени сегодня? Есть важный разговор. ‎<This message was edited>
[15.08.2025, 11:43:05] ~Daniyar: Привет
[15.08.2025, 11:43:09] ~Daniyar: Сегодня отгул
[15.08.2025, 11:43:22] ~Daniyar: По телефону  можем переговорить ‎<This message was edited>
[15.08.2025, 11:43:32] Vitalii Kazymyrovych: Давай
[15.08.2025, 11:43:40] Vitalii Kazymyrovych: Набери, как будет время
[15.08.2025, 11:43:44] ~Daniyar: Ок
[15.08.2025, 14:24:43] Vitalii Kazymyrovych: не забыл?
[15.08.2025, 14:28:26] ~Daniyar: Чуть позже
[15.08.2025, 14:28:28] ~Daniyar: Еще занят
[15.08.2025, 14:33:57] ~Daniyar: ‎Voice call  ‎2 min
[15.08.2025, 14:41:55] Vitalii Kazymyrovych: +994 50 687 24 25
[15.08.2025, 14:42:00] Vitalii Kazymyrovych: Джейхун
[15.08.2025, 14:42:32] Vitalii Kazymyrovych: Marine Oil and Security
‎[15.08.2025, 14:45:52] ~Daniyar: ‎<attached: 00000483-AUDIO-2025-08-15-14-45-52.opus>
‎[15.08.2025, 14:45:58] ~Daniyar: ‎<attached: 00000484-AUDIO-2025-08-15-14-45-58.opus>
[18.08.2025, 15:47:54] Vitalii Kazymyrovych: Привет. Как ваш ивент? Довольны результатом?
‎[18.08.2025, 15:48:30] ~Daniyar: ‎<attached: 00000486-AUDIO-2025-08-18-15-48-30.opus>
‎[18.08.2025, 15:48:41] ~Daniyar: ‎<attached: 00000487-AUDIO-2025-08-18-15-48-41.opus>
[18.08.2025, 15:49:23] Vitalii Kazymyrovych: Еще успеем. Не последний же ивент)
‎[18.08.2025, 15:50:04] ~Daniyar: ‎<attached: 00000489-AUDIO-2025-08-18-15-50-04.opus>
[18.08.2025, 15:54:50] Vitalii Kazymyrovych: Пара вопросов вопросов: 

1. Что по проекту метро Баку? Камер еще нет? 
2. Как дела с Marine? Вы дали им инсталл VMS для тестов? Там 100% потребуется моя помощь, если они хотят интеграцию с VEZHA, так что, держи меня в курсе.
‎[18.08.2025, 15:58:00] ~Daniyar: ‎<attached: 00000491-AUDIO-2025-08-18-15-58-00.opus>
‎[18.08.2025, 15:58:20] ~Daniyar: ‎<attached: 00000492-AUDIO-2025-08-18-15-58-20.opus>
[18.08.2025, 16:44:47] Vitalii Kazymyrovych: Гуд, спасибо
[18.08.2025, 16:44:52] Vitalii Kazymyrovych: Понял, ждем дальше
[18.08.2025, 17:03:39] Vitalii Kazymyrovych: На самом деле, чем дольше они тянут, тем лучше. У нас сейчас с VMS интегрируются только Face Recognition, LPR и UIC. 

Вроде остальные модули обещают к концу месяца. 

А Marine хотят как раз VMS в связке с вежей.
[18.08.2025, 18:12:27] ~Daniyar: Да ты че
[18.08.2025, 18:12:42] ~Daniyar: Я думал VMs полностью доработана
[18.08.2025, 18:16:47] Vitalii Kazymyrovych: VMS - да, а плагины – другая история
[19.08.2025, 10:30:59] ~Daniyar: привет
[19.08.2025, 10:31:01] ~Daniyar: как деал?
[19.08.2025, 10:31:06] ~Daniyar: Юра вчера скинул запрос
[19.08.2025, 10:31:09] ~Daniyar: на СИЗ
[19.08.2025, 10:31:18] ~Daniyar: 30 камер взрывозащиа
[19.08.2025, 10:31:27] ~Daniyar: что можем предложить?
[19.08.2025, 10:31:35] ~Daniyar: по мимо касок
‎[19.08.2025, 10:31:54] ~Daniyar: ‎<attached: 00000506-PHOTO-2025-08-19-10-31-54.jpg>
[19.08.2025, 10:32:17] ~Daniyar: также вход в опасную зону, или нахождение больше положеного времени
[19.08.2025, 10:32:37] ~Daniyar: распонование лиц
‎[19.08.2025, 11:25:33] Vitalii Kazymyrovych: ‎<attached: 00000509-AUDIO-2025-08-19-11-25-33.opus>
‎[19.08.2025, 11:27:06] ~Daniyar: ‎<attached: 00000510-AUDIO-2025-08-19-11-27-06.opus>
[19.08.2025, 11:27:47] Vitalii Kazymyrovych: Понял
[19.08.2025, 11:48:45] Vitalii Kazymyrovych: Пожарку есть смысл предлагать для наружного наблюдения. Если камеры внутри здания, то там датчики дыма есть.
[19.08.2025, 11:56:40] ~Daniyar: ok
[19.08.2025, 13:19:37] Vitalii Kazymyrovych: Слушай, а от Догрылюк никаких новостей?
[19.08.2025, 13:22:44] ~Daniyar: нет
[19.08.2025, 13:22:55] ~Daniyar: Туркменистан не активен
[19.08.2025, 13:29:42] Vitalii Kazymyrovych: Что это значит?
[19.08.2025, 13:30:58] ~Daniyar: нет активностей, Axis продает другой дисти, у нас там нет контракта, VMS Milestone, у нас тоже нет контракта
[19.08.2025, 13:31:16] ~Daniyar: можем предлагать только Incoresoft
[19.08.2025, 14:10:31] Vitalii Kazymyrovych: Ясно, спасибо
[19.08.2025, 14:11:07] ~Daniyar: Туркменистан закрытая страна
[19.08.2025, 14:11:23] ~Daniyar: сложно там бизнесс делать
[19.08.2025, 14:11:52] ~Daniyar: наши там в основном Dell продают
‎[19.08.2025, 15:20:14] ~Daniyar: ‎<attached: 00000524-PHOTO-2025-08-19-15-20-14.jpg>
[19.08.2025, 15:21:39] Vitalii Kazymyrovych: Гуд, можем завтра поставить и сделать интеграцию. Я у него спрошу, какие модули им нужны.
[19.08.2025, 15:21:42] Vitalii Kazymyrovych: Или ты спроси
[19.08.2025, 18:05:39] ~Daniyar: Узнаем
[20.08.2025, 13:02:03] Vitalii Kazymyrovych: Привет
[20.08.2025, 13:02:10] ~Daniyar: Привет
[20.08.2025, 13:02:10] Vitalii Kazymyrovych: У нас новый продукт есть
[20.08.2025, 13:02:27] ~Daniyar: Да какой ?
[20.08.2025, 13:04:45] Vitalii Kazymyrovych: Ща закину архив, там презентация, спека и видео демонстрация
‎[20.08.2025, 13:04:48] Vitalii Kazymyrovych: wetransfer_en_demo_myth-mp4_2025-08-06_1417.zip ‎document omitted
[20.08.2025, 13:04:57] Vitalii Kazymyrovych: Решение для полиции
[20.08.2025, 13:05:16] Vitalii Kazymyrovych: ‎You deleted this message.
[20.08.2025, 13:07:05] Vitalii Kazymyrovych: Только презентация на Украинском пока
[20.08.2025, 13:07:09] Vitalii Kazymyrovych: Сегодня должны перевести
[20.08.2025, 13:07:17] Vitalii Kazymyrovych: Я потом отдельно закину еще файл
[20.08.2025, 13:08:04] Vitalii Kazymyrovych: Ставим сервак в патрульную машину. От 1 до 4 камер. Можем обеспечить 360 обзор.
[20.08.2025, 13:08:14] Vitalii Kazymyrovych: Распознаем номера и лицаю.
[20.08.2025, 13:08:39] ~Daniyar: прикольно
[20.08.2025, 13:08:45] ~Daniyar: давай ждем иноф
[20.08.2025, 13:08:59] ~Daniyar: предложим нашим партерам которые работаеют с ДП
[26.08.2025, 11:53:56] Vitalii Kazymyrovych: Привет. Давай запланируем звонок с обзором проектов на начало сентября. Можно хоть 1-го.
‎[26.08.2025, 11:54:15] ~Daniyar: ‎<attached: 00000545-AUDIO-2025-08-26-11-54-15.opus>
[26.08.2025, 11:54:47] Vitalii Kazymyrovych: В какой середине)
[26.08.2025, 11:54:51] Vitalii Kazymyrovych: Давай 2-го ‎<This message was edited>
[26.08.2025, 11:56:11] ~Daniyar: Нееее
[26.08.2025, 11:56:23] ~Daniyar: Давай 10
[26.08.2025, 11:56:32] ~Daniyar: Школа дети
[26.08.2025, 11:56:35] ~Daniyar: Сам понимаешь
[26.08.2025, 11:57:45] Vitalii Kazymyrovych: Выбирай любой другой день, но в первую неделю месяца 100%. 1-5
[26.08.2025, 11:58:30] Vitalii Kazymyrovych: Можем конец недели, четверг-пятница. Я думаю, час времени свободного можно найти.
[26.08.2025, 12:46:18] ~Daniyar: давай 4 того в 12-00
[26.08.2025, 12:50:13] Vitalii Kazymyrovych: Годится, спасибо)
[26.08.2025, 12:50:33] Vitalii Kazymyrovych: В 12 по Астане или по Киеву?
[26.08.2025, 12:50:41] Vitalii Kazymyrovych: Мне подходит и то и другое
[26.08.2025, 12:52:16] ~Daniyar: Астана
‎[26.08.2025, 14:57:09] Vitalii Kazymyrovych: RU_MYTH.pdf • ‎8 pages ‎<attached: 00000559-RU_MYTH.pdf>
‎[26.08.2025, 14:57:09] Vitalii Kazymyrovych: RU_MYTH_Doc.pdf • ‎7 pages ‎<attached: 00000560-RU_MYTH_Doc.pdf>
‎[26.08.2025, 14:57:09] Vitalii Kazymyrovych: EN_MYTH_Doc.pdf • ‎7 pages ‎<attached: 00000561-EN_MYTH_Doc.pdf>
[26.08.2025, 15:01:10] ~Daniyar: 👍🏻
[26.08.2025, 15:01:13] ~Daniyar: Отлично
[28.08.2025, 14:08:19] ~Daniyar: Виталя салам
[28.08.2025, 14:08:32] ~Daniyar: мне нужен ценник
[28.08.2025, 14:08:39] ~Daniyar: на Мобильный комплекс дистанционного распознавания ТС и людей
[28.08.2025, 14:08:49] ~Daniyar: более подробную инфо
[28.08.2025, 14:09:08] ~Daniyar: будет ли интегрироваться с существующей системой
[28.08.2025, 14:09:09] ~Daniyar: ?
[28.08.2025, 16:37:11] Vitalii Kazymyrovych: Привет. Больше инфы, чем та, которая в презентациях у меня нет.
[28.08.2025, 16:37:34] Vitalii Kazymyrovych: Цены сейчас напишу
‎[28.08.2025, 16:37:44] ~Daniyar: ‎<attached: 00000572-AUDIO-2025-08-28-16-37-44.opus>
[28.08.2025, 16:39:07] Vitalii Kazymyrovych: Ок, я все уточню, позже вернусь с инфой
‎[28.08.2025, 16:39:51] ~Daniyar: ‎<attached: 00000574-AUDIO-2025-08-28-16-39-51.opus>
‎[28.08.2025, 16:40:23] ~Daniyar: ‎<attached: 00000575-AUDIO-2025-08-28-16-40-23.opus>
[28.08.2025, 16:40:30] Vitalii Kazymyrovych: Соберем всех на одном вебинаре?
[28.08.2025, 16:40:43] Vitalii Kazymyrovych: Да, дизайнер дизайнит баннер. Все ок. ‎<This message was edited>
[28.08.2025, 16:41:23] Vitalii Kazymyrovych: Я про обучение
[28.08.2025, 16:41:54] Vitalii Kazymyrovych: По поводу ивента принял. Поговорю с руководством
[28.08.2025, 17:08:36] ~Daniyar: Нет
[28.08.2025, 17:08:36] ~Daniyar: Армяне и Азербайджане отдельно
[28.08.2025, 17:08:48] ~Daniyar: Казахи и Киргизы можно 
Грузины и Азербайджан можно
[28.08.2025, 17:09:06] ~Daniyar: Таджикистан с Казахами и Киргизами
[28.08.2025, 17:09:31] ~Daniyar: Туркменистан тоже вместе с Казахами можно
[28.08.2025, 17:09:57] ~Daniyar: 10 октября 3 к взнос
[28.08.2025, 17:10:12] ~Daniyar: Ивент с ночевкой в Азербайджане
[28.08.2025, 17:10:34] ~Daniyar: Будет Dell, Apc, Axis
[02.09.2025, 12:29:29] ~Daniyar: Виталий Салам ‎<This message was edited>
[02.09.2025, 12:31:21] Vitalii Kazymyrovych: Привет
[02.09.2025, 12:31:31] Vitalii Kazymyrovych: По поводу МИФ
[02.09.2025, 12:33:25] Vitalii Kazymyrovych: Продается в 3-х комплектациях

1 камера $12 500
2 камеры $15 000
4 камеры $20 000 

В комплекте идут камеры, комп и лицензии. К обычной ВЕЖЕ подключить можно. 

Характеристики камер и компа вот в этом документе есть.
[02.09.2025, 12:34:01] ~Daniyar: понял
[02.09.2025, 12:34:07] ~Daniyar: это моя цена входная
[02.09.2025, 12:34:08] ~Daniyar: ?
[02.09.2025, 12:34:52] Vitalii Kazymyrovych: Не, это MSRP
[02.09.2025, 12:36:16] ~Daniyar: мне надо подготовить расчет
сможешь мне квоту сделать ‎<This message was edited>
[02.09.2025, 12:51:07] ~Daniyar: еще вопрос
[02.09.2025, 12:51:17] ~Daniyar: на 10 октября мультивендорный ивент
[02.09.2025, 12:51:20] ~Daniyar: ждем ваш ответ
[02.09.2025, 12:51:29] ~Daniyar: в Азербайджане
[02.09.2025, 12:51:51] ~Daniyar: было бы классно вам выступить как VMS + Видеоаналитика
[02.09.2025, 12:51:56] ~Daniyar: будет еще Axis
[02.09.2025, 12:52:05] ~Daniyar: APC и DELL
[02.09.2025, 12:52:21] ~Daniyar: APC как ИБП для видео и серверов
[02.09.2025, 12:52:31] ~Daniyar: Dell серверная часть+СХД
[02.09.2025, 12:53:53] Vitalii Kazymyrovych: Мне не дадут бюджет на поездки, пока не будет хотя бы одного закрытого проекта.
[02.09.2025, 12:55:03] ~Daniyar: а как вы собираетесь продвигать без маркетинга
[02.09.2025, 12:55:13] ~Daniyar: партнеры плохо знают
[02.09.2025, 12:55:34] ~Daniyar: и будут знать плохо если не продвигать решение
[02.09.2025, 12:55:54] ~Daniyar: скажи что проведем ивент после будут лиды
[02.09.2025, 12:56:26] ~Daniyar: Axis заложил 30 К на 2025 год для продвижения учитывая, что их все знают ‎<This message was edited>
[02.09.2025, 12:57:21] ~Daniyar: я помню мы провели ивент, когда я работал в софтпроме, тогда Анастасия работала
[02.09.2025, 13:05:41] Vitalii Kazymyrovych: Меня убеждать не нужно. Нужно убедить Ксавьера. А он считает, что тратить деньги на рынок, который не приносит профита нет смысла.
[02.09.2025, 13:06:11] ~Daniyar: я тебя не убеждаю
[02.09.2025, 13:06:18] ~Daniyar: пишу как есть
[02.09.2025, 13:06:59] Vitalii Kazymyrovych: Я все понимаю. Но решений по бюджету принимать не могу)
[02.09.2025, 13:07:06] ~Daniyar: понял
[02.09.2025, 13:07:20] ~Daniyar: лучше написать письмо
[02.09.2025, 13:07:24] ~Daniyar: на Хвьера
[02.09.2025, 13:07:39] Vitalii Kazymyrovych: 100%
[02.09.2025, 13:10:16] Vitalii Kazymyrovych: Но я тебе говорю, ситуация изменится, когда мы продадим первую лицензию. 

Буквально, 1 канал FR и я смогу прийти к Ксавьеру и сказать: "смотри, тут есть люди, готовые покупать, нужно ехать продвигать продукт".
[02.09.2025, 14:52:34] ~Daniyar: ВИталя
[02.09.2025, 14:52:46] ~Daniyar: сделай пжоста квоту на 3 варианта  МИФ
[02.09.2025, 15:25:23] Vitalii Kazymyrovych: До конца дня сделаю. Его в системе еще нет, надо чтобы добавили.
[02.09.2025, 15:35:51] ~Daniyar: Ok
[02.09.2025, 17:32:18] Vitalii Kazymyrovych: Сори, цена все же для вас. На нее даете наценку.

Но скидку тоже сможем сделать, если проект многообещающий. ‎<This message was edited>
[04.09.2025, 12:49:55] Vitalii Kazymyrovych: Привет, еще раз. Олег сказал с рассылкой притормозить до октября. 

То есть, лично вы можете ходить по партнерам, предлагать точечно. Но общую рассылку после подписания договора.
[04.09.2025, 12:50:29] Vitalii Kazymyrovych: Не скажу, что я в восторге от затягивания этого процесса, но тут решение высшего руководства. Политика, чтоб ее)
[04.09.2025, 12:56:49] ~Daniyar: Все понял ‎<This message was edited>
[04.09.2025, 12:56:52] ~Daniyar: Не проблема
[04.09.2025, 12:57:03] ~Daniyar: Будем точечно предлагать
[04.09.2025, 14:00:18] ~Daniyar: Виталя сделай плиз квоту на МИФ ‎<This message was edited>
[04.09.2025, 14:00:56] ~Daniyar: нужен вариан на 2 камеры и 4 камеры
[04.09.2025, 14:01:09] ~Daniyar: также вопрос с существующими камерами получится с интегрировать?
[04.09.2025, 15:53:54] Vitalii Kazymyrovych: Получается, 2 квоты?
[04.09.2025, 15:54:40] Vitalii Kazymyrovych: Кажется уже отвечал, с обычной системой без проблем интегрируется
[04.09.2025, 15:57:23] ~Daniyar: Ок
[04.09.2025, 15:57:38] ~Daniyar: В одной квоте можно
[04.09.2025, 15:57:45] ~Daniyar: 2 варианта
‎[04.09.2025, 18:04:15] Vitalii Kazymyrovych: Вот пример работы Smoke&Fire на большой площади. Я в прошлом году над этим проектом работал. ‎<attached: 00000640-PHOTO-2025-09-04-18-04-15.jpg>
‎[04.09.2025, 18:04:16] Vitalii Kazymyrovych: ‎<attached: 00000641-PHOTO-2025-09-04-18-04-16.jpg>
‎[04.09.2025, 18:04:16] Vitalii Kazymyrovych: ‎<attached: 00000642-PHOTO-2025-09-04-18-04-16.jpg>
[04.09.2025, 18:21:55] ~Daniyar: Греция
[04.09.2025, 20:20:38] Vitalii Kazymyrovych: Ага
[04.09.2025, 20:21:05] ~Daniyar: Супер
[04.09.2025, 20:21:09] ~Daniyar: Еще есть ?
[05.09.2025, 10:26:08] Vitalii Kazymyrovych: Привет. У Ксавьера еще должны быть, но обычно всем хватает одного)
[05.09.2025, 10:26:50] ~Daniyar: Привет
[05.09.2025, 10:27:07] ~Daniyar: Понял, так эффективнее
[05.09.2025, 10:27:11] ~Daniyar: Впечатляет же
[05.09.2025, 10:27:24] ~Daniyar: Когда есть несколько
[05.09.2025, 10:28:23] Vitalii Kazymyrovych: Тоже верно. В любом случае, раньше понедельника я не смогу у него взять скрины. Он сейчас из Мексики летит.
[05.09.2025, 10:28:40] ~Daniyar: Ок
[05.09.2025, 10:30:23] Vitalii Kazymyrovych: По аэропортам. Могу тебе просто набросать список модулей и варианты их применения. Презентацию обновить пока не получится.

У нас там большие изменения в маркетинге, все, кто с этим связан заняты.
[05.09.2025, 10:30:48] ~Daniyar: Ок
[08.09.2025, 12:17:39] Vitalii Kazymyrovych: Привет. Есть минута?
[08.09.2025, 12:17:52] ~Daniyar: Привет
[08.09.2025, 12:17:53] ~Daniyar: Да
[08.09.2025, 12:18:04] Vitalii Kazymyrovych: ‎Voice call  ‎35 sec
[09.09.2025, 10:54:22] ~Daniyar: Виталя салам
[09.09.2025, 10:54:36] ~Daniyar: Есть у вас решение для полиции именно для СЕзО
[09.09.2025, 10:54:47] ~Daniyar: Детекция Телефонов
[09.09.2025, 10:54:54] ~Daniyar: Не адекватное поведение
[09.09.2025, 10:55:02] ~Daniyar: Шатающийся чел
[09.09.2025, 10:55:04] ~Daniyar: ?
[09.09.2025, 11:06:38] Vitalii Kazymyrovych: Привет. Могу набрать?
[09.09.2025, 11:16:49] ~Daniyar: да
[09.09.2025, 11:17:03] Vitalii Kazymyrovych: Давай через полчаса.
[09.09.2025, 11:17:10] Vitalii Kazymyrovych: Я уже на другом звонке.
[09.09.2025, 11:35:35] ~Daniyar: Планирую сегодня встречу с партнером
[09.09.2025, 11:35:39] ~Daniyar: У него много вопросов ‎<This message was edited>
[09.09.2025, 11:35:54] ~Daniyar: Давай встречу организую
[09.09.2025, 11:36:01] ~Daniyar: Познакомимся и обсудим проекты
[09.09.2025, 11:42:23] Vitalii Kazymyrovych: ‎Voice call  ‎3 min
[09.09.2025, 11:58:42] ~Daniyar: Завтра днем
‎[09.09.2025, 11:58:42] ~Daniyar: ‎audio omitted
[09.09.2025, 11:58:52] ~Daniyar: На завтра перенесем
[09.09.2025, 12:20:38] Vitalii Kazymyrovych: Понял, без проблем
[09.09.2025, 12:30:38] ~Daniyar: MUK приглашает вас на запланированную конференцию: Zoom. 
Подключиться к конференции Zoom 
https://muk-ua.zoom.us/j/4569558498?pwd=WFE0MnlnSFNEUmJ1bDZ5dEdlc0FFQT09&omn=87141885313 
Идентификатор конференции: 456 955 8498 
Код доступа: kase123
[09.09.2025, 12:31:50] ~Daniyar: на 14-00 по Алмате
[09.09.2025, 17:53:35] Vitalii Kazymyrovych: Как там с Грузией дела? Была встреча с клиентом/партнером? ‎<This message was edited>
[09.09.2025, 18:04:18] ~Daniyar: С кем именно ?
[09.09.2025, 18:18:46] Vitalii Kazymyrovych: GE/ITS LTD/Emergency Management Service
[09.09.2025, 18:20:12] ~Daniyar: Скинули
[09.09.2025, 18:20:17] ~Daniyar: Но проект не этого года
[09.09.2025, 18:20:29] ~Daniyar: Для начало POc
[09.09.2025, 18:20:32] ~Daniyar: В офисе
[09.09.2025, 18:23:18] Vitalii Kazymyrovych: Добро. Спасибо за информацию.
[10.09.2025, 12:02:30] ~Daniyar: Виталя привет ‎<This message was edited>
[10.09.2025, 12:02:45] Vitalii Kazymyrovych: Привет
[10.09.2025, 12:02:48] Vitalii Kazymyrovych: Пустишь в зум?
[10.09.2025, 12:02:51] Vitalii Kazymyrovych: Или отмена?
[10.09.2025, 12:03:04] ~Daniyar: Сам жду
[10.09.2025, 12:03:07] ~Daniyar: Сейла не будет
[10.09.2025, 12:03:16] ~Daniyar: Он на ивенте
[10.09.2025, 12:03:28] Vitalii Kazymyrovych: Я думал, это ваш зум😅
[10.09.2025, 12:03:32] ~Daniyar: Дай 5 мин
[10.09.2025, 12:03:33] ~Daniyar: Нет
[10.09.2025, 12:52:07] Vitalii Kazymyrovych: ‎Voice call  ‎No answer
[10.09.2025, 12:52:34] ~Daniyar: ‎Voice call  ‎5 min
[10.09.2025, 13:15:38] Vitalii Kazymyrovych: НАпиши название компании партнера
[10.09.2025, 13:23:45] ~Daniyar: Infosafe
[10.09.2025, 13:24:55] Vitalii Kazymyrovych: Зарегаешь на портале?
[10.09.2025, 13:25:23] Vitalii Kazymyrovych: Пусть курсы проходят)
[10.09.2025, 13:25:23] ~Daniyar: Да
[10.09.2025, 13:26:09] ~Daniyar: 😁
‎[11.09.2025, 10:00:48] Vitalii Kazymyrovych: Quotation - S00539.pdf • ‎1 page ‎<attached: 00000707-Quotation - S00539.pdf>
[11.09.2025, 10:00:56] Vitalii Kazymyrovych: Квота на МИФы
[11.09.2025, 10:01:01] Vitalii Kazymyrovych: Привет
[11.09.2025, 10:03:04] ~Daniyar: привет
[11.09.2025, 10:03:09] ~Daniyar: дякую
[11.09.2025, 10:05:45] ~Daniyar: 1 позиция на 1 камеру?
[11.09.2025, 10:06:17] Vitalii Kazymyrovych: 3 опции: 1 камера, 2 и 4
[11.09.2025, 10:15:06] ~Daniyar: гарантия на сколько?
[11.09.2025, 10:15:15] ~Daniyar: срок поставки?
[11.09.2025, 10:33:50] Vitalii Kazymyrovych: уточню
‎[11.09.2025, 13:24:22] Vitalii Kazymyrovych: Что за подраки?😅 ‎<attached: 00000717-PHOTO-2025-09-11-13-24-22.jpg>
[11.09.2025, 13:24:46] ~Daniyar: Да прикалываются
[11.09.2025, 13:24:50] Vitalii Kazymyrovych: ахаххах
[11.09.2025, 13:25:00] ~Daniyar: Сказал кто 1 вую продажу сделает
[11.09.2025, 13:25:04] ~Daniyar: С меня подарок
[11.09.2025, 13:25:09] Vitalii Kazymyrovych: могу пару тестовых лицензий дать🤣
[11.09.2025, 13:25:19] ~Daniyar: 😁
[15.09.2025, 14:21:00] ~Daniyar: Виталя Салам
[15.09.2025, 14:21:07] ~Daniyar: по ИВС есть что добавить
[15.09.2025, 14:21:09] ~Daniyar: письмо пишу
[16.09.2025, 13:11:08] Vitalii Kazymyrovych: Привет
[16.09.2025, 13:11:14] Vitalii Kazymyrovych: Письмо получил, спасибо
[16.09.2025, 13:11:47] ~Daniyar: Привет
[16.09.2025, 13:12:18] Vitalii Kazymyrovych: Проект, по которому ты вчера ТЗ сбрасывал вы не регистрировали?
[16.09.2025, 13:13:04] Vitalii Kazymyrovych: Как там история с вашим пайплайном по AXIS? Предлагали кому-нибудь пропилотировать ACAP?
‎[16.09.2025, 13:15:25] ~Daniyar: ‎<attached: 00000732-AUDIO-2025-09-16-13-15-25.opus>
‎[16.09.2025, 13:15:58] ~Daniyar: ‎<attached: 00000733-AUDIO-2025-09-16-13-15-58.opus>
[16.09.2025, 16:36:08] Vitalii Kazymyrovych: Понял, окей
[16.09.2025, 16:36:23] Vitalii Kazymyrovych: По мифу: 2 года гарантия, 2 месяца срок поставки.
[16.09.2025, 16:52:12] ~Daniyar: Ок
[22.09.2025, 13:55:18] Vitalii Kazymyrovych: Привет. Есть новости по СИЗО?
[22.09.2025, 14:36:45] ~Daniyar: Привет
[22.09.2025, 14:36:46] ~Daniyar: Нет
[22.09.2025, 14:36:49] ~Daniyar: Написал им
[22.09.2025, 14:36:52] ~Daniyar: Жду тз
[22.09.2025, 14:36:58] ~Daniyar: Скинул им презу
[22.09.2025, 14:37:05] ~Daniyar: Видео модули
[22.09.2025, 14:49:47] Vitalii Kazymyrovych: Понял, ок
[24.09.2025, 14:05:56] Vitalii Kazymyrovych: Привет. На следующей неделе сможем регулярный созвон провести?
[24.09.2025, 14:08:54] ~Daniyar: привет
[24.09.2025, 14:09:09] ~Daniyar: на след неделе обучение
[24.09.2025, 14:09:23] ~Daniyar: Грузия и Азербайджан
[24.09.2025, 14:09:34] ~Daniyar: а так без проблем давай
[24.09.2025, 14:09:51] ~Daniyar: 1-2 я в командирвоке в Киргизии
[24.09.2025, 14:15:32] Vitalii Kazymyrovych: Понедельник/Вторник?
[24.09.2025, 14:22:32] ~Daniyar: Вторник
[30.09.2025, 12:42:02] Vitalii Kazymyrovych: Привет. Давай на следующую неделю запланируем 2-3 звонка минут на 30 каждый с командами, которые уже прошли обучение.
[30.09.2025, 12:44:14] ~Daniyar: да давай
[30.09.2025, 12:56:23] Vitalii Kazymyrovych: Сможешь сегодня - завтра запланировать?
[30.09.2025, 12:56:46] ~Daniyar: надо сейлам написать
[30.09.2025, 12:56:52] ~Daniyar: под них ориентироваться будем
[30.09.2025, 12:57:02] ~Daniyar: надо главное всех собрать
[30.09.2025, 12:57:12] ~Daniyar: особенно Кам ов
[30.09.2025, 13:10:08] Vitalii Kazymyrovych: Гуд, маякуй тогда
[03.10.2025, 13:55:50] ~Daniyar: ‎Voice call  ‎9 min
[07.10.2025, 11:50:49] Vitalii Kazymyrovych: Привет еще раз
[07.10.2025, 11:50:59] ~Daniyar: Привет
‎[07.10.2025, 11:50:59] Vitalii Kazymyrovych: Вы чего договора не подписываете?) ‎<attached: 00000764-PHOTO-2025-10-07-11-50-59.jpg>
[07.10.2025, 11:51:16] ~Daniyar: Этим отдельно юристы занимаются
[07.10.2025, 11:51:21] ~Daniyar: Щас я им ремайнд скину
[07.10.2025, 11:51:22] Vitalii Kazymyrovych: УЗнаешь?
[07.10.2025, 11:51:28] ~Daniyar: Да
[07.10.2025, 11:51:33] Vitalii Kazymyrovych: 👌
[07.10.2025, 11:59:49] ~Daniyar: Виталя
[07.10.2025, 11:59:56] ~Daniyar: Мне щас клиент звонил
[07.10.2025, 12:00:40] ~Daniyar: Говорит майлтон надо обновить, каждый год обновляет, я ему говорю зачем тебе этот майлтон😁, давай поставим инкорсофт и ты не будешь каждый год платить за обновление ‎<This message was edited>
[07.10.2025, 12:02:30] Vitalii Kazymyrovych: пхпххпхх
[07.10.2025, 12:02:36] Vitalii Kazymyrovych: И что клиент?)
[07.10.2025, 12:02:55] ~Daniyar: Я ему инкорсофт продавал
[07.10.2025, 12:02:59] ~Daniyar: Видеоаналитику
[07.10.2025, 12:03:10] ~Daniyar: Он щас просит посчитать ему
[07.10.2025, 12:03:14] ~Daniyar: Там не большой проект
[07.10.2025, 12:03:48] ~Daniyar: Он хочет заказчику показать цену обновления майлсто и инкорсофт
[07.10.2025, 12:04:03] ~Daniyar: И + я напишу что не надо обновляться каждый год
[07.10.2025, 14:27:23] ~Daniyar: Виталя скинь инфо по operator AI
[07.10.2025, 14:27:33] ~Daniyar: я заводу по золоту скину
‎[07.10.2025, 14:28:04] Vitalii Kazymyrovych: ‎<attached: 00000783-PHOTO-2025-10-07-14-28-04.jpg>
[07.10.2025, 14:36:57] Vitalii Kazymyrovych: Мне нужно понять, что это за проект. Потому что у нас есть очень похожий проект в Казахстане с другим дисти. Как раз сегодня созвон был. 

Чтобы конфликта не вышло.
[07.10.2025, 14:41:47] ~Daniyar: ты был на встрече
[07.10.2025, 14:41:48] ~Daniyar: онлайн
[07.10.2025, 14:41:51] ~Daniyar: с заказчиком
[07.10.2025, 14:42:02] ~Daniyar: которому мы подсчитали квоту на 50 каналов ‎<This message was edited>
[07.10.2025, 14:42:11] Vitalii Kazymyrovych: А, это они
[07.10.2025, 14:42:32] ~Daniyar: я им письмо написал
[07.10.2025, 14:42:38] Vitalii Kazymyrovych: Зарегайте проект
[07.10.2025, 14:42:42] ~Daniyar: но у меня нет инфо по operator AI
[07.10.2025, 14:43:02] Vitalii Kazymyrovych: Так я тебе отправлял письмо
[07.10.2025, 14:43:40] ~Daniyar: нашел
‎[07.10.2025, 15:21:18] ~Daniyar: Прайс-лист_на_ПО (48).xls ‎document omitted
[07.10.2025, 15:21:18] ~Daniyar: https://macroscop.com/produkty/programma-dlya-ip-kamer
[07.10.2025, 15:21:18] ~Daniyar: макроскоп дает скидку до 30% от розницы
‎[07.10.2025, 15:21:50] ~Daniyar: ‎<attached: 00000798-AUDIO-2025-10-07-15-21-50.opus>
[07.10.2025, 15:29:03] Vitalii Kazymyrovych: Нет звука
‎[07.10.2025, 15:33:34] ~Daniyar: ‎<attached: 00000800-AUDIO-2025-10-07-15-33-34.opus>
[07.10.2025, 17:09:28] Vitalii Kazymyrovych: Что там с договорами?
[07.10.2025, 18:20:43] ~Daniyar: Завтра
‎[08.10.2025, 10:18:59] ~Daniyar: ‎<attached: 00000803-PHOTO-2025-10-08-10-18-59.jpg>
‎[08.10.2025, 10:18:59] ~Daniyar: ‎<attached: 00000804-PHOTO-2025-10-08-10-18-59.jpg>
[08.10.2025, 10:19:07] ~Daniyar: Прайс 2025 год
[08.10.2025, 10:19:11] ~Daniyar: Интеллект
[08.10.2025, 10:19:17] ~Daniyar: Axon
‎[08.10.2025, 11:02:32] ~Daniyar: ‎<attached: 00000808-PHOTO-2025-10-08-11-02-32.jpg>
[08.10.2025, 11:12:45] Vitalii Kazymyrovych: Отправили 30-го сентября
[08.10.2025, 11:13:06] Vitalii Kazymyrovych: Если нужно что-то еще, пусть напишут письмо
[08.10.2025, 11:17:22] ~Daniyar: в общем все соглсованно Олег и Хавьер в курсе
[08.10.2025, 11:17:28] ~Daniyar: ‎This message was deleted.
[08.10.2025, 11:26:04] ~Daniyar: ВИталя
‎[08.10.2025, 11:26:09] ~Daniyar: ‎<attached: 00000814-PHOTO-2025-10-08-11-26-09.jpg>
[08.10.2025, 11:26:22] ~Daniyar: это список который я когда-о продал в КЗ
[08.10.2025, 11:26:30] ~Daniyar: там на Майлстоне все размернуто
[08.10.2025, 11:26:35] ~Daniyar: хочу снести Майлтсон
[08.10.2025, 11:26:47] ~Daniyar: и поставить вашу VMS
[08.10.2025, 11:26:53] ~Daniyar: всего 35 каналов
[08.10.2025, 11:27:02] ~Daniyar: теперь вопрос
[08.10.2025, 11:27:16] ~Daniyar: подружим этот список видеоаналитике на вашей VMS
[08.10.2025, 11:27:23] ~Daniyar: какие трудности могут возникнуть*
[08.10.2025, 11:27:25] ~Daniyar: ?
[08.10.2025, 11:29:50] Vitalii Kazymyrovych: Motion Detection больше нет, а Hard Hat Detection еще нет в VMS
[08.10.2025, 11:30:19] Vitalii Kazymyrovych: FR и OD - без проблем
[08.10.2025, 11:31:21] ~Daniyar: ммм
[08.10.2025, 11:31:30] ~Daniyar: мы не сможем полноценно поменять VMS
[08.10.2025, 11:31:40] ~Daniyar: я им предложил миграцию
[08.10.2025, 11:31:49] ~Daniyar: что купите и не будете каждый год обновлять
[08.10.2025, 11:36:45] ~Daniyar: как Майлстон
[08.10.2025, 11:37:11] ~Daniyar: тогда не сможем мы заменить Майлстон
[08.10.2025, 11:37:15] ~Daniyar: (((
[08.10.2025, 11:41:48] Vitalii Kazymyrovych: Но
[08.10.2025, 11:42:00] Vitalii Kazymyrovych: Мы можем использовать Operator AI вместо HH
[08.10.2025, 11:42:02] Vitalii Kazymyrovych: Но
[08.10.2025, 11:42:18] Vitalii Kazymyrovych: Он слишком прожорливый, придется дорогущую карту покупать
[08.10.2025, 11:43:00] Vitalii Kazymyrovych: Пока нет. Работаем с тем, что есть. Не сейчас, так через год. Это ведь в долгую игра.
[08.10.2025, 11:59:41] ~Daniyar: Это был хороший момент чтобы заменить Майлстон
[08.10.2025, 11:59:51] ~Daniyar: Потому что они за парились обновляться каждый год
[08.10.2025, 12:00:10] ~Daniyar: Надо заходить туда где заказчик устал обновлять майлстон
‎[09.10.2025, 16:53:39] ~Daniyar: ‎<attached: 00000841-AUDIO-2025-10-09-16-53-39.opus>
[09.10.2025, 17:10:29] Vitalii Kazymyrovych: Привет
[09.10.2025, 17:10:38] Vitalii Kazymyrovych: То же самое, что с аналитиками
[09.10.2025, 17:10:47] Vitalii Kazymyrovych: Лицензия покупается один раз
[09.10.2025, 17:10:57] Vitalii Kazymyrovych: + один год обновлений бесплатно
[09.10.2025, 17:11:07] Vitalii Kazymyrovych: Если дальше захотят обновляться, придется доплачивать
[09.10.2025, 17:11:15] Vitalii Kazymyrovych: Но пользоваться могут без проблем
[09.10.2025, 17:13:07] ~Daniyar: Здесь по подробнее
[09.10.2025, 17:13:19] Vitalii Kazymyrovych: Наберу?
[09.10.2025, 17:13:26] ~Daniyar: Нет у меня зум
[09.10.2025, 17:13:31] ~Daniyar: Напиши лучше
[09.10.2025, 17:13:57] Vitalii Kazymyrovych: Ну, смотри, ты ставишь систему. И можешь получать обновления в течение первого года бесплатно. Это у нас называется Warranty.
[09.10.2025, 17:15:20] Vitalii Kazymyrovych: Дальше, если тебя устраивает функционал, ты можешь ничего не платить и пользоваться, пока не надоест. Но если вдруг тебе понадобится фича, которой нет в той версии системы, которая у тебя стоит, а срок Warranty уже истек, нужно будет заплатить 10% от стоимости проекта.
[09.10.2025, 17:27:58] Vitalii Kazymyrovych: Тогда сможешь еще в течение года получать обновления
[09.10.2025, 17:30:10] ~Daniyar: Ок👍🏻
[09.10.2025, 17:30:31] Vitalii Kazymyrovych: Но просто для использования платить больше ничего не нужно
[20.10.2025, 16:50:48] Vitalii Kazymyrovych: Привет
[20.10.2025, 16:50:51] Vitalii Kazymyrovych: Как дела?
[20.10.2025, 16:50:59] Vitalii Kazymyrovych: По этому проекту есть новости? KZ/Gem Technology/Tau-Ken Altyn LLP
‎[21.10.2025, 08:18:49] ~Daniyar: ‎<attached: 00000860-AUDIO-2025-10-21-08-18-49.opus>
[21.10.2025, 10:09:23] ~Daniyar: ВИталя Салам
[21.10.2025, 10:09:33] ~Daniyar: у нас встрече намечается  в Бишкеке
[21.10.2025, 10:09:58] ~Daniyar: заказчик ТД Куликовский производство кондитерских
[21.10.2025, 10:10:35] Vitalii Kazymyrovych: Ок
[21.10.2025, 10:10:47] Vitalii Kazymyrovych: Нужна помощь?
[21.10.2025, 10:10:52] ~Daniyar: на месте сразу производить контроль качества производства
[21.10.2025, 10:11:01] ~Daniyar: на вопрос что именно это значит
[21.10.2025, 10:11:06] ~Daniyar: попросили встречу снами
[21.10.2025, 10:11:08] ~Daniyar: для прояснения
[21.10.2025, 10:11:19] ~Daniyar: да думаю твоя помощь нужна
[21.10.2025, 10:11:24] ~Daniyar: так как Юра в отпуске
[21.10.2025, 10:11:35] ~Daniyar: тебе на завтра удобно?
[21.10.2025, 10:11:43] ~Daniyar: в 14-00
[21.10.2025, 10:11:46] ~Daniyar: по Алмате
[21.10.2025, 10:11:54] Vitalii Kazymyrovych: Да, норм
[21.10.2025, 10:12:03] Vitalii Kazymyrovych: Создай встречу
[21.10.2025, 10:12:05] ~Daniyar: ок напишу
[21.10.2025, 10:12:11] ~Daniyar: обязательно
[21.10.2025, 10:57:56] Vitalii Kazymyrovych: Раз Юра в отпуске, спрошу у тебя. Что по этим проектам? 

KG/Noventiq/GP UKUK
KZ/Power Engineering/Abay region Schools
[21.10.2025, 11:03:59] ~Daniyar: KG/Noventiq/GP UKUK
готовим камеры к отправке, ждем такси до Бишкека, как получат начанем пилот
[21.10.2025, 11:04:17] ~Daniyar: KZ/Power Engineering/Abay region Schools пилот прошел, сделаю апдейт
[21.10.2025, 11:06:37] ~Daniyar: узнал
[21.10.2025, 11:06:42] ~Daniyar: заложили бюджет
[21.10.2025, 11:06:46] ~Daniyar: на след.год
[21.10.2025, 11:06:52] ~Daniyar: начало 3 крватала
[21.10.2025, 11:07:03] Vitalii Kazymyrovych: ого
[21.10.2025, 11:07:04] Vitalii Kazymyrovych: понял
[21.10.2025, 11:09:21] Vitalii Kazymyrovych: то есть, по этому проекту до следующего года никакой активности?
[21.10.2025, 11:09:31] Vitalii Kazymyrovych: Какой бюджет?
[21.10.2025, 11:11:25] ~Daniyar: мы дали им расчет
[21.10.2025, 11:11:37] ~Daniyar: они заложили в бюджет на след год для тендера
[21.10.2025, 11:11:46] ~Daniyar: это гос
[21.10.2025, 11:12:02] Vitalii Kazymyrovych: тендер под нас делается или будут конкуренты?
[21.10.2025, 11:13:17] ~Daniyar: да будут конкуренты, чтобы не было лобирование
[21.10.2025, 11:13:21] ~Daniyar: но бует писать ТЗ
[21.10.2025, 11:26:08] Vitalii Kazymyrovych: ок
[22.10.2025, 13:36:33] ~Daniyar: Салам
‎[22.10.2025, 13:36:38] ~Daniyar: ‎<attached: 00000898-PHOTO-2025-10-22-13-36-38.jpg>
[22.10.2025, 13:37:34] Vitalii Kazymyrovych: Это бред
[22.10.2025, 13:37:36] Vitalii Kazymyrovych: Привет
[22.10.2025, 13:37:50] Vitalii Kazymyrovych: Даже новый модуль вряд-ли эту задачу закроет
[22.10.2025, 13:38:12] ~Daniyar: я тоже так написал
[29.10.2025, 10:53:14] Vitalii Kazymyrovych: Привет
[29.10.2025, 10:53:33] Vitalii Kazymyrovych: Можешь глянуть у себя в партнерском кабинете, есть ли проект ТЭС-Узбекистан
[29.10.2025, 10:53:39] Vitalii Kazymyrovych: DAAC регистрировал
[29.10.2025, 10:55:47] ~Daniyar: Привет
[29.10.2025, 10:55:59] ~Daniyar: Я на встрече
[29.10.2025, 10:56:11] ~Daniyar: Напиши Исмаила
[29.10.2025, 10:56:36] Vitalii Kazymyrovych: Ок
[31.10.2025, 11:03:42] ~Daniyar: Привет
[31.10.2025, 11:03:47] ~Daniyar: Есть запрос
[31.10.2025, 11:03:49] ~Daniyar: Какие сценарии мошенничества в филиале обычно детектируют

(можно брать как чек-лист для POC)
 • подозрительная передача наличных между сотрудниками вне кассы; частые «перемещения» денег в одну и ту же сумку/карман;
 • двое/больше сотрудников долго находятся позади одной кассы;
 • клиент и сотрудник проводят «быстрые» обмены предметов/конвертов;
 • длительное нахождение у банкомата/ATM с попыткой прикрепить скиммер/инструмент;
 • попытки перекрыть или заслонить камеру;
 • «stash and run» (оставил предмет, подошёл другой и унес);
 • необычно частые операции/входы одного пользователя в защищённую зону после закрытия.
(Все эти сценарии можно формализовать и настроить триггеры/правила.)
[31.10.2025, 11:03:52] Vitalii Kazymyrovych: Привет
[31.10.2025, 11:13:09] Vitalii Kazymyrovych: • двое/больше сотрудников долго находятся позади одной кассы;
 • длительное нахождение у банкомата/ATM с попыткой прикрепить скиммер/инструмент;
 • попытки перекрыть или заслонить камеру;
 • необычно частые операции/входы одного пользователя в защищённую зону после закрытия.

Вот эти вещи можем делать теоретически. Все остальное - сомнительно.
[31.10.2025, 13:12:48] Vitalii Kazymyrovych: Это не ломбард, случаем?
[31.10.2025, 13:13:24] ~Daniyar: Не знаю
[31.10.2025, 13:13:42] Vitalii Kazymyrovych: Просто у нас уже есть проект с очень похожими требованиями
[31.10.2025, 13:13:56] ~Daniyar: Через кого ?
[31.10.2025, 13:14:00] ~Daniyar: Страна ?
[31.10.2025, 13:15:28] Vitalii Kazymyrovych: Узбекистан ‎<This message was edited>
[31.10.2025, 13:15:56] ~Daniyar: Может быть
[03.11.2025, 09:21:21] Vitalii Kazymyrovych: Привет
[03.11.2025, 09:21:41] Vitalii Kazymyrovych: Давай внутренний созвон сделаем на этой неделе. Юра из отпуска вернулся?
[03.11.2025, 09:22:23] Vitalii Kazymyrovych: Завтра в 12 по Астане сможете?
[03.11.2025, 09:23:48] ~Daniyar: Привет
[03.11.2025, 09:23:55] ~Daniyar: В 12-00 не смогу
[03.11.2025, 09:24:01] ~Daniyar: Давай после обеда
[03.11.2025, 09:24:41] Vitalii Kazymyrovych: 15:00
[03.11.2025, 09:24:42] Vitalii Kazymyrovych: ? ‎<This message was edited>
[03.11.2025, 09:26:53] ~Daniyar: Да
[03.11.2025, 11:11:05] Vitalii Kazymyrovych: У вас там новый пилот с DAAC)
[03.11.2025, 11:11:18] Vitalii Kazymyrovych: Уже ставим систему клиенту на сервер)
[03.11.2025, 11:11:19] ~Daniyar: Да
[03.11.2025, 11:11:30] ~Daniyar: Да ты че
[03.11.2025, 11:11:39] Vitalii Kazymyrovych: 😅
[03.11.2025, 11:11:45] Vitalii Kazymyrovych: Держу в курсе)
[03.11.2025, 11:21:00] ~Daniyar: 😁
[04.11.2025, 09:16:17] ~Daniyar: Привет
[04.11.2025, 09:16:28] ~Daniyar: Сорри сегодня не успею на встречу
[04.11.2025, 09:16:38] ~Daniyar: Можем перенести ?
[04.11.2025, 09:16:43] ~Daniyar: Или без меня проведите ?
[04.11.2025, 12:00:28] Vitalii Kazymyrovych: Привет
[04.11.2025, 13:42:26] ~Daniyar: Виталя
[04.11.2025, 13:42:31] ~Daniyar: Хавьер с какого города?
[04.11.2025, 13:42:45] Vitalii Kazymyrovych: Из Барселоны
[04.11.2025, 13:43:15] ~Daniyar: ок
[04.11.2025, 13:43:22] ~Daniyar: Олег в Киеве?
[04.11.2025, 13:43:49] Vitalii Kazymyrovych: Ты спрашиваешь, где он сейчас или откуда он?
[04.11.2025, 13:43:56] ~Daniyar: где он сейчас
[04.11.2025, 13:44:01] ~Daniyar: подарочки готовим список
[04.11.2025, 13:44:19] Vitalii Kazymyrovych: Пока не знаю, он постоянно катается
[04.11.2025, 13:44:43] Vitalii Kazymyrovych: Живет в Виннице, вообще, но постоянно в поездках
[04.11.2025, 13:45:18] ~Daniyar: ну ок
[04.11.2025, 13:45:20] ~Daniyar: напишу Киев
[04.11.2025, 14:44:15] ~Daniyar: Завод NDa подписал
[04.11.2025, 14:44:27] ~Daniyar: Запрашивать у них видео ?
[04.11.2025, 18:31:57] Vitalii Kazymyrovych: Давай
[12.11.2025, 09:41:52] ~Daniyar: Привет
[12.11.2025, 09:41:55] ~Daniyar: как дела?
[12.11.2025, 09:42:04] ~Daniyar: с Daac на встрече
[12.11.2025, 16:27:30] Vitalii Kazymyrovych: Привет. Порядок.
[12.11.2025, 16:27:36] Vitalii Kazymyrovych: Привет передавай
[12.11.2025, 16:29:42] ~Daniyar: Олег в Молдавии
[12.11.2025, 16:29:51] ~Daniyar: С директором встретились
[12.11.2025, 16:29:55] ~Daniyar: Старый наш знакомый
[13.11.2025, 12:16:04] Vitalii Kazymyrovych: Привет
[13.11.2025, 12:16:12] Vitalii Kazymyrovych: Ответь на письмо от Ксавьера
[13.11.2025, 12:26:10] ~Daniyar: привет
[13.11.2025, 12:26:13] ~Daniyar: на встрече
[13.11.2025, 12:26:27] ~Daniyar: после выйду и напишу
[17.11.2025, 12:29:28] Vitalii Kazymyrovych: Привет. Ксавьер хочет звонок. Будет время сегодня ?
[17.11.2025, 12:54:19] ~Daniyar: Привет
[17.11.2025, 12:54:21] ~Daniyar: Да давай
[17.11.2025, 12:54:25] ~Daniyar: Через 10 мин
[24.11.2025, 08:07:34] ~Daniyar: Виталя салам
[24.11.2025, 08:07:41] ~Daniyar: есть инфо по банкам
[24.11.2025, 08:07:47] ~Daniyar: презу я скачал
[24.11.2025, 08:07:58] ~Daniyar: на встрече с Хавьером
[24.11.2025, 08:08:08] ~Daniyar: он говорил про АТМ и камеры пинхол
[24.11.2025, 08:08:14] ~Daniyar: какая там видеоаналитика была
[24.11.2025, 08:08:16] ~Daniyar: ?
[24.11.2025, 09:07:18] Vitalii Kazymyrovych: Привет
[24.11.2025, 09:08:13] Vitalii Kazymyrovych: Точно не помню, но по логике, это FR может быть. Или OD.
[24.11.2025, 09:08:31] ~Daniyar: ок
[24.11.2025, 09:08:37] ~Daniyar: у нас запрос по банкам
[24.11.2025, 09:08:50] ~Daniyar: скинул им презу
[24.11.2025, 09:08:56] ~Daniyar: есть саксесс стори по банкам
[24.11.2025, 09:22:09] Vitalii Kazymyrovych: Публичных нет
[24.11.2025, 09:22:54] Vitalii Kazymyrovych: Но у нас сейчас крупнейший проект в Мексике с банком. У них 2000 филиалов. VMS + куча аналитик. Могу подробности на звонке рассказать.
[24.11.2025, 09:23:28] Vitalii Kazymyrovych: + функционал POS терминалов в VMS. Разработан как раз для банка.
[24.11.2025, 09:27:10] ~Daniyar: я сейчас скину инфо
[24.11.2025, 09:27:13] ~Daniyar: и предложу встречу
[24.11.2025, 09:27:19] ~Daniyar: на встречу можно удет рассказать
[24.11.2025, 09:28:36] Vitalii Kazymyrovych: Гуд
[24.11.2025, 13:09:48] ~Daniyar: на завтра встречу планиурем
[24.11.2025, 13:09:51] ~Daniyar: ты сможешь?
[24.11.2025, 13:09:58] ~Daniyar: после обеда
[24.11.2025, 13:10:10] ~Daniyar: в 15-00 удобно по Алмате
[24.11.2025, 16:13:56] Vitalii Kazymyrovych: Давай
[25.11.2025, 12:54:56] ~Daniyar: https://sts.kz/kz/nsvm
[25.11.2025, 12:55:00] ~Daniyar: так для инфо
[28.11.2025, 12:19:59] ~Daniyar: Виталя привет
[28.11.2025, 12:20:05] ~Daniyar: а в банках Мексике FR используют?
[28.11.2025, 18:53:24] Vitalii Kazymyrovych: Привет, да.
[28.11.2025, 19:55:06] ~Daniyar: Надо больше инфо по банкам
[28.11.2025, 19:55:11] ~Daniyar: Для Узбекистана
[01.12.2025, 12:09:14] Vitalii Kazymyrovych: Привет
[01.12.2025, 12:09:19] Vitalii Kazymyrovych: Какой именно инфы?
[01.12.2025, 12:12:04] ~Daniyar: Привет
[01.12.2025, 12:12:07] ~Daniyar: Все уже скинул
[08.12.2025, 09:17:53] ~Daniyar: Привет
[08.12.2025, 09:18:01] ~Daniyar: Как дела ?
[08.12.2025, 09:18:21] ~Daniyar: По Узбекистану запрос по банкам
[08.12.2025, 09:18:24] ~Daniyar: Надо обсудить
[08.12.2025, 09:18:44] ~Daniyar: Заказчику надо ГБ в Ташкенте оснастить видео аналитикой
[08.12.2025, 10:25:23] Vitalii Kazymyrovych: Привет
[08.12.2025, 10:25:36] Vitalii Kazymyrovych: Давай организуем звонок вечером
[08.12.2025, 10:25:39] ~Daniyar: Также есть проект
[08.12.2025, 10:25:42] Vitalii Kazymyrovych: Ну, вашим вечером.
[08.12.2025, 10:25:46] ~Daniyar: Думаю предложить туда VMs
[08.12.2025, 10:25:54] Vitalii Kazymyrovych: Пройдемся по всем проектам
[08.12.2025, 10:26:07] ~Daniyar: Вечером не могу, давай на 15-00
[08.12.2025, 11:33:25] ~Daniyar: Виталя давай завтра
[08.12.2025, 11:33:32] ~Daniyar: Юра на удаленке
[08.12.2025, 11:33:34] ~Daniyar: болеет
[08.12.2025, 11:33:57] ~Daniyar: Исмаил после отпуска разгрибает висяки
[08.12.2025, 11:34:07] ~Daniyar: завтра на 14-00 оК?
[08.12.2025, 11:34:11] ~Daniyar: по Алматы
[08.12.2025, 11:34:27] Vitalii Kazymyrovych: Давай завтра
[08.12.2025, 11:34:31] Vitalii Kazymyrovych: 14:00 ок
[08.12.2025, 11:34:44] ~Daniyar: ок ждем  приглашалку
[08.12.2025, 11:34:50] ~Daniyar: как раз обсудим 2 новых проекта
[08.12.2025, 11:35:28] Vitalii Kazymyrovych: Скинул
[09.12.2025, 12:04:07] Vitalii Kazymyrovych: ‎Voice call  ‎No answer
[09.12.2025, 12:04:42] Vitalii Kazymyrovych: Набери по возможности 2 момента еще хотел проговорить
[09.12.2025, 12:16:27] ~Daniyar: ‎Voice call  ‎7 min
[11.12.2025, 10:51:14] ~Daniyar: Вит салам
[11.12.2025, 10:51:18] ~Daniyar: Как дела?
[11.12.2025, 10:51:26] ~Daniyar: Есть инфо по моему запросу
[11.12.2025, 11:42:38] Vitalii Kazymyrovych: Привет
[11.12.2025, 11:42:42] Vitalii Kazymyrovych: В мыле
[11.12.2025, 11:42:51] Vitalii Kazymyrovych: Ответил на твое письмо
[11.12.2025, 11:44:49] ~Daniyar: Ок
[15.12.2025, 14:30:00] ~Daniyar: Вит Салам
[15.12.2025, 14:30:01] ~Daniyar: как дела?
[15.12.2025, 14:30:09] ~Daniyar: динамик к VMS можем подключить? ‎<This message was edited>
[15.12.2025, 15:47:40] Vitalii Kazymyrovych: Привет
[15.12.2025, 15:48:13] Vitalii Kazymyrovych: Дела в порядке. Насколько это возможно в конце года😅
[15.12.2025, 15:48:49] Vitalii Kazymyrovych: Ну, на динамик камеры мы точно звук можем передавать
[15.12.2025, 15:54:45] ~Daniyar: https://www.axis.com/dam/public/permalink/158323/ebrochure--why-choose-axis-network-audio-en-US_158323.pdf
[15.12.2025, 15:55:03] ~Daniyar: В камере динамик не пойдет
[15.12.2025, 15:55:11] ~Daniyar: Нужен полноценный спикер
[15.12.2025, 15:55:31] Vitalii Kazymyrovych: Уточню
[15.12.2025, 18:44:44] Vitalii Kazymyrovych: Не, такого функционала нет
[15.12.2025, 18:46:29] Vitalii Kazymyrovych: Если клиент готов платить за разработку, можем сделать
[09.01.2026, 13:03:53] Vitalii Kazymyrovych: Привет. Свободен?
[09.01.2026, 13:07:37] ~Daniyar: Привет
[09.01.2026, 13:07:38] ~Daniyar: Да
[09.01.2026, 13:09:02] Vitalii Kazymyrovych: ‎Group call  ‎2 invited
‎[13.01.2026, 09:31:39] ~Daniyar: ‎<attached: 00001060-AUDIO-2026-01-13-09-31-39.opus>
